Text,Created Date,Language,Retweet Count,Retweeted,Favorite Count,Favorited,co-ordinates,Tweeted By,Screen Name
"RT @astrodigitalgeo: We're in Moscow at the SOVZOND partner conference-DM if you're in the neighbourhood.
https://t.co/g6KNXPqujq",Thu Apr 14 22:54:17 +0000 2016,en,2,False,0,False,,Mikhail Kokorich,Mkokorich
"Полет мысли, любознательность, мечты - то что отличает нас как биологический вид. Было очевидно, что человечество... https://t.co/qctmaBhRWQ",Thu Apr 14 03:36:50 +0000 2016,ru,1,False,1,False,,Mikhail Kokorich,Mkokorich
Yet today there is a need for a new economic model — one that is responsive and agile — to govern civil and... https://t.co/GD0f5K8Q31,Mon Apr 11 16:16:16 +0000 2016,en,0,False,3,False,,Mikhail Kokorich,Mkokorich
https://t.co/Ads2Kw3PYu,Sun Apr 10 04:52:30 +0000 2016,und,0,False,0,False,,Mikhail Kokorich,Mkokorich
"Казалось бы, россияне из списка Forbes наверняка должны любить космос, хотя бы потому, что учились в советских... https://t.co/lQKfVcKIzx",Sun Apr 10 01:59:52 +0000 2016,ru,0,False,0,False,,Mikhail Kokorich,Mkokorich
RT @SpaceX: Onboard view of landing in high winds https://t.co/FedRzjYYyQ,Sat Apr 09 02:03:36 +0000 2016,en,21633,False,0,False,,Mikhail Kokorich,Mkokorich
"RT @ericg: an old Lockheed P-3 Orion anti-submarine hunter, parked down at Moffett Field https://t.co/TKbZIpybF5",Sat Apr 09 02:01:19 +0000 2016,en,1,False,0,False,,Mikhail Kokorich,Mkokorich
In the old NASA Ames garage @astrodigitalgeo is building monitoring system for precision land use https://t.co/M2ZcbFwuW7,Fri Apr 08 23:28:04 +0000 2016,en,1,False,2,False,,Mikhail Kokorich,Mkokorich
"10 birds with such a camera will be capable to image entire landmass daily!
 https://t.co/5P3Zb5QOYv",Fri Apr 08 23:26:35 +0000 2016,en,0,False,2,False,,Mikhail Kokorich,Mkokorich
It is awesome! low cost launches are opening new horizons for space business! https://t.co/PUzUQ3Rrpz,Fri Apr 08 23:24:27 +0000 2016,en,0,False,1,False,,Mikhail Kokorich,Mkokorich
RT @ericg: Cause it's 2016 and you can transport a micro-satellite via @lyft (Ka band transmitter in my left hand= wicked fast) https://t.c…,Tue Apr 05 14:37:45 +0000 2016,en,13,False,0,False,,Mikhail Kokorich,Mkokorich
The Growing Ecosystem of Satellite Imagery for Ag - AgFunderNews https://t.co/BgrYvNsqDk,Fri Apr 01 06:21:19 +0000 2016,en,1,False,1,False,,Mikhail Kokorich,Mkokorich
"RT @astrodigitalgeo: See roads, buildings and life in Dubai with stunning images from @esa #Sentinel mission https://t.co/KnsRccWoFk https:…",Thu Mar 31 12:33:02 +0000 2016,en,1,False,0,False,,Mikhail Kokorich,Mkokorich
RT @Mr_Chris_Biddy: The team is working late preparing a Landmapper-BC satellite for some testing tomorrow @astrodigitalgeo https://t.co/UN…,Thu Mar 31 12:32:37 +0000 2016,en,3,False,0,False,,Mikhail Kokorich,Mkokorich
Astro Digital was featured in Mercury News https://t.co/uXK7PRBHZe,Thu Mar 24 17:57:09 +0000 2016,en,0,False,0,False,,Mikhail Kokorich,Mkokorich
Astro Digital in the World Agri-Tech Investment Summit https://t.co/o8X7q67ou4,Tue Mar 22 17:46:38 +0000 2016,en,1,False,1,False,,Mikhail Kokorich,Mkokorich
"Nice mentioning of Astro Digital in Mercury News article about Silicon Valley's space startup boom.

""Nearby,... https://t.co/tmaHvlRc3a",Mon Mar 21 13:41:23 +0000 2016,en,0,False,0,False,,Mikhail Kokorich,Mkokorich
"My followers live in 21 countries: Russia(43%), USA(34%)... https://t.co/3f7ohsAUk0
Get your free map! https://t.co/tGVKDWHR4r",Sat Mar 19 06:09:14 +0000 2016,en,0,False,0,False,,Mikhail Kokorich,Mkokorich
"Я абсолютно согласен с Митрополитом Илларионом, о том, что нет оправдания как Сталину. Люди, которые несут цветы... https://t.co/orS6mTl8vB",Sun Mar 06 03:28:42 +0000 2016,ru,0,False,0,False,,Mikhail Kokorich,Mkokorich
"My followers are in Russia(43%), USA(33%)... Get your map too: https://t.co/3f7ohsAUk0 https://t.co/i9umZL4FXU",Sat Mar 05 06:35:51 +0000 2016,en,0,False,0,False,,Mikhail Kokorich,Mkokorich
ЦОЙ ЖИВ! https://t.co/HwHKinl1es,Sat Mar 05 06:07:53 +0000 2016,ru,0,False,0,False,,Mikhail Kokorich,Mkokorich
Платформа бесплатно анализирует спутниковые изображения https://t.co/XFUpLDLk4H,Sat Feb 27 13:13:39 +0000 2016,ru,0,False,1,False,,Mikhail Kokorich,Mkokorich
+++ https://t.co/9AZ4GLGpq7,Sat Feb 27 13:12:38 +0000 2016,und,0,False,0,False,,Mikhail Kokorich,Mkokorich
RT @developmentseed: Test drive the new @astrodigitalgeo imagery browser at https://t.co/aRMBPNGaFY https://t.co/WtoYhiE4l4 https://t.co/Ab…,Thu Feb 25 23:36:57 +0000 2016,en,4,False,0,False,,Mikhail Kokorich,Mkokorich
RT @TechCrunch: Astro Digital releases platform for anyone to analyze satellite imagery https://t.co/pHbIqBlBUM https://t.co/NkhB4VfEkw,Thu Feb 25 23:36:38 +0000 2016,en,85,False,0,False,,Mikhail Kokorich,Mkokorich
RT @astrodigitalgeo: @planetlabs @ericg @DigitalGlobe @SpireGlobal @SpaceX @Mapbox agreed. No dash. https://t.co/sPUS4nvoZE,Thu Feb 25 23:36:30 +0000 2016,en,2,False,0,False,,Mikhail Kokorich,Mkokorich
RT @astrodigitalgeo: Getting ready to launch! https://t.co/oZSPlb4gWl https://t.co/dTUoJXrIJj,Thu Feb 25 23:35:56 +0000 2016,en,5,False,0,False,,Mikhail Kokorich,Mkokorich
So cool! Astro Digital Platform v.2 is featured in TechCrunch. https://t.co/1doAdcYSWB,Wed Feb 24 23:53:43 +0000 2016,en,0,False,1,False,,Mikhail Kokorich,Mkokorich
"Получайте миллионы спутниковых снимков за секунды

Чтобы заказать снимки обычно мы должны выбирать с десяток... https://t.co/dJc6eHuKYh",Sat Feb 20 02:58:57 +0000 2016,ru,1,False,1,False,,Mikhail Kokorich,Mkokorich
RT @astrodigitalgeo: Thank you @AWS_Gov! Your support for #Landsat has been a game changer for us. https://t.co/evTsIGP825,Fri Feb 19 04:45:49 +0000 2016,en,1,False,0,False,,Mikhail Kokorich,Mkokorich
I was several times in steps with tape forest - always amazing phenomena  https://t.co/yc9mKvsXF0,Fri Feb 19 04:45:35 +0000 2016,en,1,False,0,False,,Mikhail Kokorich,Mkokorich
I posted a new video to Facebook https://t.co/wdWGbqi69l,Sun Feb 14 05:46:35 +0000 2016,en,0,False,0,False,,Mikhail Kokorich,Mkokorich
"Wonderful day for flight;) 
Probably the best view to San Francisco Bay it is from the plan transitioning over Oakland airport.",Thu Feb 11 00:27:47 +0000 2016,en,0,False,1,False,,Mikhail Kokorich,Mkokorich
The Luxembourg Ministry of the Economy announced the first government initiative in Europe to develop a legal and... https://t.co/IDOBTM35Vv,Tue Feb 09 02:26:08 +0000 2016,en,0,False,0,False,,Mikhail Kokorich,Mkokorich
Проходит финальная сборка интеграция спутников группировки Landmapper -  https://t.co/RxDtYFmnGZ. https://t.co/FPOUk7dmqq,Sun Feb 07 05:31:55 +0000 2016,ru,1,False,1,False,,Mikhail Kokorich,Mkokorich
https://t.co/ektPMliIrE,Fri Jan 29 01:55:52 +0000 2016,und,0,False,0,False,,Mikhail Kokorich,Mkokorich
A few years ago young Russian scientists were doing research in atmospheric physics when they realized it's... https://t.co/gJyoQxY4Bh,Thu Jan 21 10:06:22 +0000 2016,en,0,False,0,False,,Mikhail Kokorich,Mkokorich
RT @Mr_Chris_Biddy: Eagerly awaiting tomorrow's launch! https://t.co/fE32vet6Dz,Sun Jan 17 16:27:24 +0000 2016,en,1,False,0,False,,Mikhail Kokorich,Mkokorich
"“Two satellites, 18 hours, and a GoPro” by @astrodigitalgeo https://t.co/tWiFVFFdSR",Fri Jan 15 05:26:26 +0000 2016,en,0,False,1,False,,Mikhail Kokorich,Mkokorich
Case Study: Astro Digital – DropCam for Space https://t.co/RiZw4jzpEt,Thu Jan 14 19:40:55 +0000 2016,en,0,False,1,False,,Mikhail Kokorich,Mkokorich
RT @getiron: Case Study: @astrodigitalgeo – DropCam for Space  https://t.co/GFDiFBOKUe https://t.co/uwN3INAUPP,Thu Jan 14 17:58:15 +0000 2016,en,3,False,0,False,,Mikhail Kokorich,Mkokorich
"RT @astrodigitalgeo: Two satellites, 18 hours, and a GoPro https://t.co/6KQx7Bj9WJ https://t.co/7ntzlzYcMu",Thu Jan 14 16:58:04 +0000 2016,en,11,False,0,False,,Mikhail Kokorich,Mkokorich
New capabilities in Astro Digital platform. You could download processed map and play with it in Mapbox studio. https://t.co/zyB21TyfRA,Tue Jan 05 22:58:45 +0000 2016,en,1,False,2,False,,Mikhail Kokorich,Mkokorich
"Очень актуальное и правильное интервью от Vadim Lukashevich.
Вадим - спасибо за интервью и за поддержку частного... https://t.co/DMRzuinUVD",Wed Dec 23 11:40:51 +0000 2015,ru,0,False,1,False,,Mikhail Kokorich,Mkokorich
"Обычно лётные испытания заканчиваются  за пару тройку месяцев, но в случае с первыми аппаратами они продлились... https://t.co/YKgBZg9aQq",Wed Dec 23 09:25:34 +0000 2015,ru,0,False,1,False,,Mikhail Kokorich,Mkokorich
So huge! https://t.co/QgYE3VAl27,Tue Dec 22 04:21:00 +0000 2015,en,0,False,1,False,,Mikhail Kokorich,Mkokorich
I posted a new photo to Facebook https://t.co/nTwO6Fs3HQ,Tue Dec 22 03:25:41 +0000 2015,en,0,False,0,False,,Mikhail Kokorich,Mkokorich
I posted a new photo to Facebook https://t.co/a5eNMKXeeM,Tue Dec 22 02:23:43 +0000 2015,en,0,False,0,False,,Mikhail Kokorich,Mkokorich
I posted a new photo to Facebook https://t.co/TVw8clXKOS,Tue Dec 22 02:23:42 +0000 2015,en,0,False,0,False,,Mikhail Kokorich,Mkokorich
"I posted 2 photos on Facebook in the album ""Space-X just made a history!"" https://t.co/e8PQTTR0pK",Tue Dec 22 02:10:02 +0000 2015,en,1,False,1,False,,Mikhail Kokorich,Mkokorich
"I posted 4 photos on Facebook in the album ""Space-X just made a history!"" https://t.co/kFZZEI8VG4",Tue Dec 22 01:53:23 +0000 2015,en,0,False,0,False,,Mikhail Kokorich,Mkokorich
ST Electronics is a nice example of successful state investment into small satellite area. Singapore is attacking... https://t.co/pArKwWHa88,Wed Dec 16 00:36:38 +0000 2015,en,0,False,1,False,,Mikhail Kokorich,Mkokorich
https://t.co/YkI8Erlohq,Tue Dec 15 23:52:43 +0000 2015,und,0,False,0,False,,Mikhail Kokorich,Mkokorich
RT @astrodigitalgeo: Smoke from the North drifting over Delhi creating poor air quality conditions https://t.co/Qrmzc5Ccqe #Landsat https:/…,Thu Dec 10 08:08:57 +0000 2015,en,3,False,0,False,,Mikhail Kokorich,Mkokorich
https://t.co/y2KLfSvZ0N,Mon Nov 30 05:47:11 +0000 2015,und,0,False,0,False,,Mikhail Kokorich,Mkokorich
Зачёт;) https://t.co/jaPSgBRVS4,Sat Nov 28 06:10:28 +0000 2015,ru,0,False,0,False,,Mikhail Kokorich,Mkokorich
RT @astrodigitalgeo: 30 Satellite Landmapper Constellation Preps for Near Term Launch https://t.co/F15GeuqqRE https://t.co/xNZZg2zSkR,Sat Nov 21 23:41:03 +0000 2015,en,6,False,0,False,,Mikhail Kokorich,Mkokorich
https://t.co/lpWf5jA2qr,Sat Nov 21 06:56:16 +0000 2015,und,0,False,0,False,,Mikhail Kokorich,Mkokorich
Ха! - Известия окончательно превратились в желтую газетенку https://t.co/LzXur7CBgY,Wed Nov 18 18:44:26 +0000 2015,ru,0,False,0,False,,Mikhail Kokorich,Mkokorich
Two weeks ago our team attended Open Government Partnership (OGP) Summit in Mexico City. Open geodata is a theme... https://t.co/URNuIefgWu,Wed Nov 18 05:28:41 +0000 2015,en,0,False,0,False,,Mikhail Kokorich,Mkokorich
"На первый взгляд, на старой фотографии довоенного времени запечатлена обычная картина – лето, сенокосчики в... https://t.co/IpoOEO5hSd",Sat Nov 14 16:28:07 +0000 2015,ru,0,False,0,False,,Mikhail Kokorich,Mkokorich
"Astro Digital won a Naviterra competition

Проект Astro Digital выиграл конкурс Навитерра -... https://t.co/gtZbcYrNgJ",Tue Nov 03 02:00:03 +0000 2015,und,0,False,0,False,,Mikhail Kokorich,Mkokorich
"RT @astrodigitalgeo: What does a longer, colder winter in Russia mean for the potato harvest? https://t.co/qJWTUpcIo5 http://t.co/IVA94gbyaa",Sat Oct 10 22:14:15 +0000 2015,en,4,False,0,False,,Mikhail Kokorich,Mkokorich
Sad story of Aral Sea is a outcome of feckless usage of water from Amu Darya and Syr Darya for irrigation of cotton. https://t.co/N3nBRzN8eX,Thu Oct 08 00:06:12 +0000 2015,en,1,False,1,False,,Mikhail Kokorich,Mkokorich
"RT @developmentseed: Open blueprints, code &amp; knowledge. Building open aerospace w/ @AquilaSpace &amp; @astrodigitalgeo https://t.co/TS8hEOFFmI …",Wed Oct 07 18:41:18 +0000 2015,en,8,False,0,False,,Mikhail Kokorich,Mkokorich
RT @gufalei: #BeloMonte dam in Amazonia:  #dataviz using @NASA_Landsat  with @astrodigitalgeo design http://t.co/fjMnyF9GJS #ddj http://t.c…,Wed Oct 07 18:38:58 +0000 2015,en,14,False,0,False,,Mikhail Kokorich,Mkokorich
RT @astrodigitalgeo: The scene was large piles of wood &amp; devastated river islands #belomonte http://t.co/BQCzPtX2gu @gufalei http://t.co/Ve…,Wed Oct 07 18:38:54 +0000 2015,en,5,False,0,False,,Mikhail Kokorich,Mkokorich
"RT @astrodigitalgeo: @developmentseed so proud of the work we're doing together, making data from space open and accessible. @AquilaSpace",Wed Oct 07 18:38:42 +0000 2015,en,1,False,0,False,,Mikhail Kokorich,Mkokorich
"В августе 2015 г. The New York Times опубликовала список из 50 компаний, которые могут стать следующими... http://t.co/TenHkrl5Mw",Tue Oct 06 22:39:10 +0000 2015,ru,0,False,1,False,,Mikhail Kokorich,Mkokorich
"RT @astrodigitalgeo: At #WSBW, find @bronwynagrios and @katelengold to talk developer tools for satellite imagery. http://t.co/kLXGWz59Ef",Sat Sep 19 07:52:54 +0000 2015,en,1,False,0,False,,Mikhail Kokorich,Mkokorich
Famous watergate building) http://t.co/0HSgYCdSZK,Thu Aug 27 17:41:40 +0000 2015,en,0,False,0,False,,Mikhail Kokorich,Mkokorich
"Under the solar sail!  ""I can't control the wind, but I can adjust the sail."" Ricky Skaggs http://t.co/wIoscwKZPe",Tue Aug 25 23:23:17 +0000 2015,en,0,False,1,False,,Mikhail Kokorich,Mkokorich
"Draper university is the new type of startup accelerator, enhancing creativity of attendants http://t.co/dAXj10nT8m",Tue Aug 25 19:07:11 +0000 2015,en,0,False,0,False,,Mikhail Kokorich,Mkokorich
Skolkovo EMBA in Palo Alto. Anxious day for the Russian economy in a very calm environment) http://t.co/JHhGwykrlz,Tue Aug 25 01:40:09 +0000 2015,en,0,False,0,False,,Mikhail Kokorich,Mkokorich
"Это конечно чудо, что среди пассажиров были два американца, которые безоружными обезвредили террориста. Сложно... http://t.co/zIoE8IpN2d",Sat Aug 22 04:08:36 +0000 2015,ru,0,False,0,False,,Mikhail Kokorich,Mkokorich
RT @_peripatetic_: That was too easy. Grabbed a quick sat image of Khone Falls using @astrodigitalgeo -- can't wait to go in October. https…,Wed Aug 19 04:58:58 +0000 2015,en,3,False,0,False,,Mikhail Kokorich,Mkokorich
Real-Time Satellite Alerts http://t.co/Usuw95b4Oz,Tue Aug 18 00:39:02 +0000 2015,en,0,False,0,False,,Mikhail Kokorich,Mkokorich
"RT @ianschuler: If you geek out on slick interfaces to interact with geodata, immediately hit up @astrodigitalgeo for beta access http://t.…",Mon Aug 17 18:55:12 +0000 2015,en,3,False,0,False,,Mikhail Kokorich,Mkokorich
“You can now get alerts in real-time when new satellite imagery is collected over any area you…” — @astrodigitalgeo https://t.co/3SXlpmjGy2,Mon Aug 17 18:10:11 +0000 2015,en,0,False,1,False,,Mikhail Kokorich,Mkokorich
You can now get alerts in real-time when new satellite imagery is collected over any area you set to monitor.... http://t.co/MKjL7qpjm4,Mon Aug 17 18:03:03 +0000 2015,en,0,False,0,False,,Mikhail Kokorich,Mkokorich
Forest fires is one of the most devastating natural events.  https://t.co/5t2bNu3fZC,Sat Aug 15 14:38:32 +0000 2015,en,0,False,0,False,,Mikhail Kokorich,Mkokorich
"Очень интересная, почти детективная история открытия разлома Каскадия, который угрожает северо-западу США. Один... http://t.co/sGuIdFnNLQ",Sat Aug 15 12:46:49 +0000 2015,ru,0,False,0,False,,Mikhail Kokorich,Mkokorich
Новый ресурс для информации о космосе и космических технологиях) http://t.co/rW2I9q36rw,Tue Aug 11 08:12:14 +0000 2015,ru,1,False,0,False,,Mikhail Kokorich,Mkokorich
"Check out @DownlinkSpace, where space fans discover, share, and discuss the day's top #space stories! https://t.co/rkMNyEbxR0",Tue Aug 11 08:11:17 +0000 2015,en,1,False,1,False,,Mikhail Kokorich,Mkokorich
"Ну как это все можно спокойно воспринимать? Когда мы превратились в страну победившего мракобесия?
""Ирод послал... http://t.co/8dcpILNsrV",Sat Aug 08 22:46:16 +0000 2015,ru,0,False,1,False,,Mikhail Kokorich,Mkokorich
Откуда столько агрессии? На мир вообще и на Украину в частности? На какую такую мозоль наступлено россиянам и... http://t.co/GapsJQCXFR,Tue Jul 14 19:53:20 +0000 2015,ru,0,False,0,False,,Mikhail Kokorich,Mkokorich
"Леонид, замечательная работа! http://t.co/yotwi90Tmc",Mon Jul 06 00:23:00 +0000 2015,ru,0,False,0,False,,Mikhail Kokorich,Mkokorich
"О моих отношениях с западными фондами
В начале 90-х годов, программа Соросовский студент мне позволила год... http://t.co/duSLNUZIKd",Sun Jun 28 21:39:08 +0000 2015,ru,0,False,0,False,,Mikhail Kokorich,Mkokorich
Прошел первый год эксплуатации КА Perseus-M. Годовщину встречаем в полностью рабочем состоянии - все системы в... http://t.co/A7nBBUjgjc,Wed Jun 24 18:41:16 +0000 2015,ru,1,False,0,False,,Mikhail Kokorich,Mkokorich
Participating in SVOD conference. http://t.co/3M7x7uTs8z,Wed Jun 10 16:42:21 +0000 2015,cs,0,False,0,False,,Mikhail Kokorich,Mkokorich
RT @developmentseed: Every Landsat scene published on @astrodigitalgeo platform will be directly contributed to #OpenAerialMap https://t.co…,Wed Jun 10 00:03:59 +0000 2015,en,9,False,0,False,,Mikhail Kokorich,Mkokorich
The Spark app just launched on iOS!! Discover what's happening nearby with @SparkNearby https://t.co/CugLqFgWb4,Mon May 25 06:02:11 +0000 2015,en,1,False,1,False,,Mikhail Kokorich,Mkokorich
I am with Khan in Beijing http://t.co/Z8Upas81iz,Thu May 21 00:34:25 +0000 2015,en,0,False,0,False,,Mikhail Kokorich,Mkokorich
"Я бы добавил еще то, что наличие частных компаний в отрасли стимулирует появление новых технологий, направленных... http://t.co/rnjZk7S5Oy",Sat May 16 23:06:18 +0000 2015,ru,0,False,0,False,,Mikhail Kokorich,Mkokorich
"RT @pbdes: ILS Proton failure is loss for Mexico &amp; for Inmarsat, next in Proton launch queue; reinforces Ariane-SpaceX duopoly. http://t.co…",Sat May 16 19:39:27 +0000 2015,en,36,False,0,False,,Mikhail Kokorich,Mkokorich
Victory day in the capital of Siberia http://t.co/PiVpfyJY2j,Fri May 08 23:02:59 +0000 2015,en,0,False,0,False,,Mikhail Kokorich,Mkokorich
The Spark app just launched on iOS!! Discover what's happening nearby with @SparkNearby https://t.co/CugLqFgWb4,Wed May 06 13:36:35 +0000 2015,en,1,False,1,False,,Mikhail Kokorich,Mkokorich
Rocket science http://t.co/rrkM9XznBi,Wed Apr 22 21:07:14 +0000 2015,en,0,False,2,False,,Mikhail Kokorich,Mkokorich
Amazing virtual tour into the history of New York http://t.co/r36Bf4iM5B,Wed Apr 22 14:27:07 +0000 2015,en,1,False,0,False,,Mikhail Kokorich,Mkokorich
"Доверие - самая чувствительная часть связывающая людей
 https://t.co/W9Oo2QlMhg",Wed Apr 15 19:37:24 +0000 2015,ru,0,False,0,False,,Mikhail Kokorich,Mkokorich
"RT @tvrain: В эфире ПАНФИЛОВА. В гостях журналист и основатель клуба частных пилотов Анастасия Дагаева:
http://t.co/SSW9gEjs9r http://t.co/…",Wed Apr 15 15:08:10 +0000 2015,ru,4,False,0,False,,Mikhail Kokorich,Mkokorich
"Nathan Kundtz стал новым CEO компании Kymeta. Мы познакомились с Натаном два года назад, когда о нем никто еще... http://t.co/Z1AEapcf3j",Wed Apr 15 08:29:38 +0000 2015,ru,1,False,0,False,,Mikhail Kokorich,Mkokorich
"Центр Хруничева отказался делать систему «Обзор-О»

Мои комментарии Известиям по ситуации:

— Система «Обзор-О»... http://t.co/qjsj0JowXY",Tue Apr 14 06:26:08 +0000 2015,ru,1,False,0,False,,Mikhail Kokorich,Mkokorich
В тему про предыдущую новость про привлечение дополнительных средств от IFC самым заметным игроком... http://t.co/o1SMetaP9x,Tue Apr 14 06:12:38 +0000 2015,ru,0,False,1,False,,Mikhail Kokorich,Mkokorich
"Planet Labs raised additional funds into RoundC from IFC
http://t.co/voZ318bIbM via @techcrunch",Tue Apr 14 05:15:22 +0000 2015,en,0,False,0,False,,Mikhail Kokorich,Mkokorich
RT @bronwynagrios: True of the entire emerging satellite market  - an “important tool for economic dev and disaster risk response” http://t…,Tue Apr 14 00:51:42 +0000 2015,en,2,False,0,False,,Mikhail Kokorich,Mkokorich
"Внимание руководителей государства важно для такой ориентированной на крупные проекты отрасли, однако весьма... http://t.co/TpH41Sb0ju",Mon Apr 13 14:32:29 +0000 2015,ru,0,False,0,False,,Mikhail Kokorich,Mkokorich
"Полностью согласен с ректором Сколтеха - Эдом Кроули: ""А вот доставка информации значительно более выгодна.... http://t.co/D8YpihgrtQ",Mon Apr 13 14:26:32 +0000 2015,ru,0,False,0,False,,Mikhail Kokorich,Mkokorich
http://t.co/xVClV4sbPU,Mon Apr 13 03:00:25 +0000 2015,und,0,False,0,False,,Mikhail Kokorich,Mkokorich
"""Just read the instructions"" - написано на судне - дроне. Завтрашняя попытка посадки первой ступени Falcon в... http://t.co/UNJUrrAPM8",Mon Apr 13 02:57:58 +0000 2015,ru,0,False,0,False,,Mikhail Kokorich,Mkokorich
Мысли на День Космонавтики. https://t.co/B0OYuyG5AK,Sun Apr 12 16:19:10 +0000 2015,ru,1,False,0,False,,Mikhail Kokorich,Mkokorich
"Мысли в день космонавтики

Сегодня День Космонавтики. Один из тех профессиональных праздников, которые близок не... http://t.co/YCYWKDLd2W",Sun Apr 12 14:38:32 +0000 2015,ru,0,False,0,False,,Mikhail Kokorich,Mkokorich
Всем кто хочет обелить образ самого страшного человека в истории России и романтизировать это время http://t.co/SQGPZLEOo3,Sat Apr 11 15:08:42 +0000 2015,ru,0,False,0,False,,Mikhail Kokorich,Mkokorich
"Human activity doesn't always expand relentlessly. Occasionally, nature reclaims the land. One of the images show... http://t.co/fScjx2loMZ",Sat Apr 11 00:37:40 +0000 2015,en,0,False,1,False,,Mikhail Kokorich,Mkokorich
Get the Spark mobile app to discover what's happening nearby. http://t.co/MlXELQyfVS,Sat Apr 11 00:14:25 +0000 2015,en,0,False,0,False,,Mikhail Kokorich,Mkokorich
http://t.co/UgsKL95mRd,Fri Apr 03 06:09:57 +0000 2015,und,0,False,0,False,,Mikhail Kokorich,Mkokorich
Это важный этап для нашей компании http://t.co/Yx4kad1XvY,Wed Apr 01 14:15:37 +0000 2015,ru,0,False,0,False,,Mikhail Kokorich,Mkokorich
@katelengold Washington! Lincoln memorial,Sun Mar 29 12:38:10 +0000 2015,en,0,False,0,False,,Mikhail Kokorich,Mkokorich
"Spacecraft Traveling Close to Light Speed Should Be Visible With Current Technology, Say... http://t.co/K4wpR5PiSR",Sun Mar 29 02:36:10 +0000 2015,en,1,False,1,False,,Mikhail Kokorich,Mkokorich
"It is amazing how good shots you can do now with smartphone camera. From moving plane, at night with small aperture. http://t.co/DvkGwxO00H",Sat Mar 28 05:56:56 +0000 2015,en,0,False,0,False,,Mikhail Kokorich,Mkokorich
RT @bronwynagrios: Co-working in DC. More than 50% of the people in here are using Windows. #notSF,Sat Mar 28 05:49:23 +0000 2015,en,1,False,0,False,,Mikhail Kokorich,Mkokorich
"Юлия Латынина о частном космосе (с 37 минуты), и об уголовном деле против Даурии Аэроспейс (с 41 минуты). http://t.co/ohXZMsbSFG",Sat Mar 07 18:04:33 +0000 2015,ru,0,False,1,False,,Mikhail Kokorich,Mkokorich
Химеры спрашивают про значение слова химеры... http://t.co/kLQku7kaVy,Sat Mar 07 04:24:40 +0000 2015,ru,0,False,0,False,,Mikhail Kokorich,Mkokorich
"Вот такую новость мы прочитали сегодня в Известиях, узнав о возбуждении уголовного дела.Поэтому особо деталей... http://t.co/jGpD3fGq4R",Thu Mar 05 21:56:52 +0000 2015,ru,0,False,0,False,,Mikhail Kokorich,Mkokorich
