Text,Created Date,Language,Retweet Count,Retweeted,Favorite Count,Favorited,co-ordinates,Tweeted By,Screen Name
"After all NASA starts to develop mission to capture asteroid and drag it to high lunar orbit.
What do you think:... http://t.co/htgTgQH7",Sat Jan 05 22:15:58 +0000 2013,en,0,False,0,False,,Mikhail Kokorich,Mkokorich
"I'm at Four Seasons Resort Maui (Wailea, HI) [pic]: http://t.co/2I9M71jQ",Fri Jan 04 23:55:48 +0000 2013,en,0,False,0,False,"{'type': 'Point', 'coordinates': [-156.44282341, 20.68053017]}",Mikhail Kokorich,Mkokorich
"I'm at Kahului Airport (OGG) (Kahului, HI) w/ 8 others http://t.co/XQYahv64",Fri Jan 04 22:39:57 +0000 2013,et,0,False,0,False,"{'type': 'Point', 'coordinates': [-156.43797398, 20.89281503]}",Mikhail Kokorich,Mkokorich
I posted a new photo to Facebook http://t.co/1vlyD61k,Fri Dec 28 18:53:19 +0000 2012,en,0,False,0,False,,Mikhail Kokorich,Mkokorich
@K_Ozzy попробуй,Thu Dec 27 04:46:58 +0000 2012,ru,0,False,0,False,,Mikhail Kokorich,Mkokorich
"@K_Ozzy не знаю, сейчас гляну",Thu Dec 27 03:27:46 +0000 2012,ru,0,False,0,False,,Mikhail Kokorich,Mkokorich
Спутникостроитель - Региональные публикации - Бизнес-Журнал Онлайн http://t.co/2JBMTYc,Wed Dec 26 19:03:04 +0000 2012,ru,1,False,0,False,,Mikhail Kokorich,Mkokorich
I posted a new photo to Facebook http://t.co/GAdk3Q3,Mon Dec 24 20:30:44 +0000 2012,en,0,False,0,False,,Mikhail Kokorich,Mkokorich
Наши поздравления Элону и Space-X! Проект создания возвращаемых ступеней идет полным ходом. http://t.co/K9ow5np,Mon Dec 24 04:28:16 +0000 2012,ru,0,False,0,False,,Mikhail Kokorich,Mkokorich
"Это важный шаг для нас, как для молодой команды. Поздравляем Центр им. Хруничева и лично Инессу Глазкову с... http://t.co/UAMtXBQ",Fri Dec 07 20:52:16 +0000 2012,ru,0,False,0,False,,Mikhail Kokorich,Mkokorich
Оказывается у меня в Китае фабрика;) http://t.co/h7JHWAa,Fri Nov 23 17:42:13 +0000 2012,ru,0,False,0,False,,Mikhail Kokorich,Mkokorich
"The New York City metropolitan area's JFK International, LaGuardia, and Newark International airports, all... http://t.co/k7L4JIg",Thu Nov 15 20:05:59 +0000 2012,en,0,False,0,False,,Mikhail Kokorich,Mkokorich
"Традиционный фермерский рынок в Пало-Альто. Можете купить свежие овощи с окрестных ферм, перекусить на открытом... http://t.co/KC8hZ6V",Sun Nov 11 20:36:47 +0000 2012,ru,0,False,0,False,,Mikhail Kokorich,Mkokorich
"In 2011, LAX was the sixth busiest airport in the world after Hartsfield-Jackson Atlanta International Airport,... http://t.co/1jINaRl",Sun Nov 11 00:03:17 +0000 2012,en,0,False,0,False,,Mikhail Kokorich,Mkokorich
"В Аэрофлоте новое меню, и живые розы;) надо сказать, что по сервису Аэрофлот безусловно одна из лучших... http://t.co/vg1TwfF",Sat Nov 10 23:58:14 +0000 2012,ru,0,False,0,False,,Mikhail Kokorich,Mkokorich
SSTL - компания выросшая из небольшой университетской лаборатории в лидера нового подхода в конструировании... http://t.co/4t8NdNf,Sat Nov 10 08:59:35 +0000 2012,ru,0,False,0,False,,Mikhail Kokorich,Mkokorich
Даурия Аэроспейс и SSTL подписали соглашение о партнерстве! Теперь лучшие технологии Surrey Satellite Technologies будут в России!,Fri Nov 09 09:33:32 +0000 2012,ru,0,False,0,False,,Mikhail Kokorich,Mkokorich
RT @SpacePlazas: NASA fires-up experimental space Internet for robot control - Network World http://t.co/iKiqKaiN,Fri Nov 09 09:29:44 +0000 2012,en,2,False,0,False,,Mikhail Kokorich,Mkokorich
Кремниевая Долина из окна автомобиля http://t.co/PXmlE9Y,Sun Oct 28 00:47:36 +0000 2012,ru,0,False,0,False,,Mikhail Kokorich,Mkokorich
http://t.co/JxTve35 http://t.co/gpTaCpt,Sat Oct 27 05:09:19 +0000 2012,und,0,False,0,False,,Mikhail Kokorich,Mkokorich
http://t.co/LS3ss0l http://t.co/zjyNoCY,Sat Oct 27 01:58:10 +0000 2012,und,0,False,0,False,,Mikhail Kokorich,Mkokorich
"Анжелика! Я очень благодарен судьбе и обстоятельствам, что много лет назад они свели нас! Спасибо тебе за... http://t.co/PqayPAK",Sat Oct 20 02:57:50 +0000 2012,ru,0,False,0,False,,Mikhail Kokorich,Mkokorich
One day the dreams like this will change the limits of impossible! http://t.co/63CmDUX,Fri Oct 19 21:56:00 +0000 2012,en,0,False,0,False,,Mikhail Kokorich,Mkokorich
1 год http://t.co/Fxci1Fs,Fri Oct 05 10:14:06 +0000 2012,ru,0,False,0,False,,Mikhail Kokorich,Mkokorich
Global Innovation Partnerships. 2012 Asia-Pacific Business Trip to Russia http://t.co/h5JWU9I,Wed Oct 03 11:42:38 +0000 2012,en,0,False,0,False,,Mikhail Kokorich,Mkokorich
Полный текст статьи теперь на сайте Forbes http://t.co/J9M1AAo,Wed Oct 03 10:05:46 +0000 2012,ru,0,False,0,False,,Mikhail Kokorich,Mkokorich
Industry luncheon in IAC http://t.co/HS5uftk,Tue Oct 02 10:51:35 +0000 2012,ro,0,False,0,False,,Mikhail Kokorich,Mkokorich
"Forbes, рейтинг 200 крупнейших непубличных компаний. 
Статья ""Сила убеждения"" http://t.co/m559SLl",Tue Sep 25 11:47:37 +0000 2012,ru,0,False,0,False,,Mikhail Kokorich,Mkokorich
РБК daily удалось пообщаться с первым частным отечественным предпринимателем в космической сфере - http://t.co/QpgD3Jq,Thu Sep 20 21:05:07 +0000 2012,ru,0,False,0,False,,Mikhail Kokorich,Mkokorich
"Посадка Curiosity на Марс - огромный результат не только научного сообщества, но и для всех землян. Марс - это... http://t.co/Q2ncx3H",Mon Aug 06 11:15:18 +0000 2012,ru,0,False,0,False,,Mikhail Kokorich,Mkokorich
"Один из лучших и самых известных образцов английской фольклорной песни - Greensleeves

Одно из лучших вокальных... http://t.co/r6mHB65",Sun Jul 29 06:52:27 +0000 2012,ru,0,False,0,False,,Mikhail Kokorich,Mkokorich
I posted a new photo to Facebook http://t.co/7WLhhfn,Sun Jul 08 10:28:39 +0000 2012,en,0,False,0,False,,Mikhail Kokorich,Mkokorich
Удивительное рядом! Результаты эксперимента BaBar на Стэнфордском электрон-позитронном коллайдере меняют картину... http://t.co/jByFfec,Sat Jun 23 20:11:43 +0000 2012,ru,0,False,0,False,,Mikhail Kokorich,Mkokorich
I posted a new photo to Facebook http://t.co/exklDJF,Thu Jun 21 08:36:25 +0000 2012,en,0,False,0,False,,Mikhail Kokorich,Mkokorich
Olympic Torch! http://t.co/CNcfW4F,Wed Jun 13 18:40:21 +0000 2012,en,0,False,0,False,,Mikhail Kokorich,Mkokorich
"RT @Rogozin: http://t.co/SAUrKDQ7 Здесь всё неправда. У ""Роскосмоса"" сохранится статус федерального агентства. Реформу начинать надо не  ...",Sun Jun 03 18:01:52 +0000 2012,ru,25,False,0,False,,Mikhail Kokorich,Mkokorich
Один из немногих солнечных дней в Сан-Франциско http://t.co/D4RJpfV,Sun Apr 01 17:17:16 +0000 2012,ru,0,False,0,False,,Mikhail Kokorich,Mkokorich
@DRogozin Thanks for readiness to look into Express AM4 case. It could be gift for Antarctic science society http://t.co/BkXTOxJ,Sat Mar 24 16:16:09 +0000 2012,en,0,False,0,False,,Mikhail Kokorich,Mkokorich
WE URGE ROSCOSMOS AND RSCC TO RECOGNIZE THE VALUE OF THE MISSION EXPRESS AM4  – AND GIVE AM4 A NEW LIFE.,Sat Mar 24 10:55:02 +0000 2012,en,0,False,0,False,,Mikhail Kokorich,Mkokorich
Похоже сегодня не удалось собрать совещание по отмене планируемого свода с орбиты Экспресс АМ4,Sat Mar 24 10:49:57 +0000 2012,ru,0,False,0,False,,Mikhail Kokorich,Mkokorich
"@Rogozin 
Спасибо за готовность разобраться в ситуации с Экспресс АМ4. Это был бы подарок мировой и российской науке http://t.co/BkXTOxJ",Sat Mar 24 10:47:36 +0000 2012,ru,0,False,0,False,,Mikhail Kokorich,Mkokorich
Выборы прошли. Что делаем?,Sun Mar 04 23:07:15 +0000 2012,ru,0,False,0,False,,Mikhail Kokorich,Mkokorich
"@amicableru Андрей привет, что думаешь про вчерашний митинг?",Sun Dec 11 19:39:47 +0000 2011,ru,0,False,0,False,"{'type': 'Point', 'coordinates': [37.50026978, 55.63956342]}",Mikhail Kokorich,Mkokorich
Песни наших родителей - у нас в генах;) http://t.co/KNUnkz6,Sat Dec 03 10:44:48 +0000 2011,ru,0,False,0,False,,Mikhail Kokorich,Mkokorich
День рождения Покровского Дениса. Вырвался. Кантри Резорт находится в заднице,Sat Oct 22 23:30:10 +0000 2011,ru,0,False,0,False,,Mikhail Kokorich,Mkokorich
История успеха Михаила Кокорича - архивный выпуск программы Они сделали это! . Радио Финам ФМ http://t.co/KPTcEwp via @AddThis,Thu May 26 12:50:49 +0000 2011,ru,0,False,0,False,,Mikhail Kokorich,Mkokorich
Техносила не банкрот. Банкрот старое юрлицо которое входило в группу СВ контролируемую Зайцевым,Fri Feb 11 15:21:57 +0000 2011,ru,0,False,0,False,,Mikhail Kokorich,Mkokorich
http://www.snob.ru/profile/blog/9402/29332?rp=fb%3Frp%3Dfb?rp=tw — 2,Thu Dec 30 19:31:40 +0000 2010,und,0,False,0,False,,Mikhail Kokorich,Mkokorich
http://www.vedomosti.ru/newspaper/article/248947/tehnosile_nashli_hozyaina,Wed Nov 03 04:15:17 +0000 2010,und,0,False,0,False,,Mikhail Kokorich,Mkokorich
@amicableru Надо чаще бывать за МКАД:),Tue Nov 02 06:46:04 +0000 2010,ru,0,False,0,False,,Mikhail Kokorich,Mkokorich
http://www.retailer.ru/item/id/25337/,Tue Nov 02 04:19:17 +0000 2010,und,0,False,0,False,,Mikhail Kokorich,Mkokorich
"I just finished a 6,12km run with a pace of 7'35""/km with my Nike+ GPS app.",Sun Oct 31 11:37:09 +0000 2010,en,0,False,0,False,,Mikhail Kokorich,Mkokorich
Вылетаю в славный город Москву. Ждите:) http://yfrog.com/mg27431843j,Wed Oct 27 11:54:37 +0000 2010,ru,0,False,0,False,,Mikhail Kokorich,Mkokorich
"RT @podakuni: Блядь, что за страна у нас такая? Все только и говорят что ото всюду ""сигналы поступают"": из мэрии, из Кремля, из Думы...  ...",Mon Oct 25 02:07:27 +0000 2010,ru,13,False,0,False,,Mikhail Kokorich,Mkokorich
"Собянин проводит выездное совещание по вопросам подготовки зимы. Неужели они думают, что ручное управление большим мегаполисом правильно?",Sun Oct 24 14:45:17 +0000 2010,ru,0,False,0,False,,Mikhail Kokorich,Mkokorich
"I just finished a 10,5km run with a pace of 7'51""/km with my Nike+ GPS app.",Sun Oct 24 11:10:02 +0000 2010,en,0,False,0,False,,Mikhail Kokorich,Mkokorich
Хорошая погода. Надо идти в парк бегать:),Sun Oct 24 09:35:20 +0000 2010,ru,0,False,0,False,,Mikhail Kokorich,Mkokorich
"I just finished a 10,0km run with a pace of 7'45""/km with my Nike+ GPS app.",Sun Oct 24 09:31:29 +0000 2010,en,0,False,0,False,,Mikhail Kokorich,Mkokorich
@amicableru Читал? http://avmalgin.livejournal.com/2157654.html,Sun Oct 24 09:03:44 +0000 2010,ru,0,False,0,False,,Mikhail Kokorich,Mkokorich
@amicableru Ильницкий! привет! Ты правда считаешь назначение Собянина торжеством здравого смысла?,Sun Oct 24 08:59:56 +0000 2010,ru,0,False,0,False,,Mikhail Kokorich,Mkokorich
Провели презентацию компании для китайских клиентов. Вручили грамоты. Как же это работает! Как в СССР,Sun Oct 24 08:23:47 +0000 2010,ru,0,False,0,False,,Mikhail Kokorich,Mkokorich
Прилетел из Шанхая. Провел в самолете 12 часов. Все таки хорошо оказаться в России,Sun Oct 24 08:21:11 +0000 2010,ru,0,False,0,False,,Mikhail Kokorich,Mkokorich
"Муртазин произвел хорошее впечатление, человек знает о чем говорит",Sun Apr 25 04:07:16 +0000 2010,ru,0,False,0,False,,Mikhail Kokorich,Mkokorich
"Вчера прочитал статью Латыниной ""Рой и булочник"",  точно подмечена ситуация",Sun Apr 25 04:04:05 +0000 2010,ru,0,False,0,False,,Mikhail Kokorich,Mkokorich
