Text,Created Date,Language,Retweet Count,Retweeted,Favorite Count,Favorited,co-ordinates,Tweeted By,Screen Name
The Digital Marketing and Start Up Daily is out! https://t.co/ArowcMg3vA Stories via @sarahdruetlamy @FraVillanova,Fri Apr 01 09:18:56 +0000 2016,en,0,False,0,False,,Sam Khoury,Hussamkhoury
Yen for animation inspired Hong Kong designer's robot https://t.co/m4qIcNJUEq #news #technology,Fri Apr 01 08:27:51 +0000 2016,en,1,False,0,False,,Sam Khoury,Hussamkhoury
"""U.S. Textile Industry Turns to Tech as Gateway to Revival"" #tech #news @nytimes https://t.co/yjhGDzcf0k",Fri Apr 01 07:59:38 +0000 2016,en,0,False,0,False,,Sam Khoury,Hussamkhoury
Quantum Break Blends an OK Game With an Intriguing TV Show https://t.co/O3k2kz120D #tech #entrepreneur #digital #wired,Fri Apr 01 07:37:01 +0000 2016,en,0,False,2,False,,Sam Khoury,Hussamkhoury
Review: Quantum Break Has Great Actors But a Meh Story and Gameplay https://t.co/V23znXFvWu @TIME https://t.co/xZlzGjsMeU,Fri Apr 01 07:26:25 +0000 2016,en,0,False,0,False,,Sam Khoury,Hussamkhoury
Exclusive: Egypt blocked Facebook Internet service over surveillance - sources https://t.co/1svfrMW3Ej #news #technology,Fri Apr 01 06:14:55 +0000 2016,en,0,False,0,False,,Sam Khoury,Hussamkhoury
"""John Doerr to Step Aside and Become Chairman at Kleiner Perkins"" #tech #news @nytimes https://t.co/qR3QWIJBX6",Fri Apr 01 04:22:37 +0000 2016,en,0,False,0,False,,Sam Khoury,Hussamkhoury
"Meet Tesla’s Model 3, Its Long-Awaited Car for the Masses https://t.co/T5pMVWeGTS #tech #entrepreneur #digital #wired",Fri Apr 01 04:14:20 +0000 2016,en,0,False,0,False,,Sam Khoury,Hussamkhoury
Facebook drives up to 7 times more traffic than Twitter. Get to know your social audience https://t.co/5Ryv2HDceF #digital #media,Fri Apr 01 04:08:11 +0000 2016,en,0,False,0,False,,Sam Khoury,Hussamkhoury
Copyranter: An imagined conversation from inside the McDonald’s tagline bunker https://t.co/36xosBPv1G #digital #media,Fri Apr 01 04:08:11 +0000 2016,en,0,False,0,False,,Sam Khoury,Hussamkhoury
Inside BuzzFeed’s mobile plans for breaking-news domination https://t.co/6Ylb822zFK #digital #media,Fri Apr 01 04:08:10 +0000 2016,en,0,False,0,False,,Sam Khoury,Hussamkhoury
5 charts that break down the e-commerce landscape today https://t.co/dl7jVn7LTL #digital #media,Fri Apr 01 04:08:10 +0000 2016,en,0,False,0,False,,Sam Khoury,Hussamkhoury
The luxury smart bracelet that wants to rid city-dwellers of stress https://t.co/2JArQcITxa #digital #media,Fri Apr 01 04:08:09 +0000 2016,en,0,False,0,False,,Sam Khoury,Hussamkhoury
Snapchat Discover publishers could get comScore numbers https://t.co/mk46i68RTk #digital #media,Fri Apr 01 04:08:09 +0000 2016,en,0,False,0,False,,Sam Khoury,Hussamkhoury
"Platforms, viewability and profitability: Publishers confess their biggest challenges https://t.co/dYqGIan0Xx #digital #media",Fri Apr 01 04:08:09 +0000 2016,en,0,False,0,False,,Sam Khoury,Hussamkhoury
The secret to Axel Springer’s success: A diverse digital portfolio https://t.co/sygv6ecPNx #digital #media,Fri Apr 01 04:08:08 +0000 2016,en,0,False,0,False,,Sam Khoury,Hussamkhoury
From olive oil to an online zoo: Agency executives’ passion projects that we love https://t.co/SypezFYScU #digital #media,Fri Apr 01 04:08:08 +0000 2016,en,0,False,0,False,,Sam Khoury,Hussamkhoury
Oscar de la Renta: ‘Companies should aspire to become heritage brands’ https://t.co/kyUNIBxoXL #digital #media,Fri Apr 01 04:08:06 +0000 2016,en,1,False,1,False,,Sam Khoury,Hussamkhoury
"Huawei 2015 revenue jumps 37 percent, strongest in seven years https://t.co/aTKsjfmkLv #news #technology",Fri Apr 01 04:00:23 +0000 2016,en,0,False,0,False,,Sam Khoury,Hussamkhoury
Who isn't standing in line for the new #tesla ? https://t.co/f4o7K8nTkt,Fri Apr 01 02:15:21 +0000 2016,en,0,False,0,False,,Sam Khoury,Hussamkhoury
Reddit Hints—Without Saying Anything—That It Got a National Security Letter https://t.co/TD20ZEAlw5 #tech #entrepreneur #digital #wired,Fri Apr 01 02:04:47 +0000 2016,en,0,False,0,False,,Sam Khoury,Hussamkhoury
Security vulnerabilities found in U.S. visa database: ABC News https://t.co/NHbGSiYxLL #news #technology,Fri Apr 01 01:48:20 +0000 2016,en,0,False,0,False,,Sam Khoury,Hussamkhoury
Quick Question https://t.co/wQ69Yt4QAM #auto #news,Fri Apr 01 01:28:13 +0000 2016,en,0,False,0,False,,Sam Khoury,Hussamkhoury
Quick question https://t.co/9xn6GT9ji0 #auto #news,Fri Apr 01 01:28:13 +0000 2016,en,0,False,0,False,,Sam Khoury,Hussamkhoury
On the record https://t.co/zQViLwG0H9 #auto #news,Fri Apr 01 01:28:12 +0000 2016,en,0,False,0,False,,Sam Khoury,Hussamkhoury
"Liveblog: Get Your First Glimpse at Tesla’s $30,000 Model 3 https://t.co/AWw7hbxP1k #tech #entrepreneur #digital #wired",Fri Apr 01 00:55:51 +0000 2016,en,0,False,0,False,,Sam Khoury,Hussamkhoury
To trade in or not to trade in? https://t.co/PbIQ9uU7oW #auto #news,Fri Apr 01 00:53:34 +0000 2016,en,0,False,0,False,,Sam Khoury,Hussamkhoury
Ally rolls out used-vehicle leases https://t.co/ZIIYslp0LX #auto #news,Fri Apr 01 00:53:33 +0000 2016,en,0,False,0,False,,Sam Khoury,Hussamkhoury
Ford cites several dealers for community service work https://t.co/K3XgFYXKPN #auto #news,Fri Apr 01 00:53:33 +0000 2016,en,0,False,0,False,,Sam Khoury,Hussamkhoury
Disruption on horizon? Better not ignore it https://t.co/LwcoFRJMkE #auto #news,Fri Apr 01 00:53:32 +0000 2016,en,0,False,0,False,,Sam Khoury,Hussamkhoury
Making house calls with iPads? https://t.co/PAbMAIWCWn #auto #news,Fri Apr 01 00:53:32 +0000 2016,en,0,False,0,False,,Sam Khoury,Hussamkhoury
Food52’s Bridget Williams: The scale era in media is waning https://t.co/sBzuasIoXJ #digital #media,Fri Apr 01 00:48:48 +0000 2016,en,0,False,0,False,,Sam Khoury,Hussamkhoury
Reddit deletes surveillance 'warrant canary' in transparency report https://t.co/pIXb0Plwg4 #news #technology,Fri Apr 01 00:40:26 +0000 2016,en,0,False,0,False,,Sam Khoury,Hussamkhoury
"Toyota's Carter says sales nearing plateau, but will remain solid https://t.co/szzsofeyZg #auto #news",Fri Apr 01 00:36:31 +0000 2016,en,0,False,0,False,,Sam Khoury,Hussamkhoury
Lenders panel says worries overblown https://t.co/0pzqjGJZhO #auto #news,Fri Apr 01 00:36:31 +0000 2016,en,0,False,0,False,,Sam Khoury,Hussamkhoury
NADA donates delivery van to Nevada food bank https://t.co/mS0EN4Zryf #auto #news,Fri Apr 01 00:36:30 +0000 2016,en,0,False,0,False,,Sam Khoury,Hussamkhoury
Northwood honors 5 who support education https://t.co/CiIdeSLatj #auto #news,Fri Apr 01 00:36:29 +0000 2016,en,0,False,0,False,,Sam Khoury,Hussamkhoury
Penske says punching problems can be solved https://t.co/dnQBUXBp2j #auto #news,Thu Mar 31 23:56:36 +0000 2016,en,0,False,0,False,,Sam Khoury,Hussamkhoury
Hyundai's Zuchowski warns of 'digital mercenaries' https://t.co/2fi4YeHyaw #auto #news,Thu Mar 31 23:56:36 +0000 2016,en,0,False,0,False,,Sam Khoury,Hussamkhoury
"Tracing the Legacy of Zaha Hadid, Architecture’s Esteemed Anomaly https://t.co/70nXxEHFtx #tech #entrepreneur #digital #wired",Thu Mar 31 23:33:41 +0000 2016,en,0,False,2,False,,Sam Khoury,Hussamkhoury
Best Dealerships entries due April 8 https://t.co/PLPRk1euyx #auto #news,Thu Mar 31 23:29:43 +0000 2016,en,1,False,0,False,,Sam Khoury,Hussamkhoury
TrueCar drops online financing plans https://t.co/tjtNNqDQ42 #auto #news,Thu Mar 31 23:29:42 +0000 2016,en,1,False,0,False,,Sam Khoury,Hussamkhoury
Google paid-ad costs could rise https://t.co/dVDXkDJh6q #auto #news,Thu Mar 31 23:29:40 +0000 2016,en,1,False,0,False,,Sam Khoury,Hussamkhoury
Infographic: 50 percent of publishers recruit editors to create native ads https://t.co/DTHV82vzg7 #digital #media,Thu Mar 31 23:20:11 +0000 2016,en,0,False,0,False,,Sam Khoury,Hussamkhoury
Uber CEO must face price-fixing lawsuit by passengers: U.S. judge https://t.co/q3Va6LQpSs #news #technology,Thu Mar 31 22:57:08 +0000 2016,en,0,False,0,False,,Sam Khoury,Hussamkhoury
FCC not to investigate Netflix throttling of some mobile consumers https://t.co/spEGY8xC2V #news #technology,Thu Mar 31 22:57:07 +0000 2016,en,0,False,0,False,,Sam Khoury,Hussamkhoury
Final Fantasy XV game information unveiled https://t.co/KoXnqSE1kw #news #technology,Thu Mar 31 22:57:07 +0000 2016,en,0,False,0,False,,Sam Khoury,Hussamkhoury
"Tesla fans line up, camp out to sign up for Model 3 https://t.co/hEcxigE14m #auto #news",Thu Mar 31 22:45:06 +0000 2016,en,0,False,0,False,,Sam Khoury,Hussamkhoury
On the record https://t.co/ByKqYTzjSs #auto #news,Thu Mar 31 22:45:05 +0000 2016,en,0,False,0,False,,Sam Khoury,Hussamkhoury
"It's all about trucks, inventory, profitability https://t.co/zdpVY6ndnf #auto #news",Thu Mar 31 22:45:04 +0000 2016,en,0,False,0,False,,Sam Khoury,Hussamkhoury
Experts see softer blue sky values this year https://t.co/HZ6Zy7hztN #auto #news,Thu Mar 31 22:45:04 +0000 2016,en,0,False,0,False,,Sam Khoury,Hussamkhoury
7 Steps-to-Success for Clothing Industry Start-ups https://t.co/vVYTyqx1RS #startup #entrepreneur,Thu Mar 31 22:45:03 +0000 2016,en,0,False,0,False,,Sam Khoury,Hussamkhoury
TradeRev app upgrade offers premium features https://t.co/flPe6B5jZz #auto #news,Thu Mar 31 22:45:03 +0000 2016,en,0,False,0,False,,Sam Khoury,Hussamkhoury
Fiat Chrysler shuns PSA but is talking with noncore auto players https://t.co/YyuEajEwIw #auto #news,Thu Mar 31 21:02:03 +0000 2016,en,0,False,0,False,,Sam Khoury,Hussamkhoury
Jeep campaign asks fans to share their stories https://t.co/u6Ep9M1uwv #auto #news,Thu Mar 31 21:02:02 +0000 2016,en,0,False,0,False,,Sam Khoury,Hussamkhoury
"Apple Inc. (AAPL) price at close, March 31, 2016, is 108.99.",Thu Mar 31 20:34:39 +0000 2016,en,0,False,0,False,,Sam Khoury,Hussamkhoury
"Alphabet Inc. (GOOG) price at close, March 31, 2016, is 744.95.",Thu Mar 31 20:34:19 +0000 2016,en,0,False,0,False,,Sam Khoury,Hussamkhoury
Amy Schumer’s Game of Thrones-Inspired Promo Is Perfect https://t.co/AE8XQ1jYi5 #tech #entrepreneur #digital #wired,Thu Mar 31 20:29:20 +0000 2016,en,0,False,1,False,,Sam Khoury,Hussamkhoury
The 10 Must-Watch Movies Coming to Hulu in April https://t.co/JSxIs2BxlJ #tech #entrepreneur #digital #wired,Thu Mar 31 20:29:20 +0000 2016,en,0,False,0,False,,Sam Khoury,Hussamkhoury
FCC advances privacy proposal for U.S. internet users https://t.co/EKuzvI5I2K #news #technology,Thu Mar 31 20:13:17 +0000 2016,en,1,False,0,False,,Sam Khoury,Hussamkhoury
Microsoft looking to support ad blockers in Edge web browser https://t.co/dKxzr668mg #news #technology,Thu Mar 31 20:13:16 +0000 2016,en,1,False,0,False,,Sam Khoury,Hussamkhoury
See What’s Inside a Virtual Reality Headset https://t.co/X3bf0ScXir @TIME https://t.co/pwYZtwr1KN,Thu Mar 31 20:00:16 +0000 2016,en,0,False,0,False,,Sam Khoury,Hussamkhoury
"TrueCar taps AutoTrader, Search Optics exec to lead dealer sales https://t.co/Rc8RQOc2k0 #auto #news",Thu Mar 31 19:34:14 +0000 2016,en,0,False,0,False,,Sam Khoury,Hussamkhoury
Ex-Navistar CEO Ustian faces SEC suit over emissions disclosures https://t.co/4172EWMV4M #auto #news,Thu Mar 31 19:34:14 +0000 2016,en,0,False,0,False,,Sam Khoury,Hussamkhoury
Microsoft Delights Devs By Freeing Its Xamarin Coding Tools https://t.co/QgbJYTdyU4 #tech #entrepreneur #digital #wired,Thu Mar 31 19:18:58 +0000 2016,en,0,False,0,False,,Sam Khoury,Hussamkhoury
New Amazon Dash Buttons Let You Instantly Order Condoms for Some Reason https://t.co/kss80FyiWP #tech #entrepreneur #digital #wired,Thu Mar 31 19:18:58 +0000 2016,en,0,False,0,False,,Sam Khoury,Hussamkhoury
"Final Fantasy XV’s New Demo Is Gorgeous, But Also Skimpy https://t.co/Ag2r7XicAY #tech #entrepreneur #digital #wired",Thu Mar 31 19:18:58 +0000 2016,en,0,False,0,False,,Sam Khoury,Hussamkhoury
You are the one who teaches other people how to treat you. What do you teach? - Chalene Johnson #quote,Thu Mar 31 19:16:13 +0000 2016,en,0,False,0,False,,Sam Khoury,Hussamkhoury
"Lululemon mocks Beyoncé, gets promptly dragged by the BeyHive https://t.co/pLwy2H8N1s #digital #media",Thu Mar 31 19:11:22 +0000 2016,en,0,False,0,False,,Sam Khoury,Hussamkhoury
TrueCar drops online financing plans https://t.co/WvE8kU2wow #auto #news,Thu Mar 31 18:23:28 +0000 2016,en,0,False,0,False,,Sam Khoury,Hussamkhoury
Google paid-ad costs could rise https://t.co/PmKXeAwsLu #auto #news,Thu Mar 31 18:23:28 +0000 2016,en,0,False,0,False,,Sam Khoury,Hussamkhoury
Ally nearly halts losses in its floorplan share https://t.co/WZL02VN3iF #auto #news,Thu Mar 31 18:23:28 +0000 2016,en,0,False,0,False,,Sam Khoury,Hussamkhoury
VW dealers have a lot riding on the make meeting https://t.co/35z0bYlJpQ #auto #news,Thu Mar 31 18:23:27 +0000 2016,en,0,False,0,False,,Sam Khoury,Hussamkhoury
"Retailers hope Volvo hits 100,000 annual U.S. sales https://t.co/HwlZODE3xn #auto #news",Thu Mar 31 18:23:27 +0000 2016,en,0,False,0,False,,Sam Khoury,Hussamkhoury
Toyota council chair learned from the best #8212; his dad https://t.co/qqUYqlqw7O #auto #news,Thu Mar 31 18:23:27 +0000 2016,en,0,False,0,False,,Sam Khoury,Hussamkhoury
Toyota dealers are happy but want more trucks https://t.co/yjIJhKdvmA #auto #news,Thu Mar 31 18:23:26 +0000 2016,en,0,False,0,False,,Sam Khoury,Hussamkhoury
"New line, China steer Lincoln in 'right direction' https://t.co/6npbG7yVPM #auto #news",Thu Mar 31 18:23:26 +0000 2016,en,0,False,0,False,,Sam Khoury,Hussamkhoury
Dealers to Hyundai: Send us more crossovers https://t.co/OPM7LILIP7 #auto #news,Thu Mar 31 18:23:26 +0000 2016,en,0,False,0,False,,Sam Khoury,Hussamkhoury
Customer loyalty: GM snaps Ford's 5-year run https://t.co/M7WWMHsGZB #auto #news,Thu Mar 31 18:23:25 +0000 2016,en,0,False,0,False,,Sam Khoury,Hussamkhoury
50 dealers nominated for Time magazine award https://t.co/hjKIkKOD4x #auto #news,Thu Mar 31 18:23:25 +0000 2016,en,0,False,0,False,,Sam Khoury,Hussamkhoury
"Dealers fight the naysayers, wait for crossovers https://t.co/wSYQLuwlyM #auto #news",Thu Mar 31 18:23:24 +0000 2016,en,0,False,0,False,,Sam Khoury,Hussamkhoury
Dealers can't get enough of Chevy's great products https://t.co/V6i2cvf7qb #auto #news,Thu Mar 31 18:23:24 +0000 2016,en,0,False,0,False,,Sam Khoury,Hussamkhoury
"With inventory improved, Cadillac dealers await product https://t.co/TGXEsPzNx3 #auto #news",Thu Mar 31 18:23:23 +0000 2016,en,0,False,0,False,,Sam Khoury,Hussamkhoury
"With more light trucks, BMW can set record https://t.co/yceQC2V4mk #auto #news",Thu Mar 31 18:23:23 +0000 2016,en,0,False,0,False,,Sam Khoury,Hussamkhoury
Amazon in talks to buy stake in mapping company HERE: sources https://t.co/JV5kHOGmQ4 #news #technology,Thu Mar 31 18:06:42 +0000 2016,en,0,False,0,False,,Sam Khoury,Hussamkhoury
Global smartphone market growth to be lowest ever in 2016: Gartner https://t.co/wnQBhaVGiR #news #technology,Thu Mar 31 18:06:41 +0000 2016,en,1,False,0,False,,Sam Khoury,Hussamkhoury
Three Ways to Make a Rocket From a Bottle (Bonus: GIFs!) https://t.co/LvNNFdYouI #tech #entrepreneur #digital #wired,Thu Mar 31 18:04:53 +0000 2016,en,0,False,1,False,,Sam Khoury,Hussamkhoury
Letter From the Editor: The Counterintuitive Commonalities Between ISIS and Silicon Valley https://t.co/h6EKff3HCX #tech #entrepreneur #di…,Thu Mar 31 18:04:52 +0000 2016,en,0,False,1,False,,Sam Khoury,Hussamkhoury
Superstar Architect Zaha Hadid Is Dead at 65 https://t.co/Ups9pRHTfJ #tech #entrepreneur #digital #wired,Thu Mar 31 18:04:52 +0000 2016,en,0,False,0,False,,Sam Khoury,Hussamkhoury
Tesla’s Electric Cars Aren’t as Green as You Might Think https://t.co/yPm2IkC7af #tech #entrepreneur #digital #wired,Thu Mar 31 18:04:51 +0000 2016,en,0,False,0,False,,Sam Khoury,Hussamkhoury
Cape Watch: Batman Battles Superman and the Box Office Wins https://t.co/RXyPDej1DD #tech #entrepreneur #digital #wired,Thu Mar 31 18:04:51 +0000 2016,en,0,False,0,False,,Sam Khoury,Hussamkhoury
Microsoft plans to install ad-blockers to its new browser releases https://t.co/JsXKNo8Tl0 #digital #media,Thu Mar 31 17:57:34 +0000 2016,en,0,False,0,False,,Sam Khoury,Hussamkhoury
The Atlantic’s verdict on Facebook Instant Articles: ‘Jury’s still out’ https://t.co/USS2nd9hWL #digital #media,Thu Mar 31 17:57:33 +0000 2016,en,0,False,0,False,,Sam Khoury,Hussamkhoury
Apple updates Siri's response to 'I was raped' https://t.co/fWGQ1T7Jgo #tech #news cnn,Thu Mar 31 17:48:40 +0000 2016,en,0,False,0,False,,Sam Khoury,Hussamkhoury
"'Super-Earth' is super hot, NASA telescope discovers https://t.co/anen5N5ert #tech #news cnn",Thu Mar 31 17:48:40 +0000 2016,en,0,False,0,False,,Sam Khoury,Hussamkhoury
"Ice melt could make seas rise 6 feet by 2100, study says https://t.co/nXP5EN1Qd3 #tech #news cnn",Thu Mar 31 17:48:39 +0000 2016,en,0,False,0,False,,Sam Khoury,Hussamkhoury
Best Dealerships entries due April 8 https://t.co/9bDx80kry2 #auto #news,Thu Mar 31 17:23:54 +0000 2016,en,0,False,0,False,,Sam Khoury,Hussamkhoury
"Auto-show tweets spur clicks, not just kicks (of tires) https://t.co/UEOBiMtkL0 #auto #news",Thu Mar 31 17:23:52 +0000 2016,en,0,False,0,False,,Sam Khoury,Hussamkhoury
New TV series shows off the achievements of women in color at startups https://t.co/yhUo2dNtby #entrepreneur #startup #news,Thu Mar 31 17:08:04 +0000 2016,en,0,False,1,False,,Sam Khoury,Hussamkhoury
Exclusive: Uber will use Progressive Insurance to cover Texas drivers https://t.co/dKyMkRegob #news #technology,Thu Mar 31 16:57:36 +0000 2016,en,0,False,0,False,,Sam Khoury,Hussamkhoury
Microsoft details subscriber growth in cloud https://t.co/hqFRBX44GA #news #technology,Thu Mar 31 16:57:35 +0000 2016,en,0,False,0,False,,Sam Khoury,Hussamkhoury
Attention Graphic Designers: Tips for Finding Clients and Pricing Your Services https://t.co/MuuTQzmRzz #startup #entrepreneur,Thu Mar 31 16:49:44 +0000 2016,en,0,False,0,False,,Sam Khoury,Hussamkhoury
This Woman Sold Her Twitter Account to Help Flint Get Water https://t.co/RPTdLUM0Qa @TIME https://t.co/7NyInKTict,Thu Mar 31 16:19:58 +0000 2016,en,0,False,0,False,,Sam Khoury,Hussamkhoury
Amazon Will Send You Condoms When You Press This Button https://t.co/6YpUv4VVbh @TIME https://t.co/ISP0z7CYPu,Thu Mar 31 16:19:57 +0000 2016,en,0,False,0,False,,Sam Khoury,Hussamkhoury
Here’s When the Next Final Fantasy Finally Comes Out https://t.co/V9b110pC8M @TIME https://t.co/t3mryIPFm9,Thu Mar 31 16:19:56 +0000 2016,en,0,False,0,False,,Sam Khoury,Hussamkhoury
Don't exercise your freedom of speech until you have exercised your freedom of thought. - Tim Fargo #quote,Thu Mar 31 16:16:21 +0000 2016,en,0,False,0,False,,Sam Khoury,Hussamkhoury
U.S. FCC expected to impose $2 billion budget cap on low-income subsidy https://t.co/aPuDXrfIUG #news #technology,Thu Mar 31 16:12:45 +0000 2016,en,0,False,0,False,,Sam Khoury,Hussamkhoury
GOP Launches Handy Site to Teach You About the Convention https://t.co/044TXebBNS #tech #entrepreneur #digital #wired,Thu Mar 31 16:10:57 +0000 2016,en,0,False,0,False,,Sam Khoury,Hussamkhoury
Global regulators move closer to regulating fintech https://t.co/VFAs72dOwg #news #technology,Thu Mar 31 15:51:43 +0000 2016,en,1,False,2,False,,Sam Khoury,Hussamkhoury
Refinery29 co-founder explains why it’s going ‘all-in’ on video https://t.co/Pcozf9bBQJ #digital #media,Thu Mar 31 15:21:27 +0000 2016,en,0,False,0,False,,Sam Khoury,Hussamkhoury
The 7 Best Gadgets For Getting in Shape https://t.co/m611qT4h1w @TIME https://t.co/0kIbOswG8E,Thu Mar 31 15:16:37 +0000 2016,en,1,False,1,False,,Sam Khoury,Hussamkhoury
Sri Lankan in Bangladesh cyber heist says she was set up by friend https://t.co/JHsltZ8T2X #news #technology,Thu Mar 31 14:47:16 +0000 2016,en,1,False,0,False,,Sam Khoury,Hussamkhoury
"""Amazon Widens Its Push-Button E-Commerce Horizons"" #tech #news @nytimes https://t.co/50a5ZeRp6i",Thu Mar 31 13:51:24 +0000 2016,en,0,False,0,False,,Sam Khoury,Hussamkhoury
Batman’s Decline From Hero to Just Another Angsty White Guy https://t.co/lRyTEWQWXI #tech #entrepreneur #digital #wired,Thu Mar 31 13:23:07 +0000 2016,en,0,False,0,False,,Sam Khoury,Hussamkhoury
"Saban, Disney invest in digital content firm Playbuzz https://t.co/mOUuWbXGO3 #news #technology",Thu Mar 31 13:03:42 +0000 2016,en,0,False,0,False,,Sam Khoury,Hussamkhoury
Foxconn's $3.5 billion bet to keep up with Apple https://t.co/HIpFZNDxrB #news #technology,Thu Mar 31 12:42:18 +0000 2016,en,0,False,0,False,,Sam Khoury,Hussamkhoury
"A Year After the Ellen Pao Verdict, Tech Still Gets Diversity Wrong https://t.co/W1qxO0AFGY #tech #entrepreneur #digital #wired",Thu Mar 31 12:40:19 +0000 2016,en,0,False,0,False,,Sam Khoury,Hussamkhoury
"Video Is Turning Amazon Into Much, Much More Than the Everything Store https://t.co/DyWUUcbxoU #tech #entrepreneur #digital #wired",Thu Mar 31 11:23:13 +0000 2016,en,0,False,0,False,,Sam Khoury,Hussamkhoury
"Why Do the Feds Usually Try to Unlock Phones? It’s Drugs, Not Terrorism https://t.co/VQTFBuywTd #tech #entrepreneur #digital #wired",Thu Mar 31 11:23:13 +0000 2016,en,0,False,0,False,,Sam Khoury,Hussamkhoury
"Inside the Post-Soviet Towns Built Around a 40,000-Foot Hole https://t.co/BmgSoKDjPB #tech #entrepreneur #digital #wired",Thu Mar 31 11:23:12 +0000 2016,en,0,False,0,False,,Sam Khoury,Hussamkhoury
Millennials for Hillary Have a Plan to Prove They Exist https://t.co/QRM03wZtMb #tech #entrepreneur #digital #wired,Thu Mar 31 11:23:12 +0000 2016,en,0,False,0,False,,Sam Khoury,Hussamkhoury
"Journey Back to the Dreamy, Gorgeous Architecture of Utopia https://t.co/bEle1pfSTQ #tech #entrepreneur #digital #wired",Thu Mar 31 11:23:12 +0000 2016,en,0,False,0,False,,Sam Khoury,Hussamkhoury
The FDA Just Opened Up Abortion Pill Access. Next Up: Webcam Prescriptions https://t.co/RRpHAGXsFw #tech #entrepreneur #digital #wired,Thu Mar 31 11:23:12 +0000 2016,en,0,False,0,False,,Sam Khoury,Hussamkhoury
"Sorry, But Don’t Expect Your Tesla Model 3 to Cost Under $30K https://t.co/SE14INRvNp #tech #entrepreneur #digital #wired",Thu Mar 31 11:23:11 +0000 2016,en,0,False,0,False,,Sam Khoury,Hussamkhoury
Skoda will take equity stake in China JV as it seeks to double sales https://t.co/areeuYwQxw #auto #news,Thu Mar 31 11:20:26 +0000 2016,en,0,False,0,False,,Sam Khoury,Hussamkhoury
UK watchdog warns of bottleneck in P2P platform approvals https://t.co/wYT5sCoVPl #news #technology,Thu Mar 31 11:04:18 +0000 2016,en,0,False,0,False,,Sam Khoury,Hussamkhoury
Where's the lane? Self-driving cars confused by shabby U.S. roadways https://t.co/wRuJ9TCOjM #news #technology,Thu Mar 31 10:44:53 +0000 2016,en,0,False,0,False,,Sam Khoury,Hussamkhoury
"Impatient with Yahoo, some investors cheer Starboard effort https://t.co/wQ4bWeowkp #news #technology",Thu Mar 31 10:44:53 +0000 2016,en,0,False,0,False,,Sam Khoury,Hussamkhoury
The 10 Most Righteous New Features Coming to Windows 10 https://t.co/czvdjJVcK3 #tech #entrepreneur #digital #wired,Thu Mar 31 10:24:22 +0000 2016,en,0,False,1,False,,Sam Khoury,Hussamkhoury
So You Got an iPhone SE. Here’s How to Get All Your Stuff on It https://t.co/A1gegJtoth #tech #entrepreneur #digital #wired,Thu Mar 31 10:05:48 +0000 2016,en,0,False,1,False,,Sam Khoury,Hussamkhoury
China finds drug users and convicts among ride-hailing app drivers https://t.co/xFRRaf5sVU #news #technology,Thu Mar 31 09:48:17 +0000 2016,en,1,False,1,False,,Sam Khoury,Hussamkhoury
The Digital Marketing and Start Up Daily is out! https://t.co/0AnPqWFFx7,Thu Mar 31 09:18:57 +0000 2016,en,0,False,0,False,,Sam Khoury,Hussamkhoury
Chinese AI team plans to challenge Google's AlphaGo: state media https://t.co/tmUbueu5Cy #news #technology,Thu Mar 31 08:20:54 +0000 2016,en,0,False,0,False,,Sam Khoury,Hussamkhoury
Fiat Chrysler shuns PSA but is talking with non-core auto players https://t.co/o7F6mavmoD #auto #news,Thu Mar 31 08:17:25 +0000 2016,en,0,False,0,False,,Sam Khoury,Hussamkhoury
Red Bull Media House opens up sports content to Reuters https://t.co/AV8ShNIfeb #digital #media,Thu Mar 31 08:12:40 +0000 2016,en,0,False,0,False,,Sam Khoury,Hussamkhoury
World of Tanks shows Belarus potential beyond Soviet-era farms https://t.co/V2gKxgHkWe #news #technology,Thu Mar 31 06:37:55 +0000 2016,en,0,False,0,False,,Sam Khoury,Hussamkhoury
"""Microsoft Trumpets Windows 10, and Pushes Into Sci-Fi Tech"" #tech #news @nytimes https://t.co/MqPn2LnGUd",Thu Mar 31 04:19:57 +0000 2016,en,0,False,0,False,,Sam Khoury,Hussamkhoury
"""Sizing Up Apple’s New Downsized Devices"" #tech #news @nytimes https://t.co/T3udzfVueZ",Thu Mar 31 04:19:56 +0000 2016,en,0,False,0,False,,Sam Khoury,Hussamkhoury
"Manolo Blahnik takes on e-commerce, with an assist from online marketplace Farfetch https://t.co/39ewfbU9tG #digital #media",Thu Mar 31 04:07:42 +0000 2016,en,0,False,0,False,,Sam Khoury,Hussamkhoury
Newspaper Association of America: ‘Digital ad inventory is not even close to infinite’ https://t.co/4KB9sirUUg #digital #media,Thu Mar 31 04:07:42 +0000 2016,en,0,False,1,False,,Sam Khoury,Hussamkhoury
Kik me some lipstick: Sephora bets on messaging apps for e-commerce https://t.co/yX6kuMLLag #digital #media,Thu Mar 31 04:07:41 +0000 2016,en,0,False,0,False,,Sam Khoury,Hussamkhoury
How Lane Bryant motivated Glamour magazine to prioritize its plus-sized readers https://t.co/y2Jr5S9cZ9 #digital #media,Thu Mar 31 04:07:41 +0000 2016,en,0,False,0,False,,Sam Khoury,Hussamkhoury
Mic is plotting a European expansion https://t.co/jD9kWqWVC9 #digital #media,Thu Mar 31 04:07:41 +0000 2016,en,0,False,0,False,,Sam Khoury,Hussamkhoury
Instagram is coaching advertisers to approach it exactly the same way they do Facebook https://t.co/4yLQuDExig #digital #media,Thu Mar 31 04:07:40 +0000 2016,en,0,False,0,False,,Sam Khoury,Hussamkhoury
How publishers are adapting their video strategies in the age of platforms https://t.co/az33moAMcK #digital #media,Thu Mar 31 04:07:40 +0000 2016,en,0,False,0,False,,Sam Khoury,Hussamkhoury
Domino’s DXP delivers pizza through Instagram-based games https://t.co/aanyFfDypZ #digital #media,Thu Mar 31 04:07:39 +0000 2016,en,0,False,0,False,,Sam Khoury,Hussamkhoury
