Text,Created Date,Language,Retweet Count,Retweeted,Favorite Count,Favorited,co-ordinates,Tweeted By,Screen Name
Proud to see @trulio on this list -&gt; Five of the hottest and most promising #fintech companies across Canada https://t.co/Ua1kD9ey1k,Thu Apr 21 15:55:36 +0000 2016,en,0,False,0,False,,David Blumberg,davidblumberg
Move fast and break things: #Innovation the Facebook way. https://t.co/JYPBXKyEzQ,Thu Apr 21 15:25:23 +0000 2016,en,3,False,3,False,,David Blumberg,davidblumberg
"A hypothetical can only get you so far. Leaders are born through real-life, innovative problem solving. https://t.co/UCsuCELvM7",Wed Apr 20 18:10:33 +0000 2016,en,0,False,1,False,,David Blumberg,davidblumberg
Preparation and education put one Texas county in the position to fend off a #cyberattack. https://t.co/GDa7A0RuLp,Wed Apr 20 15:25:22 +0000 2016,en,1,False,2,False,,David Blumberg,davidblumberg
RT @BlumbergCapital: Congrats to @ApesterMag! Proud to be a part of their $17 million raise for this digital storytelling platform -&gt; https…,Tue Apr 19 21:34:43 +0000 2016,en,3,False,0,False,,David Blumberg,davidblumberg
#IT executives' distance from cyber threats could be to blame for an overconfidence in their #cybersecurity. https://t.co/zqQgucFsTs,Tue Apr 19 16:25:23 +0000 2016,en,0,False,1,False,,David Blumberg,davidblumberg
"With help from @NamogooSecurity, one large UK retailer is giving its consumers a safer #CX. https://t.co/eAK0igmGP8",Tue Apr 19 14:55:21 +0000 2016,en,0,False,1,False,,David Blumberg,davidblumberg
Great read from @Trulioo regarding the pitfalls of categorical risk assessment -&gt; https://t.co/ihn1n9UM7h,Mon Apr 18 21:25:14 +0000 2016,en,0,False,2,False,,David Blumberg,davidblumberg
Are banks no longer an enemy to #fintech? More from #Money2020 Europe: https://t.co/62G7wxhHYs,Mon Apr 18 18:25:20 +0000 2016,en,0,False,2,False,,David Blumberg,davidblumberg
Your employees' W2s are a #cybercriminal's new prized possession. https://t.co/ShC5uMB0S8,Sun Apr 17 18:25:10 +0000 2016,en,0,False,0,False,,David Blumberg,davidblumberg
"Hadoop is putting #BigData in the palm of your hands, but what does this mean for your security? https://t.co/cDYqiru9T3",Sun Apr 17 15:25:11 +0000 2016,en,4,False,2,False,,David Blumberg,davidblumberg
Two-factor authentication or two-step verification? Tips for staying safe online: https://t.co/o5FnQF69CW,Sat Apr 16 20:20:16 +0000 2016,en,1,False,3,False,,David Blumberg,davidblumberg
60% of small business are forced to close after a #databreach. Keep your #SMB safe with these tools: https://t.co/QJGNZezk1L,Sat Apr 16 17:20:19 +0000 2016,en,3,False,4,False,,David Blumberg,davidblumberg
Mobile is driving a better #CX and more from #Finovate Europe 2016: https://t.co/ztpNVLZqK2,Fri Apr 15 21:05:11 +0000 2016,en,0,False,1,False,,David Blumberg,davidblumberg
Consider using two-factor verification to maintain strong personal #cybersecurity. https://t.co/4AO01Xc12w https://t.co/1Xp099TMNA,Fri Apr 15 16:48:31 +0000 2016,en,0,False,1,False,,David Blumberg,davidblumberg
Making computer science a K-12 priority could ultimately advance America's #cybersecurity. https://t.co/mPXxtq2SLf,Thu Apr 14 20:05:14 +0000 2016,en,0,False,0,False,,David Blumberg,davidblumberg
RT @lindachung321: #Robots to replace smartphones? @BlumbergCapital's @cmgottschalk breaks it down w/@CNBC @TheDomino https://t.co/H4SY03QH…,Thu Apr 14 17:11:49 +0000 2016,en,8,False,0,False,,David Blumberg,davidblumberg
Are you a rule follower or more laissez-faire? Your leadership style affects the outcome you acheive. https://t.co/6zwSGrEpkb via @Lendio,Thu Apr 14 16:40:12 +0000 2016,en,1,False,3,False,,David Blumberg,davidblumberg
Lost business became the most severe financial consequence of #data breaches in 2015. More from @Fortscale: https://t.co/y33By0K3ih,Wed Apr 13 20:05:14 +0000 2016,en,3,False,3,False,,David Blumberg,davidblumberg
"With 80% of global organizations exploring #IoT, security integration is more important than ever. https://t.co/gMjk7GW1yE",Wed Apr 13 17:25:12 +0000 2016,en,0,False,1,False,,David Blumberg,davidblumberg
Involved in cross border commerce? @Trulioo has the rundown on foreign currency exchange regulations: https://t.co/eZnm01VRP2,Tue Apr 12 21:30:25 +0000 2016,en,0,False,2,False,,David Blumberg,davidblumberg
Businesses aren't the only ones with #cybersecurity on the brain. Not even the government is safe from hacks. https://t.co/MzbpI2NCFt,Tue Apr 12 17:32:18 +0000 2016,en,0,False,1,False,,David Blumberg,davidblumberg
Amazon is diving deeper into the payments space. More from #Money2020Europe https://t.co/VgM9lcDBjj,Mon Apr 11 17:40:07 +0000 2016,en,0,False,1,False,,David Blumberg,davidblumberg
Good read from @Trulioo -&gt; Cost-saving Robo-advisors are gaining popularity in the #investment world: https://t.co/0ufclSjLXb,Sun Apr 10 20:05:11 +0000 2016,en,0,False,0,False,,David Blumberg,davidblumberg
Is your approach to stress actually making it worse? Tips to combating #business burnout: https://t.co/DVchJjKR8v,Sun Apr 10 17:55:10 +0000 2016,en,0,False,1,False,,David Blumberg,davidblumberg
RT @trulioo: Should the #payments industry adopt distributed ledger technology? https://t.co/VWOjyz6nIW https://t.co/nlYPD60Pfm,Sat Apr 09 21:50:07 +0000 2016,en,5,False,4,False,,David Blumberg,davidblumberg
You have to exercise more than your brain. How does your fitness routine stack up against @BillGates' workout? https://t.co/JtwUkAUTgB,Sat Apr 09 20:30:45 +0000 2016,en,0,False,0,False,,David Blumberg,davidblumberg
"Impressive presentation by @santisiri on #computing, #encryption, #blockchain &amp; orgs of the future #Sinergia2016 https://t.co/yAWsa2jlll",Fri Apr 08 22:46:23 +0000 2016,en,3,False,6,False,,David Blumberg,davidblumberg
"2 inspiring leaders: Vincente Fox, former president, MX &amp; Maickel Melamed, UN Goodwill Ambassador, VE #sinergia2016 https://t.co/KBw0h8sJtv",Fri Apr 08 22:40:15 +0000 2016,en,0,False,4,False,,David Blumberg,davidblumberg
".@JoanCwaik on disruptive technologies &amp; social, economic, cultural &amp; political implications #Sinergia2016 https://t.co/alaoGaQDCR",Fri Apr 08 22:28:43 +0000 2016,und,1,False,1,False,,David Blumberg,davidblumberg
"Andy Grove never stopped teaching- ""The greatest danger is in standing still."" https://t.co/JeYvtAO2jN #leadership",Fri Apr 08 19:05:16 +0000 2016,en,2,False,0,False,,David Blumberg,davidblumberg
"Empathy doesn't just help you in life, but in #business. @Lendio zeros in on what makes a successful leader -&gt; https://t.co/b2vhlZNDJs",Fri Apr 08 16:20:12 +0000 2016,en,0,False,3,False,,David Blumberg,davidblumberg
"Went sightseeing while in Cancun for #sinergia2016 . Chichen Itza is an ancient Mayan site &gt;1,000 years old. https://t.co/yvfDEA0g2Y",Fri Apr 08 14:28:39 +0000 2016,en,0,False,0,False,,David Blumberg,davidblumberg
RT @fortscale: Insider Security Threats: Disloyal Employees - InformationWeek https://t.co/GxNQJbaFsE,Thu Apr 07 19:15:27 +0000 2016,en,1,False,1,False,,David Blumberg,davidblumberg
"Vincente Fox, former president, Mexico &amp; Jose Quiroga, former president, Bolivia discuss the future @ Sinergia LatAm https://t.co/mgeW2YlRIc",Thu Apr 07 17:44:11 +0000 2016,es,0,False,1,False,,David Blumberg,davidblumberg
"Honored to join Sinergia LatAm, a meeting of leaders creating a better future for LatAm w/ innovation, entrepreneurs https://t.co/UHtjPYDQ32",Thu Apr 07 17:37:23 +0000 2016,en,0,False,1,False,,David Blumberg,davidblumberg
"Mayans made advances in math, astronomy, architecture &amp; more. Human spirit of #innovation is in our DNA, will propel us to a better future.",Thu Apr 07 17:22:16 +0000 2016,en,1,False,2,False,,David Blumberg,davidblumberg
"As the desire for #data grows, your social media could be considered when calculating your credit score. https://t.co/zOtEMmERrW",Thu Apr 07 16:02:21 +0000 2016,en,0,False,1,False,,David Blumberg,davidblumberg
"As threats evolve, so should your precautionary measures. Keeping your #cybersecurity current is key. https://t.co/5btHltWOE7",Wed Apr 06 20:05:12 +0000 2016,en,1,False,0,False,,David Blumberg,davidblumberg
Unsure what to do with that old gift card? @ZeekMarketplace has everything you need to know about #brandedcurrency: https://t.co/9oQXibSZEP,Wed Apr 06 17:51:10 +0000 2016,en,0,False,1,False,,David Blumberg,davidblumberg
"Attacks on large businesses increased by 40%, yet some companies remain unconcerned with improving #cybersecurity. https://t.co/4ODWGeYTFH",Tue Apr 05 20:35:13 +0000 2016,en,1,False,4,False,,David Blumberg,davidblumberg
Can the immediacy of social media lead to revenue from impulse buys? @Zoozpayments talks digital #payment solutions: https://t.co/JE6akTBUD8,Tue Apr 05 17:23:31 +0000 2016,en,1,False,2,False,,David Blumberg,davidblumberg
Want to send money from the UK to East Africa? Virtual #currency is bringing opportunity to emerging economies. https://t.co/3zVLFXOMJT,Mon Apr 04 20:10:16 +0000 2016,en,0,False,1,False,,David Blumberg,davidblumberg
Great mention of @arcadiadata's solutions announcement at #StrataHadoop conf from @sdtimes -&gt; https://t.co/zNefLsk5CW,Mon Apr 04 17:47:55 +0000 2016,en,0,False,1,False,,David Blumberg,davidblumberg
6 excellent reasons why #entrepreneurs should be concerned with #cybersecurity -&gt; https://t.co/8GyszGmmjJ,Sun Apr 03 19:30:32 +0000 2016,en,2,False,2,False,,David Blumberg,davidblumberg
Grooming leaders from within your company is essential for its lasting success. Great tips from @Inc -&gt; https://t.co/0AjFSIn5rM,Sun Apr 03 17:30:48 +0000 2016,en,0,False,1,False,,David Blumberg,davidblumberg
RT @BlumbergCapital: Device classification could be essential in addressing #IoT security concerns. https://t.co/sp6Td0F2uB,Sat Apr 02 19:25:05 +0000 2016,en,0,False,5,False,,David Blumberg,davidblumberg
Every great #entrepreneur needs to be adaptable. These success stories are no exception: https://t.co/RnYL8x95L6,Sat Apr 02 17:53:17 +0000 2016,en,0,False,4,False,,David Blumberg,davidblumberg
"With cyber threats increasing, someone has to foot the #cybersecurity bill. https://t.co/6FochuTR4w",Fri Apr 01 20:40:15 +0000 2016,en,1,False,1,False,,David Blumberg,davidblumberg
"#BigData is in big demand, so who's getting their hands on it? https://t.co/KXAGOAhoCb",Fri Apr 01 17:29:11 +0000 2016,en,0,False,1,False,,David Blumberg,davidblumberg
Take some cues from @Trulioo and learn how to protect your #business from fraudulent activity -&gt; https://t.co/0dHXIUfJ4k,Thu Mar 31 17:05:10 +0000 2016,en,1,False,2,False,,David Blumberg,davidblumberg
RT @UriLevine1: @FeeX Unveils Innovative Comparison Feature to Help People Retire Richer https://t.co/bBznOvHKW8 #retirementplanning #fees,Thu Mar 31 16:33:57 +0000 2016,en,1,False,1,False,,David Blumberg,davidblumberg
"""#IoT takes in so many disparate verticals - not one market, but many."" - Rami Efrati, @FirmitasCS #IDS16",Wed Mar 30 23:30:44 +0000 2016,en,2,False,4,False,,David Blumberg,davidblumberg
"""It's a journey, not a destination. Resilience is crucial."" - Rami Efrati, @FirmitasCS #IDS16 https://t.co/DyeVDYy5JC",Wed Mar 30 23:30:08 +0000 2016,en,6,False,7,False,,David Blumberg,davidblumberg
xDR Repository from @SQreamTech is giving organizations the ability to store and analyze #data in real-time -&gt; https://t.co/bZyhFEMyTc,Wed Mar 30 18:10:18 +0000 2016,en,2,False,2,False,,David Blumberg,davidblumberg
Cyberspace is the new battleground. Hackers keep attacking despite US government's improved #cybersecurity. https://t.co/LT64rDBfR0,Wed Mar 30 16:30:28 +0000 2016,en,0,False,3,False,,David Blumberg,davidblumberg
"Pleasure to see @AmbDermer speak not once, but twice this week. #IDS16 https://t.co/c1ffWGTW1J",Tue Mar 29 21:48:48 +0000 2016,en,2,False,5,False,,David Blumberg,davidblumberg
RT @BlumbergCapital: Are you at #IDS16 ? Our team will be here for the next two days. https://t.co/5wrqYpsQ6g,Tue Mar 29 21:40:48 +0000 2016,en,6,False,0,False,,David Blumberg,davidblumberg
The @Fortscale blog explores how #data manipulation is the biggest threat to your #cybersecurity: https://t.co/fKrJpnyqMw,Tue Mar 29 16:40:32 +0000 2016,en,2,False,3,False,,David Blumberg,davidblumberg
"#FinTech: great from the consumer, but bad for big banks. @cloudtweaks explores the end of traditional banking -&gt; https://t.co/YPRJuuacFe",Mon Mar 28 19:15:17 +0000 2016,en,0,False,0,False,,David Blumberg,davidblumberg
"Proud of the new @BlumbergCapital site. Check out my welcome blog -&gt; Blumberg Capital Isn’t New, But Our Blog Is https://t.co/N417z0ol3c",Mon Mar 28 17:15:08 +0000 2016,en,5,False,5,False,,David Blumberg,davidblumberg
Is #Blockchain the next big thing in #FinTech? @TechCrunch explores -&gt; https://t.co/zGxBdTJKRZ,Sun Mar 27 21:35:10 +0000 2016,en,1,False,5,False,,David Blumberg,davidblumberg
How will #bigdata shape the future of business? @Forbes gives us 17 predictions -&gt; https://t.co/u0CBKB8Tm1,Sun Mar 27 17:35:12 +0000 2016,en,2,False,3,False,,David Blumberg,davidblumberg
"The #IoT is permeating &amp; transforming society via connectivity, but how can we prepare for its growth? Read more -&gt; https://t.co/YdDhOdK3CE",Sat Mar 26 17:22:17 +0000 2016,en,2,False,4,False,,David Blumberg,davidblumberg
"With global #business on the rise, federated #digital identities could be pivotal for cross-border operations. https://t.co/jCGHROgqzj",Fri Mar 25 20:25:08 +0000 2016,en,1,False,3,False,,David Blumberg,davidblumberg
Unsure if #Blockchain can be incorporated into your organization-&gt;The five major use cases for financial blockchains https://t.co/vMhwidKpOk,Fri Mar 25 17:35:06 +0000 2016,en,1,False,1,False,,David Blumberg,davidblumberg
Congrats to @Credorax and @Vantiv on the new partnership for international acceptance. https://t.co/n1QddsntRk  #fintech,Thu Mar 24 22:25:14 +0000 2016,en,1,False,0,False,,David Blumberg,davidblumberg
Proud to see @Fundbox win this -&gt; @PYMNTS Small Business Innovation Award for the 3rd straight year https://t.co/gZxQzlrBAm,Thu Mar 24 17:24:15 +0000 2016,en,0,False,3,False,,David Blumberg,davidblumberg
Good article detailing #cybersecurity trends to be on the lookout for in 2016 https://t.co/PKAqaDht91,Thu Mar 24 17:15:32 +0000 2016,en,0,False,0,False,,David Blumberg,davidblumberg
#Entrepreneurs need to be able to push themselves. @Inc explores 8 tips to stay motivated -&gt; https://t.co/uJSFFmbk4i,Wed Mar 23 20:10:17 +0000 2016,en,1,False,2,False,,David Blumberg,davidblumberg
Great success story via @Fundbox and @Preservationco_ -&gt; https://t.co/WMc7YRnSIx,Wed Mar 23 17:55:09 +0000 2016,en,0,False,1,False,,David Blumberg,davidblumberg
RT @lenddofriend: We speak at the @LendIt conference this April 11-12! Apply now https://t.co/WuMt1fBCne and meet us in SF! #BigData,Tue Mar 22 23:33:15 +0000 2016,en,0,False,0,False,,David Blumberg,davidblumberg
Find out what challenges are on the horizon for #cybersecurity and what business can do to defend themselves -&gt; https://t.co/3TRfUADtHe,Tue Mar 22 20:05:13 +0000 2016,en,0,False,0,False,,David Blumberg,davidblumberg
With @Credorax’s help @Vantiv is able to provide enhanced #CX &amp; have access to a global acquiring platform -&gt; https://t.co/28H5CJqWae,Tue Mar 22 17:30:15 +0000 2016,en,0,False,1,False,,David Blumberg,davidblumberg
$81M #cyberheist thwarted by a spelling error? Great write-up on the @Fortscale blog -&gt; https://t.co/aMMtu4nrQ6 #cyberattack,Mon Mar 21 20:15:18 +0000 2016,en,1,False,2,False,,David Blumberg,davidblumberg
Great mention of @Fortscale and @DeepInstinctSec -&gt; 10 Hot Startups Using Artificial Intelligence in #Cybersecurity https://t.co/G2SExHDxl3,Mon Mar 21 18:07:01 +0000 2016,en,3,False,5,False,,David Blumberg,davidblumberg
Collaboration is instrumental when #problemsolving in as a team. Tips via @INC -&gt;  https://t.co/OSradgppKu,Sun Mar 20 19:35:14 +0000 2016,en,0,False,0,False,,David Blumberg,davidblumberg
Excellent reminder of #cybersecurity's importance on any scale and some basic tips to keep your #data safe https://t.co/H4R41PVxAB,Sun Mar 20 18:20:24 +0000 2016,en,0,False,1,False,,David Blumberg,davidblumberg
Great read about the impact effective decision making can have on your organization  https://t.co/SycLKedEYD #leadership,Sat Mar 19 18:15:27 +0000 2016,en,2,False,5,False,,David Blumberg,davidblumberg
Interesting glimpse into the DOD's focus on the human element of their growing #cybersecurity initiative -&gt; https://t.co/9sHRRmTFO9,Fri Mar 18 19:01:52 +0000 2016,en,0,False,0,False,,David Blumberg,davidblumberg
RT @SQreamTech: @SQreamTech - ranked among Banking CIO's Top 10 Banking Analytics Solution Providers 2016 https://t.co/u6QGx97Dxz,Fri Mar 18 15:45:30 +0000 2016,en,0,False,0,False,,David Blumberg,davidblumberg
Only 10% of enterprises implementing #IoT feel confident in their #cybersecurity -&gt;  https://t.co/icZCTY0VeH,Thu Mar 17 21:15:16 +0000 2016,en,1,False,1,False,,David Blumberg,davidblumberg
Your employees are on the frontline in your defense of data. #Cybersecurity training more important than ever -&gt; https://t.co/HS90qiMRfL,Thu Mar 17 19:25:08 +0000 2016,en,0,False,0,False,,David Blumberg,davidblumberg
Exceptional take on the state of effective #technology implementation with regards to #cybersecurity  https://t.co/legCced7zH,Wed Mar 16 18:30:31 +0000 2016,en,1,False,1,False,,David Blumberg,davidblumberg
"Fascinating insights from inside governmental #cybersecurity-- ""we are the new army""  https://t.co/dw44aRIkwz",Wed Mar 16 16:40:10 +0000 2016,en,1,False,2,False,,David Blumberg,davidblumberg
Without effective #cybersecurity every business could be in danger of a breach:  https://t.co/AklJVShgxi,Tue Mar 15 18:20:16 +0000 2016,en,1,False,2,False,,David Blumberg,davidblumberg
Ready for great energy and conversations at the @Barclays Emerging #Payments Forum.,Tue Mar 15 16:07:36 +0000 2016,en,1,False,0,False,,David Blumberg,davidblumberg
Brief video on #FinTech's game-changing effect on big banks and the financial sector as a whole -&gt;  https://t.co/zuIUk2jupB,Mon Mar 14 19:05:18 +0000 2016,en,1,False,1,False,,David Blumberg,davidblumberg
Great overview of @FortScale and #cybersecurity from #RSAC2016  https://t.co/hYFSoEbzkL,Mon Mar 14 16:40:08 +0000 2016,en,1,False,1,False,,David Blumberg,davidblumberg
How is #RegTech helping to fuel innovation in finance? https://t.co/8MHflJw7EE via @techvibes #fintech,Sun Mar 13 20:25:13 +0000 2016,en,0,False,4,False,,David Blumberg,davidblumberg
Nine out of ten startups will fail. Do you have the characteristics common to successful #tech leaders via @larrykim https://t.co/qtsBU2TXY8,Sun Mar 13 16:25:14 +0000 2016,en,1,False,2,False,,David Blumberg,davidblumberg
EU Approach To Regulating Data Needs More Hope And Less Fear via @PaulMacDonnell  https://t.co/YQ3SXFR4lG,Sat Mar 12 22:35:12 +0000 2016,en,1,False,2,False,,David Blumberg,davidblumberg
Worried your #business idea doesn't have a market? Here are several ways to test that via @DanScalco -&gt; https://t.co/WOYNPQbT01,Sat Mar 12 18:20:21 +0000 2016,en,0,False,1,False,,David Blumberg,davidblumberg
Servant #leadership leads to peak performance levels. Learn how to elevate your leadership via @LeeColan -&gt;  https://t.co/FjaK8ZCkx3,Fri Mar 11 18:50:08 +0000 2016,en,0,False,0,False,,David Blumberg,davidblumberg
Israel has one of the best climates for #fintech innovation. @DataconomyMedia explores -&gt; https://t.co/pf9LJln5gc,Thu Mar 10 21:40:16 +0000 2016,en,1,False,0,False,,David Blumberg,davidblumberg
RT @BlumbergCapital: .@Deloitte report says Israel’s Blockchain &amp; #Fintech industry is booming -&gt;  https://t.co/AHszswGyyg,Thu Mar 10 19:10:53 +0000 2016,en,0,False,0,False,,David Blumberg,davidblumberg
Great mention of @FortScale in this article -&gt; 30 Cool New Security Products And Solutions Launched At #RSA2016 https://t.co/luii4OuzRv,Wed Mar 09 21:05:11 +0000 2016,en,0,False,1,False,,David Blumberg,davidblumberg
Great read on the @Trulioo blog: Do We Need to Rethink #Payments?  https://t.co/zRrniFqsXV,Wed Mar 09 19:50:08 +0000 2016,en,1,False,1,False,,David Blumberg,davidblumberg
Great mention of @FortScale in this article -&gt; 30 Cool New Security Products And Solutions Launched At #RSA2016 https://t.co/OoJe49cG8N,Tue Mar 08 20:45:17 +0000 2016,en,1,False,1,False,,David Blumberg,davidblumberg
Great read on the @Trulioo blog: Do We Need to Rethink #Payments?  https://t.co/jhA0ZPewbn,Tue Mar 08 18:10:09 +0000 2016,en,0,False,3,False,,David Blumberg,davidblumberg
Great mention of @Fortscale -&gt; @mxvpartners Releases Its Watch List at the 2016 #RSAC https://t.co/FJpMSEXoZJ,Mon Mar 07 20:20:19 +0000 2016,en,1,False,2,False,,David Blumberg,davidblumberg
Missed #RSAC2016 last week? Here's a great write up -&gt;  https://t.co/1MsgzHcFSf,Mon Mar 07 18:35:09 +0000 2016,en,0,False,0,False,,David Blumberg,davidblumberg
Glad to see @Kreditech and @Trulioo showcased here for their #fintech innovation:  https://t.co/SFCPqmU99w,Mon Mar 07 16:35:39 +0000 2016,en,2,False,6,False,,David Blumberg,davidblumberg
These podcasts tackle a variety of topics on every #entrepreneur's mind via @DrewAHendricks  https://t.co/tdLxyC6EBb,Fri Mar 04 21:55:12 +0000 2016,en,0,False,0,False,,David Blumberg,davidblumberg
Great interview with @romerosky of @Kreditech on their blog -&gt; https://t.co/6rnI4mrTJT,Fri Mar 04 18:45:19 +0000 2016,en,0,False,1,False,,David Blumberg,davidblumberg
Join me @templeemanuelsf tonight for a a fireside chat w/ Rami Efrati from https://t.co/RSLyWpqZQQ on #cybersecurity https://t.co/RqoM9mlxMD,Thu Mar 03 22:01:18 +0000 2016,en,0,False,1,False,,David Blumberg,davidblumberg
"Lesson for enterprise companies, hackers won't stop, even after a huge #breach-&gt; Sony Hackers Still Going Strong https://t.co/TZ8CTDS5mO",Thu Mar 03 17:10:19 +0000 2016,en,2,False,1,False,,David Blumberg,davidblumberg
Great overview -&gt; Email Alert Subscriptions – New @Fortscale 2.5 Feature  https://t.co/in02NXUbrl #RSAC2016,Wed Mar 02 17:15:16 +0000 2016,en,0,False,2,False,,David Blumberg,davidblumberg
Great interview series -&gt; Inside @Credorax: Nicola Palin-Willis on Balancing Payments and Family https://t.co/wyhxpyPYMj,Tue Mar 01 21:25:10 +0000 2016,en,0,False,0,False,,David Blumberg,davidblumberg
RT @fortscale: #RSAC Stop by booth S1939 for free a demo + ANOMALOUS SWAG! https://t.co/AskGZ2t9u4 #RSAC2016 https://t.co/BnYBaHDLYF,Tue Mar 01 21:05:34 +0000 2016,en,0,False,1,False,,David Blumberg,davidblumberg
RT @BlumbergCapital: Congrats to @DeepInstinctSec on their win at the @infosecuritypg Global Excellence Awards! https://t.co/Gd8FHTroE5,Tue Mar 01 19:23:19 +0000 2016,en,2,False,0,False,,David Blumberg,davidblumberg
Imagine if the Oscars’ categories applied to #cybersecurity via @DeepInstinctSec https://t.co/hPGHLAjPL6,Tue Mar 01 19:06:40 +0000 2016,en,2,False,1,False,,David Blumberg,davidblumberg
Congrats on the latest product release @FortScale https://t.co/0FUGBNnrgE #RSAC2016,Tue Mar 01 18:55:14 +0000 2016,en,0,False,1,False,,David Blumberg,davidblumberg
Well deserved!  https://t.co/swnLFrxQap,Tue Mar 01 18:48:36 +0000 2016,en,0,False,1,False,,David Blumberg,davidblumberg
"Pride, Wrath, Greed. I cover all the deadly internet #security sins in my latest blog post: https://t.co/34rra82HV9 #RSAC2016",Tue Mar 01 17:05:14 +0000 2016,en,1,False,1,False,,David Blumberg,davidblumberg
RT @BlumbergCapital: .@wurtis of @FortScale talks w/ @editingwhiz on #RSAC2016 + reminisces about the conference beginnings 25 years ago: h…,Tue Mar 01 00:14:09 +0000 2016,en,4,False,0,False,,David Blumberg,davidblumberg
"RT @RichardAEpstein: Much deserved take down of Apple &amp; Cook exaggeration on privacy question
https://t.co/yELtA0rW24",Mon Feb 29 20:12:53 +0000 2016,en,19,False,0,False,,David Blumberg,davidblumberg
Starting #RSAC2016 off right with an overview of the top #cybersecurity stories via @thehill -&gt; https://t.co/sWZfPg6AA6,Mon Feb 29 16:42:28 +0000 2016,en,3,False,3,False,,David Blumberg,davidblumberg
What impact will #IoTand #fintech have on the new era of #finance? via @Computing_News https://t.co/YpT2q3Ndkn,Sun Feb 28 20:40:37 +0000 2016,en,0,False,1,False,,David Blumberg,davidblumberg
Big opportunity for payments &amp; #FinTech players to fill the gaps for SMEs cross border #payment needs via @pymnts https://t.co/FwSrJFUHsL,Sun Feb 28 17:25:23 +0000 2016,en,2,False,7,False,,David Blumberg,davidblumberg
The number of underbanked people is staggering - 2 billion people don't have access to formal #finserv https://t.co/w2rKEBzRrc,Sat Feb 27 16:25:25 +0000 2016,en,1,False,0,False,,David Blumberg,davidblumberg
#Fintech trends to watch via @NateMatherson https://t.co/LCgZhhHjZI,Fri Feb 26 18:25:31 +0000 2016,en,0,False,2,False,,David Blumberg,davidblumberg
"The numbers are in -&gt; total annual #VC funding in #cybersecurity increased 76%, to $3.34 billion, in 2015. https://t.co/TsReimk6E2",Fri Feb 26 16:25:35 +0000 2016,en,0,False,1,False,,David Blumberg,davidblumberg
Join me @templeemanuelsf next week for a fireside chat w/ Rami Efrati of https://t.co/RSLyWpqZQQ on #cybersecurity https://t.co/3wfdQfWU77,Thu Feb 25 22:25:22 +0000 2016,en,0,False,0,False,,David Blumberg,davidblumberg
"Fortscale explores the Neiman Marcus Group attack of 2014 and shows hackers set off 60,000 security alarms. https://t.co/GnKGAfN7ZG",Thu Feb 25 18:25:30 +0000 2016,en,0,False,0,False,,David Blumberg,davidblumberg
Welcome @ChesterRitchie_!  https://t.co/TMnMkeXdSD,Wed Feb 24 22:28:00 +0000 2016,en,0,False,1,False,,David Blumberg,davidblumberg
.@neilpatel talks strategy on dealing with the chaos that comes with being an #entrepreneur -&gt; https://t.co/UXCMZ8dTe2,Wed Feb 24 21:25:25 +0000 2016,en,1,False,1,False,,David Blumberg,davidblumberg
