Text,Created Date,Language,Retweet Count,Retweeted,Favorite Count,Favorited,co-ordinates,Tweeted By,Screen Name
"Apple's new iPhone faces challenge measuring up in China, India https://t.co/oSp7fLQXss #news #technology",Tue Mar 22 00:42:41 +0000 2016,en,0,False,0,False,,Sam Khoury,Hussamkhoury
"U.S. asks to cancel Apple encryption hearing, may be able to access device https://t.co/wKnrmFX6hm #news #technology",Tue Mar 22 00:42:40 +0000 2016,en,0,False,0,False,,Sam Khoury,Hussamkhoury
The Military History Behind the Apple Watch’s New Straps https://t.co/AzAkcNKOWe #tech #entrepreneur #digital #wired,Tue Mar 22 00:26:36 +0000 2016,en,0,False,0,False,,Sam Khoury,Hussamkhoury
Gawker Says Hulk Hogan Jury Was Denied Key Evidence https://t.co/OQU6A5hK5Y #tech #entrepreneur #digital #wired,Mon Mar 21 23:56:23 +0000 2016,en,0,False,1,False,,Sam Khoury,Hussamkhoury
The FBI Now Says It May Crack That iPhone Without Apple’s Help https://t.co/MbF0VQT5zo #tech #entrepreneur #digital #wired,Mon Mar 21 23:56:22 +0000 2016,en,0,False,1,False,,Sam Khoury,Hussamkhoury
#apple #ios 9.3 is out! #winning,Mon Mar 21 23:19:05 +0000 2016,en,0,False,0,False,,Sam Khoury,Hussamkhoury
The first U.S. passenger cruise to Cuba in 50 years will happen in May https://t.co/zm2PKHlFyy #entrepreneur #startup #news,Mon Mar 21 23:02:53 +0000 2016,en,0,False,1,False,,Sam Khoury,Hussamkhoury
Amazon German warehouse workers start fresh strike in pay row https://t.co/rXqn5pxPFE #news #technology,Mon Mar 21 22:57:48 +0000 2016,en,0,False,0,False,,Sam Khoury,Hussamkhoury
Senate proposal on encryption gives judges broad powers https://t.co/AhSF1HQyV0 #news #technology,Mon Mar 21 22:43:27 +0000 2016,en,1,False,0,False,,Sam Khoury,Hussamkhoury
How to Update Your iPhone to iOS 9.3 https://t.co/ulGgosEx1m #tech #entrepreneur #digital #wired,Mon Mar 21 22:27:44 +0000 2016,en,0,False,1,False,,Sam Khoury,Hussamkhoury
Apple’s CareKit Is the Best Argument For Strong Encryption Yet https://t.co/TBaBZQbid2 #tech #entrepreneur #digital #wired,Mon Mar 21 22:12:37 +0000 2016,en,0,False,0,False,,Sam Khoury,Hussamkhoury
Number of U.S. government 'cyber incidents' jumps in 2015 https://t.co/zqayHSLjEK #news #technology,Mon Mar 21 21:10:27 +0000 2016,en,0,False,0,False,,Sam Khoury,Hussamkhoury
"""Apple’s Modest Product Upgrades Take Back Seat to Worries on iPhone Encryption"" #tech #news @nytimes https://t.co/sgfzLKidOE",Mon Mar 21 20:58:58 +0000 2016,en,1,False,0,False,,Sam Khoury,Hussamkhoury
Spotify Now Has 30 Million Subscribers https://t.co/KoYgQaXaPT @TIME https://t.co/w6Sq3zpFP7,Mon Mar 21 20:58:54 +0000 2016,en,0,False,0,False,,Sam Khoury,Hussamkhoury
Looking for the Future at the World’s Craziest Watch Show https://t.co/vWbGc5iAhx #tech #entrepreneur #digital #wired,Mon Mar 21 20:36:49 +0000 2016,en,0,False,0,False,,Sam Khoury,Hussamkhoury
"Apple Inc. (AAPL) price at close, March 21, 2016, is 105.91.",Mon Mar 21 20:36:15 +0000 2016,en,0,False,0,False,,Sam Khoury,Hussamkhoury
"Alphabet Inc. (GOOG) price at close, March 21, 2016, is 742.09.",Mon Mar 21 20:35:52 +0000 2016,en,0,False,0,False,,Sam Khoury,Hussamkhoury
AutoNews Now: Toyota hits gas on auto-braking https://t.co/mbTohAriEX #auto #news,Mon Mar 21 20:19:08 +0000 2016,en,0,False,0,False,,Sam Khoury,Hussamkhoury
How to talk to your editors about new ad formats https://t.co/fJoVlrjP7c #digital #media,Mon Mar 21 20:14:40 +0000 2016,en,0,False,0,False,,Sam Khoury,Hussamkhoury
Veep Is Arriving Just in Time for Election Season https://t.co/XQD0gZ7gQx #tech #entrepreneur #digital #wired,Mon Mar 21 20:04:57 +0000 2016,en,0,False,0,False,,Sam Khoury,Hussamkhoury
Here’s Everything Apple Announced Today https://t.co/lM2eDsQMaB @TIME https://t.co/s06vbeWANO,Mon Mar 21 19:55:16 +0000 2016,en,0,False,0,False,,Sam Khoury,Hussamkhoury
"After Trying Every VR Headset, Here’s What Worries Me and Keeps Me Hopeful https://t.co/VrfNFdLlKS @TIME https://t.co/AJWvT1ypNl",Mon Mar 21 19:55:15 +0000 2016,en,0,False,0,False,,Sam Khoury,Hussamkhoury
The One Reason Why Apple Is Making a Smaller iPhone https://t.co/jiim2Nd9YS @TIME https://t.co/VPtNVUGbZA,Mon Mar 21 19:55:14 +0000 2016,en,0,False,0,False,,Sam Khoury,Hussamkhoury
Everything Apple Announced Today https://t.co/Ag5HOPgT27 #tech #entrepreneur #digital #wired,Mon Mar 21 19:48:57 +0000 2016,en,0,False,0,False,,Sam Khoury,Hussamkhoury
Hack Brief: Update iOS Now to Fix a Serious iMessage Crypto Flaw https://t.co/fzqxIVxDH6 #tech #entrepreneur #digital #wired,Mon Mar 21 19:48:57 +0000 2016,en,0,False,0,False,,Sam Khoury,Hussamkhoury
"MSX International acquires Australian company, expands global reach https://t.co/4ZLX1ibJ1u #auto #news",Mon Mar 21 19:17:59 +0000 2016,en,0,False,0,False,,Sam Khoury,Hussamkhoury
How you treat yourself sets the standard for how others will treat you. - Steve Maraboli #quote,Mon Mar 21 19:16:19 +0000 2016,en,0,False,0,False,,Sam Khoury,Hussamkhoury
Girls Is the Best Show No One’s Talking About Right Now https://t.co/o99rZSnJKl #tech #entrepreneur #digital #wired,Mon Mar 21 19:03:13 +0000 2016,en,0,False,0,False,,Sam Khoury,Hussamkhoury
ID verification company Jumio files for bankruptcy protection https://t.co/VDQzRWE7cE #news #technology,Mon Mar 21 18:48:24 +0000 2016,en,1,False,1,False,,Sam Khoury,Hussamkhoury
Security Experts Aren’t Going To Like Utah’s Online Primary https://t.co/QH7zq1dNBZ #tech #entrepreneur #digital #wired,Mon Mar 21 18:46:22 +0000 2016,en,0,False,0,False,,Sam Khoury,Hussamkhoury
How to Start a Business With (Almost) No Money https://t.co/gn5j6ckdTB #startup #entrepreneur,Mon Mar 21 18:44:16 +0000 2016,en,0,False,0,False,,Sam Khoury,Hussamkhoury
The Apple TV Just Got a Huge Upgrade https://t.co/Hw3Ui0jIge @TIME https://t.co/AYGaHhixuN,Mon Mar 21 18:36:50 +0000 2016,en,0,False,0,False,,Sam Khoury,Hussamkhoury
These Are the Major New Features Coming to Your iPhone Today https://t.co/1ENdEfyu0s @TIME https://t.co/MV2RiHxiu6,Mon Mar 21 18:36:49 +0000 2016,en,0,False,0,False,,Sam Khoury,Hussamkhoury
See Apple’s New iPhone SE https://t.co/y3kjuw1ymf @TIME https://t.co/LsDqnPhVZR,Mon Mar 21 18:36:48 +0000 2016,en,0,False,0,False,,Sam Khoury,Hussamkhoury
Apple’s Smaller iPhone SE Will Cost You $400 https://t.co/JLDDWO1xdO #tech #entrepreneur #digital #wired,Mon Mar 21 18:13:51 +0000 2016,en,0,False,0,False,,Sam Khoury,Hussamkhoury
Apple Expands Its Tablet Lineup With Smaller iPad Pro https://t.co/jx8HGTEIKl #tech #entrepreneur #digital #wired,Mon Mar 21 18:13:50 +0000 2016,en,0,False,0,False,,Sam Khoury,Hussamkhoury
Apple iOS 9.3 Is Available Now. Here’s Why You Want It https://t.co/4lZKr6C3Nl #tech #entrepreneur #digital #wired,Mon Mar 21 18:13:50 +0000 2016,en,0,False,0,False,,Sam Khoury,Hussamkhoury
"Apple Slashes Watch Price, Introduces New Bands https://t.co/KPgZDYTjHf @TIME https://t.co/eX5FtMBAce",Mon Mar 21 18:04:18 +0000 2016,en,0,False,0,False,,Sam Khoury,Hussamkhoury
Tim Cook: “We Will Not Shrink from Our Responsibility” https://t.co/X7UEum4JAz @TIME https://t.co/82KWHnyWxg,Mon Mar 21 18:04:17 +0000 2016,en,0,False,0,False,,Sam Khoury,Hussamkhoury
Bloomberg finds a new outlet for video-licensing deal: airlines https://t.co/jaYzUXFMFC #digital #media,Mon Mar 21 17:45:44 +0000 2016,en,0,False,0,False,,Sam Khoury,Hussamkhoury
"Apple Watch Gets New Bands, New $299 Price https://t.co/5iyPmZkPEC #tech #entrepreneur #digital #wired",Mon Mar 21 17:41:03 +0000 2016,en,0,False,0,False,,Sam Khoury,Hussamkhoury
"""Supreme Court to Hear Samsung Appeal on Apple Patent Award"" #tech #news @nytimes https://t.co/ib0P2TLqZV",Mon Mar 21 16:55:50 +0000 2016,en,0,False,0,False,,Sam Khoury,Hussamkhoury
FanDuel and DraftKings shut down games in New York https://t.co/Ud7pQMyGsv #news #technology,Mon Mar 21 16:51:22 +0000 2016,en,0,False,1,False,,Sam Khoury,Hussamkhoury
13 first tweets from brands and publishers https://t.co/hE5Uft5rit #digital #media,Mon Mar 21 16:37:15 +0000 2016,en,0,False,0,False,,Sam Khoury,Hussamkhoury
Adobe Harnesses AI to Organize Your Photos for You https://t.co/hjHUEq7acS #tech #entrepreneur #digital #wired,Mon Mar 21 16:33:01 +0000 2016,en,0,False,0,False,,Sam Khoury,Hussamkhoury
The most important thing in communication is to hear what isn't being said. - Peter Drucker #quote,Mon Mar 21 16:16:22 +0000 2016,en,0,False,0,False,,Sam Khoury,Hussamkhoury
"This Crowdfunding Competition Produced an Al-Dente Kitchen, Cost-Effective Bikes and an Online Personal Shopping Cart …",Mon Mar 21 16:13:55 +0000 2016,en,0,False,0,False,,Sam Khoury,Hussamkhoury
Nintendo’s Miitomo Is Already Monstrously Popular https://t.co/VM3jBe1y4H @TIME https://t.co/K4gJV6lW92,Mon Mar 21 15:32:10 +0000 2016,en,0,False,0,False,,Sam Khoury,Hussamkhoury
"Study Finds 24 Car Models Open to Unlocking, Ignition Hack https://t.co/aPrgEE4mhJ #tech #entrepreneur #digital #wired",Mon Mar 21 14:52:07 +0000 2016,en,0,False,0,False,,Sam Khoury,Hussamkhoury
RT @CedarCalifornia: U.S. top court agrees to hear Samsung-Apple patent fight https://t.co/HY04jjE8tM #business #bloomberg,Mon Mar 21 14:09:15 +0000 2016,en,1,False,0,False,,Sam Khoury,Hussamkhoury
RT @CedarCalifornia: Smaller iPhone expected Monday as Apple counters drop in phone sales https://t.co/saLxIqwBlY #business #news,Mon Mar 21 14:09:08 +0000 2016,en,1,False,0,False,,Sam Khoury,Hussamkhoury
"RT @engadget: Google plans to bring internet to Cuba, Obama says https://t.co/Ho7ZCCeW3g https://t.co/yxhNfrEMDI",Mon Mar 21 14:09:06 +0000 2016,en,77,False,0,False,,Sam Khoury,Hussamkhoury
U.S. top court rejects EA Sports' appeal over Madden videogame https://t.co/Gtb48i8cP9 #news #technology,Mon Mar 21 14:03:35 +0000 2016,en,0,False,0,False,,Sam Khoury,Hussamkhoury
U.S. top court agrees to hear Samsung-Apple patent fight https://t.co/BiSrTXz6Zg #news #technology,Mon Mar 21 14:03:34 +0000 2016,en,0,False,0,False,,Sam Khoury,Hussamkhoury
First Shift: Jeep Wrangler output to boom https://t.co/dMcsQTkkB2 #auto #news,Mon Mar 21 13:12:38 +0000 2016,en,0,False,0,False,,Sam Khoury,Hussamkhoury
How Big Is the Cloud? Even GoDaddy Is Selling It https://t.co/qJK36pFEYS #tech #entrepreneur #digital #wired,Mon Mar 21 12:29:12 +0000 2016,en,0,False,0,False,,Sam Khoury,Hussamkhoury
I’m So Totally Over Newton’s Laws of Motion https://t.co/3s3qtJ4OmJ #tech #entrepreneur #digital #wired,Mon Mar 21 12:29:12 +0000 2016,en,0,False,0,False,,Sam Khoury,Hussamkhoury
Boeing’s Monstrous Underwater Robot Can Wander the Ocean for 6 Months https://t.co/CQgxaq8sG3 #tech #entrepreneur #digital #wired,Mon Mar 21 12:29:12 +0000 2016,en,0,False,0,False,,Sam Khoury,Hussamkhoury
Learn how to be a fierce &amp; fabulous female entrepreneur in our next #BizChats https://t.co/wMr3SYiFHZ #entrepreneur #startup #news,Mon Mar 21 12:05:25 +0000 2016,en,0,False,0,False,,Sam Khoury,Hussamkhoury
GM says China investment plans on track despite maturing auto market https://t.co/qjyYpMly0d #auto #news,Mon Mar 21 11:57:01 +0000 2016,en,0,False,0,False,,Sam Khoury,Hussamkhoury
"Google set to expand Wifi, broadband access in Cuba, Obama tells ABC https://t.co/XFgcQ4saft #news #technology",Mon Mar 21 11:45:14 +0000 2016,en,0,False,0,False,,Sam Khoury,Hussamkhoury
"On Its 10th Birthday, a Short History of Twitter in Tweets https://t.co/u5B4B5Lh8t #tech #entrepreneur #digital #wired",Mon Mar 21 11:43:50 +0000 2016,en,0,False,0,False,,Sam Khoury,Hussamkhoury
"Good Riddance, Chemicals: Microbes Are Farming’s Hot New Pesticides https://t.co/zN0Hsf2BCW #tech #entrepreneur #digital #wired",Mon Mar 21 11:43:49 +0000 2016,en,0,False,0,False,,Sam Khoury,Hussamkhoury
Liveblog: Apple’s March 21 Event in Cupertino https://t.co/g5tOxux5h1 #tech #entrepreneur #digital #wired,Mon Mar 21 11:43:49 +0000 2016,en,0,False,0,False,,Sam Khoury,Hussamkhoury
Herschel’s New Bags Are Rip-Proof … But Not Machete-Proof https://t.co/MBT0adP4aK #tech #entrepreneur #digital #wired,Mon Mar 21 11:43:49 +0000 2016,en,0,False,0,False,,Sam Khoury,Hussamkhoury
Here’s What Space Actually Looks Like to the Human Eye https://t.co/J0qL7trv8A #tech #entrepreneur #digital #wired,Mon Mar 21 11:43:48 +0000 2016,en,0,False,0,False,,Sam Khoury,Hussamkhoury
NASA’s Human Spaceflight Program Can’t Afford Another Reset From the Next President https://t.co/rAUEz0q5Hf #tech #entrepreneur #digital #…,Mon Mar 21 11:43:48 +0000 2016,en,0,False,0,False,,Sam Khoury,Hussamkhoury
GM targets big jump in South Korea sales to alleviate production woes https://t.co/fGKrmvhpIh #auto #news,Mon Mar 21 11:11:48 +0000 2016,en,0,False,0,False,,Sam Khoury,Hussamkhoury
Indonesian taxi drivers to rally for ban on online taxi apps https://t.co/RjccbXUvHR #news #technology,Mon Mar 21 10:45:15 +0000 2016,en,0,False,0,False,,Sam Khoury,Hussamkhoury
Priceline strikes deal with Cuba to let Americans book hotels https://t.co/dI5gmU4xjV #news #technology,Mon Mar 21 10:45:15 +0000 2016,en,0,False,0,False,,Sam Khoury,Hussamkhoury
"After a year, Carnegie Mellon and Uber research initiative is stalled https://t.co/aSsbIxwekd #news #technology",Mon Mar 21 10:30:32 +0000 2016,en,0,False,0,False,,Sam Khoury,Hussamkhoury
"Alibaba annual transaction volumes cross 3 trillion yuan, but growth slows https://t.co/WjdO3NebIw #news #technology",Mon Mar 21 10:30:32 +0000 2016,en,0,False,0,False,,Sam Khoury,Hussamkhoury
The Digital Marketing and Start Up Daily is out! https://t.co/cSjtXboNlC,Mon Mar 21 09:20:27 +0000 2016,en,0,False,0,False,,Sam Khoury,Hussamkhoury
Smaller iPhone expected Monday as Apple counters drop in phone sales https://t.co/fMUghGZlq5 #news #technology,Mon Mar 21 07:30:14 +0000 2016,en,0,False,0,False,,Sam Khoury,Hussamkhoury
Apple 'privacy czars' grapple with internal conflicts over user data https://t.co/a7Yq4n15Fc #news #technology,Mon Mar 21 06:30:22 +0000 2016,en,1,False,0,False,,Sam Khoury,Hussamkhoury
Foxconn to reduce offer for Sharp by around $900 million: Jiji https://t.co/fEM1DbRsh9 #news #technology,Mon Mar 21 05:45:17 +0000 2016,en,0,False,0,False,,Sam Khoury,Hussamkhoury
China's Xiaomi says has no plans to raise funds https://t.co/MrneSsypgc #news #technology,Mon Mar 21 05:30:26 +0000 2016,en,1,False,0,False,,Sam Khoury,Hussamkhoury
RT @Di_Knox: Airbnb will open its Cuba listings to users outside the United States #startup #marketing #business #creativelysmart https://t…,Mon Mar 21 04:22:14 +0000 2016,en,2,False,0,False,,Sam Khoury,Hussamkhoury
5 case studies: How location data is pulling customers off the street and into stores https://t.co/izmbCxSe1o #digital #media,Mon Mar 21 04:17:55 +0000 2016,en,0,False,0,False,,Sam Khoury,Hussamkhoury
Day in the Life: What a campaign manager at Whisper does all day https://t.co/78olMJj9u8 #digital #media,Mon Mar 21 04:17:55 +0000 2016,en,0,False,0,False,,Sam Khoury,Hussamkhoury
"How the BBC, Sky Sports and other UK media are using Facebook Live video https://t.co/3lBfQtoe5y #digital #media",Mon Mar 21 04:17:54 +0000 2016,en,0,False,0,False,,Sam Khoury,Hussamkhoury
How agencies integrate automation into media buying https://t.co/tH0yQCTIDi #digital #media,Mon Mar 21 04:17:54 +0000 2016,en,0,False,0,False,,Sam Khoury,Hussamkhoury
"As ad tech firms struggle, agencies benefit from an influx of programmatic-adept talent https://t.co/dQXRHR9Pam #digital #media",Mon Mar 21 04:17:53 +0000 2016,en,0,False,0,False,,Sam Khoury,Hussamkhoury
Where Twitter stands with the ad world on its 10th birthday https://t.co/5fqkip7Mjm #digital #media,Mon Mar 21 04:17:52 +0000 2016,en,0,False,0,False,,Sam Khoury,Hussamkhoury
"After dropping its paywall, The Sun focuses on rebuilding traffic https://t.co/bBAss34esB #digital #media",Mon Mar 21 04:17:51 +0000 2016,en,0,False,0,False,,Sam Khoury,Hussamkhoury
Head-on problem solving makes Greater N.Y. dealer group a trailblazer https://t.co/VVGcdgVKKO #auto #news,Mon Mar 21 04:11:58 +0000 2016,en,0,False,0,False,,Sam Khoury,Hussamkhoury
Punching cars hurts everyone https://t.co/KB5Cvz01kr #auto #news,Mon Mar 21 04:11:58 +0000 2016,en,0,False,0,False,,Sam Khoury,Hussamkhoury
Toyota dealers get CPO leasing https://t.co/jSGCbxHYtc #auto #news,Mon Mar 21 04:11:57 +0000 2016,in,0,False,0,False,,Sam Khoury,Hussamkhoury
Cheap-fuel savings slip with premium https://t.co/awKNlYPoWT #auto #news,Mon Mar 21 04:11:57 +0000 2016,en,0,False,0,False,,Sam Khoury,Hussamkhoury
Buy-sells  reshuffle  dealership rankings https://t.co/CiZLRVMPOv #auto #news,Mon Mar 21 04:11:57 +0000 2016,en,0,False,0,False,,Sam Khoury,Hussamkhoury
"Month after month, Audi delivers. Not that you noticed https://t.co/ZtFwdlA8BT #auto #news",Mon Mar 21 04:11:57 +0000 2016,en,0,False,0,False,,Sam Khoury,Hussamkhoury
"Uh-oh, Volkswagen finds itself in, er, on 'Jeopardy' https://t.co/5RBmuVs6dB #auto #news",Mon Mar 21 04:11:56 +0000 2016,en,0,False,0,False,,Sam Khoury,Hussamkhoury
Mustang takes iPhone Down Under https://t.co/UdSYOHSIgY #auto #news,Mon Mar 21 04:11:56 +0000 2016,en,0,False,0,False,,Sam Khoury,Hussamkhoury
"Any color as long as it's dark, subdued https://t.co/u2xW45qniQ #auto #news",Mon Mar 21 04:11:56 +0000 2016,en,0,False,0,False,,Sam Khoury,Hussamkhoury
California Toyota store tackles review site comments one by one https://t.co/9dOm3swQXd #auto #news,Mon Mar 21 04:11:55 +0000 2016,en,0,False,0,False,,Sam Khoury,Hussamkhoury
Influential marketers to speak in L.A. https://t.co/Z9JNvB8Ckf #auto #news,Mon Mar 21 04:11:55 +0000 2016,en,0,False,0,False,,Sam Khoury,Hussamkhoury
BMW to chase M-B with superluxury entry https://t.co/WRXll7MQqM #auto #news,Mon Mar 21 04:11:55 +0000 2016,en,0,False,0,False,,Sam Khoury,Hussamkhoury
FCA rethinks its minivan with the 2017 Chrysler Pacifica https://t.co/fs1svxIyZa #auto #news,Mon Mar 21 04:11:55 +0000 2016,en,0,False,0,False,,Sam Khoury,Hussamkhoury
Time was right for Fiat Chrysler in Canada https://t.co/7kcFLnIx2s #auto #news,Mon Mar 21 04:11:54 +0000 2016,en,0,False,0,False,,Sam Khoury,Hussamkhoury
3 Scion models to survive as Toyotas https://t.co/VEZZFtkR3y #auto #news,Mon Mar 21 04:11:54 +0000 2016,en,0,False,0,False,,Sam Khoury,Hussamkhoury
"Maserati starts new Levante  at $72,000 https://t.co/KeNdTac2Ep #auto #news",Mon Mar 21 04:11:53 +0000 2016,en,1,False,0,False,,Sam Khoury,Hussamkhoury
@elijah_medge_ thanks for following!,Mon Mar 21 03:02:36 +0000 2016,en,0,False,1,False,,Sam Khoury,Hussamkhoury
"""Flinging Emojis, Twitch Chatters Revel as Julia Child Cooks"" #tech #news @nytimes https://t.co/PEHD6zBTUz",Mon Mar 21 02:04:46 +0000 2016,en,0,False,0,False,,Sam Khoury,Hussamkhoury
Watch Apple’s Biggest Product Announcements in 2 Minutes https://t.co/gN7wZz44ah @TIME https://t.co/5czy30giT9,Mon Mar 21 00:49:48 +0000 2016,en,0,False,0,False,,Sam Khoury,Hussamkhoury
These Are the 10 Most Popular Tweets of All Time https://t.co/95criYiUzY @TIME https://t.co/r9XJWflvPZ,Mon Mar 21 00:35:04 +0000 2016,en,0,False,0,False,,Sam Khoury,Hussamkhoury
"""Amazon Leans on Government in Its Quest to Be a Delivery Powerhouse"" #tech #news @nytimes https://t.co/Oc1VrLKwjW",Sun Mar 20 22:49:47 +0000 2016,en,0,False,0,False,,Sam Khoury,Hussamkhoury
Big day for #cuba and #usa relations! What a great president! @BarackObama,Sun Mar 20 21:52:04 +0000 2016,en,0,False,0,False,,Sam Khoury,Hussamkhoury
RT @TheObamaDiary: The President arrives in Cuba .... look at that smile :-) https://t.co/BVjOAxKfj6,Sun Mar 20 21:51:12 +0000 2016,en,167,False,0,False,,Sam Khoury,Hussamkhoury
RT @nytimes: President Obama and his family touch down in Cuba https://t.co/8Hw6S8ztiz https://t.co/PsCmjxYJbb,Sun Mar 20 21:50:59 +0000 2016,en,849,False,0,False,,Sam Khoury,Hussamkhoury
Exclusive: SWIFT to advise banks on security as Bangladesh hack details emerge https://t.co/VkDReHEdxd #news #technology,Sun Mar 20 21:04:53 +0000 2016,en,0,False,0,False,,Sam Khoury,Hussamkhoury
"RT @intlspectator: US spends $640 billion on its military; more than China, Russia, Saudi, France, India, UK and Germany combined. https://…",Sun Mar 20 20:01:25 +0000 2016,en,457,False,0,False,,Sam Khoury,Hussamkhoury
Every exit is an entry somewhere. - Tom Stoppard #quote,Sun Mar 20 19:16:05 +0000 2016,en,0,False,0,False,,Sam Khoury,Hussamkhoury
Blackstone makes quiet sale ahead of FCC airwaves auction https://t.co/DdHrAasDKT #news #technology,Sun Mar 20 18:04:51 +0000 2016,en,1,False,1,False,,Sam Khoury,Hussamkhoury
How an injured Iraq War veteran became a successful electric bike entrepreneur https://t.co/nGxtHRHF4p #entrepreneur #startup #news,Sun Mar 20 16:18:26 +0000 2016,en,0,False,0,False,,Sam Khoury,Hussamkhoury
"Look up to the sky 
You'll never find rainbows 
If you're looking down.
- Charlie Chaplin #quote",Sun Mar 20 16:16:26 +0000 2016,en,0,False,0,False,,Sam Khoury,Hussamkhoury
"Exclusive: Lyft drivers, if employees, owed millions more - court documents https://t.co/b4nw4NXIna #news #technology",Sun Mar 20 15:03:39 +0000 2016,en,0,False,0,False,,Sam Khoury,Hussamkhoury
How To Use Google Docs Even Without An Internet Connection https://t.co/d6BSmnSqxr @TIME https://t.co/wzIL38Ld5a,Sun Mar 20 13:37:48 +0000 2016,en,0,False,0,False,,Sam Khoury,Hussamkhoury
Cyber expert disappears after comments on Bangladesh central bank heist https://t.co/bWAQiNcgdV #news #technology,Sun Mar 20 13:33:14 +0000 2016,en,0,False,0,False,,Sam Khoury,Hussamkhoury
"""Apple vs. the F.B.I.: How the Case Could Play Out"" #tech #news @nytimes https://t.co/RFptMuobUN",Sun Mar 20 13:23:01 +0000 2016,en,0,False,0,False,,Sam Khoury,Hussamkhoury
While You Were Offline: The Heathers Reboot Not a Single Person Asked For https://t.co/ReTPQsG0dY #tech #entrepreneur #digital #wired,Sun Mar 20 11:31:38 +0000 2016,en,0,False,0,False,,Sam Khoury,Hussamkhoury
Mathematicians Have Discovered a Prime Conspiracy https://t.co/h6EZYqT9gH #tech #entrepreneur #digital #wired,Sun Mar 20 11:31:37 +0000 2016,en,0,False,0,False,,Sam Khoury,Hussamkhoury
The Digital Marketing and Start Up Daily is out! https://t.co/gA0wTM0Dty Stories via @LondonOMJ,Sun Mar 20 09:20:29 +0000 2016,en,0,False,0,False,,Sam Khoury,Hussamkhoury
RT @TheNationalUAE: 62 dead in FlyDubai crash in Russia — in pictures https://t.co/fJGNaXs1PS,Sun Mar 20 04:29:40 +0000 2016,en,2,False,0,False,,Sam Khoury,Hussamkhoury
RT @VoteforHillary1: Hillary Clinton Endorsed by Arizona Congressman Ruben Gallego:  https://t.co/tz3BNXxwhI #AZPrimary #ArizonaPrimary #AZ…,Sun Mar 20 04:19:40 +0000 2016,en,92,False,0,False,,Sam Khoury,Hussamkhoury
"RT @WorldUnblocked: I'm looking for #VPN #content like #articles, #reviews and detailed #infographics. If you can help please DM me.",Sun Mar 20 04:18:40 +0000 2016,en,1,False,0,False,,Sam Khoury,Hussamkhoury
The VR Fund 2016 landscape https://t.co/Btb9zU7GiR,Sun Mar 20 02:03:28 +0000 2016,en,0,False,0,False,,Sam Khoury,Hussamkhoury
Ever lost your keys? Checkout @thetileapp - It's an app that helps you find your keys or your phone!  https://t.co/fffO38VaCH,Sun Mar 20 01:29:48 +0000 2016,en,0,False,0,False,,Sam Khoury,Hussamkhoury
Ever #lost your #keys? Checkout @thetileapp - It's an app that helps you find your keys or your #phone!  https://t.co/fffO38VaCH,Sun Mar 20 01:26:55 +0000 2016,en,0,False,1,False,,Sam Khoury,Hussamkhoury
@CarlHamlet you can't possibly be on an iPhone,Sat Mar 19 22:32:26 +0000 2016,en,0,False,1,False,,Sam Khoury,Hussamkhoury
https://t.co/eOm49nAmhv,Sat Mar 19 21:20:53 +0000 2016,und,0,False,0,False,,Sam Khoury,Hussamkhoury
Netflix Hid a Luke Cage Teaser in the Daredevil Credits https://t.co/5h0dLBjypr #tech #entrepreneur #digital #wired,Sat Mar 19 21:16:57 +0000 2016,en,0,False,0,False,,Sam Khoury,Hussamkhoury
"""Farhad and Mike Parse Virtual Reality Tech and the Apple Standoff"" #tech #news @nytimes https://t.co/DRAbZekIzK",Sat Mar 19 19:37:32 +0000 2016,en,0,False,0,False,,Sam Khoury,Hussamkhoury
It's what you learn after you know it all that counts. - John Wooden #quote,Sat Mar 19 19:16:08 +0000 2016,en,0,False,0,False,,Sam Khoury,Hussamkhoury
"When the character of someone is not clear to you, look at their friends. - Unknown #quote",Sat Mar 19 16:16:10 +0000 2016,en,0,False,0,False,,Sam Khoury,Hussamkhoury
Domino’s Actually Made a Robot That Delivers Your Pizza https://t.co/cKkkdDR0Et @TIME https://t.co/WAvZiapwi6,Sat Mar 19 15:51:37 +0000 2016,en,0,False,0,False,,Sam Khoury,Hussamkhoury
Facebook's Zuckerberg meets propaganda czar in China charm drive https://t.co/pO6wELKsY3 #news #technology,Sat Mar 19 13:17:30 +0000 2016,en,0,False,0,False,,Sam Khoury,Hussamkhoury
Bangladesh seeks FBI's help in investigating central bank heist https://t.co/fJ7FweBl7c #news #technology,Sat Mar 19 12:17:08 +0000 2016,en,0,False,0,False,,Sam Khoury,Hussamkhoury
These 7 Big Companies Also Fancy Themselves VCs https://t.co/pCQAewuLu3 #startup #entrepreneur,Sat Mar 19 11:58:37 +0000 2016,en,0,False,0,False,,Sam Khoury,Hussamkhoury
Space Photos of the Week: Monster Stars Show the Sun Who’s Boss https://t.co/AJQ7NhM3oI #tech #entrepreneur #digital #wired,Sat Mar 19 11:30:41 +0000 2016,en,0,False,0,False,,Sam Khoury,Hussamkhoury
"1,000 Days. 1,000 Surreal Posters. One … Unfortunate Design https://t.co/EepeG9Y57d #tech #entrepreneur #digital #wired",Sat Mar 19 11:30:41 +0000 2016,en,0,False,0,False,,Sam Khoury,Hussamkhoury
Security News This Week: The NSA Denied Hillary a Secure BlackBerry https://t.co/hqu2jYPtKs #tech #entrepreneur #digital #wired,Sat Mar 19 11:30:41 +0000 2016,en,0,False,0,False,,Sam Khoury,Hussamkhoury
"We’ll Take One Microwave-Powered Starship, Please https://t.co/v2Anp6SHyE #tech #entrepreneur #digital #wired",Sat Mar 19 11:30:40 +0000 2016,en,0,False,0,False,,Sam Khoury,Hussamkhoury
Apple Needs a New Reason for You to Buy an iPad https://t.co/zveXEwnLJA #tech #entrepreneur #digital #wired,Sat Mar 19 11:30:40 +0000 2016,en,0,False,0,False,,Sam Khoury,Hussamkhoury
