Text,Created Date,Language,Retweet Count,Retweeted,Favorite Count,Favorited,co-ordinates,Tweeted By,Screen Name
Do You Really Want to Be Your Own Boss? Answer These 6 Questions First. https://t.co/zsDIjPxrMc #startup #entrepreneur,Fri Apr 22 20:54:45 +0000 2016,en,0,False,1,False,,Sam Khoury,Hussamkhoury
7 Shortcuts That Can Kill A Startup Business https://t.co/BpkSrPNpqU #startup #entrepreneur,Fri Apr 22 20:54:44 +0000 2016,en,0,False,1,False,,Sam Khoury,Hussamkhoury
"Alphabet Inc. (GOOG) price at close, April 22, 2016, is 718.77.",Fri Apr 22 20:31:39 +0000 2016,en,0,False,0,False,,Sam Khoury,Hussamkhoury
"Apple Inc. (AAPL) price at close, April 22, 2016, is 105.68.",Fri Apr 22 20:31:00 +0000 2016,en,0,False,0,False,,Sam Khoury,Hussamkhoury
"Dutch police seize encrypted communication network with 19,000 users https://t.co/mzVVvQSCYB #news #technology",Fri Apr 22 19:42:59 +0000 2016,en,0,False,0,False,,Sam Khoury,Hussamkhoury
AutoNation changes recall policy to allow some auctions https://t.co/C6FLl0XEh0 #auto #news,Fri Apr 22 19:39:17 +0000 2016,en,0,False,0,False,,Sam Khoury,Hussamkhoury
AutoNews Now: Japan quakes rattle GM production https://t.co/BvJmAMuyOw #auto #news,Fri Apr 22 19:39:16 +0000 2016,en,0,False,0,False,,Sam Khoury,Hussamkhoury
"Connect enthusiastically. Give relentlessly. And lead bravely. Do that, and the future is yours! – Ted Coine #quote",Fri Apr 22 19:16:09 +0000 2016,en,0,False,0,False,,Sam Khoury,Hussamkhoury
"Neil deGrasse Tyson Is a Black Hole, Sucking the Fun Out of the Universe https://t.co/Pgo0tThZPB #tech #entrepreneur #digital #wired",Fri Apr 22 18:55:42 +0000 2016,en,0,False,0,False,,Sam Khoury,Hussamkhoury
"The 10 Essential Prince Albums, From Purple Rain to Parade https://t.co/fblLEVuAe7 #tech #entrepreneur #digital #wired",Fri Apr 22 18:55:41 +0000 2016,en,0,False,1,False,,Sam Khoury,Hussamkhoury
The Simpsons Gives Its Couch Gag the Disney Treatment https://t.co/ZmyjI1w3xM #tech #entrepreneur #digital #wired,Fri Apr 22 18:41:07 +0000 2016,en,0,False,0,False,,Sam Khoury,Hussamkhoury
Uber drivers' $100 million deal may set pace for gig economy https://t.co/uu7yWme5Y7 #auto #news,Fri Apr 22 16:54:39 +0000 2016,en,0,False,0,False,,Sam Khoury,Hussamkhoury
You don't have to learn from experience; if you don't mind repeating the course. - Tim Fargo #quote,Fri Apr 22 16:16:14 +0000 2016,en,0,False,0,False,,Sam Khoury,Hussamkhoury
Nike Hints That Its Flyknit Tech Will Be About More Than Shoes https://t.co/WATURwpvrW #tech #entrepreneur #digital #wired,Fri Apr 22 16:12:05 +0000 2016,en,0,False,2,False,,Sam Khoury,Hussamkhoury
Chevrolet remembers Prince with full-page ads https://t.co/raxRmJ6ewt #auto #news,Fri Apr 22 15:55:13 +0000 2016,en,0,False,0,False,,Sam Khoury,Hussamkhoury
"Microsoft, Google agree to drop complaints against each other https://t.co/S7sFDoaKTG #news #technology",Fri Apr 22 15:43:07 +0000 2016,en,1,False,0,False,,Sam Khoury,Hussamkhoury
"EU lawmaker seeks bigger clean tech fund, targeted CO2 permits https://t.co/pNFWn653pr #news #technology",Fri Apr 22 15:43:05 +0000 2016,en,1,False,0,False,,Sam Khoury,Hussamkhoury
Snapchat quietly kills in-app purchase option https://t.co/rIlAltEHD0 #digital #media,Fri Apr 22 15:36:48 +0000 2016,en,0,False,0,False,,Sam Khoury,Hussamkhoury
Get to know San Jose like a local and explore everything Silicon Valley has to offer https://t.co/6yulw0oX0a #entrepreneur #startup #news,Fri Apr 22 15:18:44 +0000 2016,en,0,False,0,False,,Sam Khoury,Hussamkhoury
Dell's cyber security arm SecureWorks down 4.3 percent in debut https://t.co/QJjEhInlQb #news #technology,Fri Apr 22 15:13:07 +0000 2016,en,0,False,0,False,,Sam Khoury,Hussamkhoury
Review: DJI Phantom 4 https://t.co/qciFldEAL7 #tech #entrepreneur #digital #wired,Fri Apr 22 15:11:43 +0000 2016,en,0,False,1,False,,Sam Khoury,Hussamkhoury
Will We Ever Hear the Hundreds of Songs Prince Left Behind? https://t.co/jyfTvXD4F8 #tech #entrepreneur #digital #wired,Fri Apr 22 15:11:43 +0000 2016,en,0,False,1,False,,Sam Khoury,Hussamkhoury
3 ways chat platforms can modernize business culture https://t.co/7zObjAoamV #entrepreneur #startup #news,Fri Apr 22 15:03:37 +0000 2016,en,0,False,0,False,,Sam Khoury,Hussamkhoury
Alphabet stock slips after results but brokerages stay bullish https://t.co/LhsmXH5Hrh #news #technology,Fri Apr 22 14:43:39 +0000 2016,en,0,False,0,False,,Sam Khoury,Hussamkhoury
Catch Up With Everyone in Game of Thrones Before Season 6 https://t.co/59X3zJMuFG #tech #entrepreneur #digital #wired,Fri Apr 22 14:11:43 +0000 2016,en,0,False,0,False,,Sam Khoury,Hussamkhoury
5 Things Teen Entrepreneurs Can Do to Ensure a Lifetime of Success https://t.co/mi3IHXuxiA #startup #entrepreneur,Fri Apr 22 13:55:50 +0000 2016,en,0,False,0,False,,Sam Khoury,Hussamkhoury
Tour the Amazing Workspace of an Audio Gear Wizard https://t.co/zHFs7lgVJo #tech #entrepreneur #digital #wired,Fri Apr 22 13:11:49 +0000 2016,en,0,False,0,False,,Sam Khoury,Hussamkhoury
8 Stunning Photo Galleries of Our Precious Planet https://t.co/h5BrIzKZrG #tech #entrepreneur #digital #wired,Fri Apr 22 13:11:49 +0000 2016,en,0,False,0,False,,Sam Khoury,Hussamkhoury
First Shift: Nissan ad pokes fun at Tesla https://t.co/gzfOQOw1eW #auto #news,Fri Apr 22 12:54:46 +0000 2016,en,0,False,0,False,,Sam Khoury,Hussamkhoury
9 WIRED Stories You Should Read This Earth Day https://t.co/M4PLpLuipc #tech #entrepreneur #digital #wired,Fri Apr 22 12:11:37 +0000 2016,en,1,False,0,False,,Sam Khoury,Hussamkhoury
GOME says opens store on https://t.co/I08e7qTZEJ's China online marketplace https://t.co/0WolFGfv6C #news #technology,Fri Apr 22 11:58:16 +0000 2016,en,1,False,1,False,,Sam Khoury,Hussamkhoury
President of Gabon: The Paris Agreement Is Just the Start of Africa’s Climate Quest https://t.co/7rAdgXc3qB #tech #entrepreneur #digital #…,Fri Apr 22 11:11:33 +0000 2016,en,1,False,0,False,,Sam Khoury,Hussamkhoury
The Ingenious Way Iranians Are Using Satellite TV to Beam in Banned Data https://t.co/r5Wgms8hKl #tech #entrepreneur #digital #wired,Fri Apr 22 11:11:33 +0000 2016,en,1,False,0,False,,Sam Khoury,Hussamkhoury
"Prince, the Only Influence a Musician Will Ever Need https://t.co/s8bw3ceUpv #tech #entrepreneur #digital #wired",Fri Apr 22 11:11:33 +0000 2016,en,1,False,0,False,,Sam Khoury,Hussamkhoury
Infinite Arcade Makes It Dead Simple to Build Your Own Videogames https://t.co/3N8T0VJcb6 #tech #entrepreneur #digital #wired,Fri Apr 22 11:11:32 +0000 2016,en,1,False,0,False,,Sam Khoury,Hussamkhoury
Top Gear’s Stig Schools Us in Racing With … a Go-Kart https://t.co/QAzykbgItN #tech #entrepreneur #digital #wired,Fri Apr 22 11:11:32 +0000 2016,en,1,False,0,False,,Sam Khoury,Hussamkhoury
Facebook’s Making Antennas to Force Everyone to Expand the Internet https://t.co/osAy6JIKcl #tech #entrepreneur #digital #wired,Fri Apr 22 11:11:32 +0000 2016,en,1,False,0,False,,Sam Khoury,Hussamkhoury
"Why Yes, a Cruise for Metalheads Does Include a Mosh Pit in the Pool https://t.co/kEL6gvbtqE #tech #entrepreneur #digital #wired",Fri Apr 22 11:11:31 +0000 2016,en,1,False,0,False,,Sam Khoury,Hussamkhoury
"The Cable Box Is Almost Dead, But Someone Needs to Fix It First https://t.co/NUHFnZZ39P #tech #entrepreneur #digital #wired",Fri Apr 22 10:56:41 +0000 2016,en,0,False,2,False,,Sam Khoury,Hussamkhoury
Nissan ads take a poke at upstart Tesla https://t.co/MQGFWqIKRS #auto #news,Fri Apr 22 10:55:16 +0000 2016,en,0,False,0,False,,Sam Khoury,Hussamkhoury
The Digital Marketing and Start Up Daily is out! https://t.co/h7A6H0Te71 Stories via @welovecreatives @FinchWrites,Fri Apr 22 09:18:59 +0000 2016,en,0,False,0,False,,Sam Khoury,Hussamkhoury
"Toyota counts on big boost from greener, zippier Prius https://t.co/PpNmUF0g0l #auto #news",Fri Apr 22 08:17:45 +0000 2016,en,0,False,0,False,,Sam Khoury,Hussamkhoury
Uber Settlement Doesn’t Really Settle Much of Anything https://t.co/cRyDqKyGtZ #tech #entrepreneur #digital #wired,Fri Apr 22 07:51:29 +0000 2016,en,0,False,0,False,,Sam Khoury,Hussamkhoury
JetSmarter is a Jay Z-backed private jet booking startup wants to be Uber in the sky https://t.co/FIREmi8XT1 #digital #media,Fri Apr 22 05:40:54 +0000 2016,en,0,False,1,False,,Sam Khoury,Hussamkhoury
"Post-paywall, The Sun eyes distributed video on platforms https://t.co/P83WumggX6 #digital #media",Fri Apr 22 05:40:53 +0000 2016,en,0,False,0,False,,Sam Khoury,Hussamkhoury
‘It’s important to have a clear identity’: Mashable’s new content chief discusses the way forward https://t.co/nnaIVeQKDP #digital #media,Fri Apr 22 05:40:52 +0000 2016,en,0,False,0,False,,Sam Khoury,Hussamkhoury
Copyranter: Death sells more than sex these days https://t.co/zGCIG6AHb9 #digital #media,Fri Apr 22 05:40:52 +0000 2016,en,0,False,0,False,,Sam Khoury,Hussamkhoury
3 Musketeens: Can a candy bar make its own YouTube stars? https://t.co/HSMzzEYwPR #digital #media,Fri Apr 22 05:40:51 +0000 2016,en,0,False,0,False,,Sam Khoury,Hussamkhoury
How Instagram’s favorite beauty brand is also winning on Snapchat https://t.co/SiMq9b5dZs #digital #media,Fri Apr 22 05:40:50 +0000 2016,en,0,False,0,False,,Sam Khoury,Hussamkhoury
"Apple's book, film services go dark in China https://t.co/RRBrZFnbHc #news #technology",Fri Apr 22 05:23:53 +0000 2016,en,1,False,0,False,,Sam Khoury,Hussamkhoury
"In Asia, Netflix trips on regulation, content, and competition https://t.co/1fLSjOmLxi #news #technology",Fri Apr 22 05:23:53 +0000 2016,en,1,False,0,False,,Sam Khoury,Hussamkhoury
"""Uber Settles Cases With Concessions, but Drivers Stay Freelancers"" #tech #news @nytimes https://t.co/uXz2EBLggc",Fri Apr 22 04:34:47 +0000 2016,en,0,False,0,False,,Sam Khoury,Hussamkhoury
"""Apple No Longer Immune to China’s Scrutiny of U.S. Tech Firms"" #tech #news @nytimes https://t.co/oUUILBrcw2",Fri Apr 22 04:34:47 +0000 2016,en,0,False,0,False,,Sam Khoury,Hussamkhoury
"""Apps to Build Your Understanding of the Environment"" #tech #news @nytimes https://t.co/HkFxSHLSP6",Fri Apr 22 04:34:46 +0000 2016,en,0,False,1,False,,Sam Khoury,Hussamkhoury
Uber settles major lawsuit over driver employment status https://t.co/KPtyobrkGE #news #technology,Fri Apr 22 03:24:04 +0000 2016,en,0,False,0,False,,Sam Khoury,Hussamkhoury
Congrats Leon Murdock III ! https://t.co/YxMmeYYKqj,Fri Apr 22 02:40:13 +0000 2016,en,0,False,0,False,,Sam Khoury,Hussamkhoury
https://t.co/QIyc8gPsDU,Fri Apr 22 02:38:01 +0000 2016,und,0,False,0,False,,Sam Khoury,Hussamkhoury
How do you explain programmatic to someone who isn't in the industry?,Fri Apr 22 02:17:44 +0000 2016,en,0,False,0,False,,Sam Khoury,Hussamkhoury
"California delays decision on Uber, Lyft car rentals https://t.co/FvgMzm0hVj #auto #news",Fri Apr 22 01:47:44 +0000 2016,en,0,False,0,False,,Sam Khoury,Hussamkhoury
Starbucks mobile order-ahead usage doubles from last year! https://t.co/YwleTP1VXl,Fri Apr 22 01:42:53 +0000 2016,en,0,False,0,False,,Sam Khoury,Hussamkhoury
Google drives majority of paid search ad clicks in Q1 - No one comes close! https://t.co/SqTYDUEEyM,Fri Apr 22 01:37:10 +0000 2016,en,0,False,1,False,,Sam Khoury,Hussamkhoury
"""Alphabet Earnings Miss Forecasts, as a Key Google Ad Metric Stumbles"" #tech #news @nytimes https://t.co/Nju7fUJecY",Fri Apr 22 00:05:31 +0000 2016,en,0,False,0,False,,Sam Khoury,Hussamkhoury
The Best Prince Videos Available on YouTube https://t.co/JgGWoR3ZD8 #tech #entrepreneur #digital #wired,Thu Apr 21 23:52:37 +0000 2016,en,0,False,1,False,,Sam Khoury,Hussamkhoury
Google Isn’t Done Wringing Profits Out of Search Yet https://t.co/W33ncJ51lB #tech #entrepreneur #digital #wired,Thu Apr 21 23:52:36 +0000 2016,en,0,False,1,False,,Sam Khoury,Hussamkhoury
Google’s Parent Company Is Losing Even More Money On Moonshots https://t.co/Qt6lqnCXIc #tech #entrepreneur #digital #wired,Thu Apr 21 23:52:36 +0000 2016,en,0,False,1,False,,Sam Khoury,Hussamkhoury
Pentagon awards HP Enterprise $443 million technology contract https://t.co/wjEn5o7py5 #news #technology,Thu Apr 21 23:26:20 +0000 2016,en,0,False,0,False,,Sam Khoury,Hussamkhoury
SecureWorks raises $120 million in year's first technology IPO https://t.co/5Kn4NPHBDH #news #technology,Thu Apr 21 23:26:19 +0000 2016,en,0,False,0,False,,Sam Khoury,Hussamkhoury
Dealers hope VW deal brings owners back on board https://t.co/9BQfkDHbOI #auto #news,Thu Apr 21 23:21:10 +0000 2016,en,0,False,0,False,,Sam Khoury,Hussamkhoury
New Maps Make Aftershocks Look Scarier Than the Main Quake https://t.co/MrzgEsZX70 #tech #entrepreneur #digital #wired,Thu Apr 21 21:56:45 +0000 2016,en,2,False,2,False,,Sam Khoury,Hussamkhoury
FBI Hints It Paid Hackers $1 Million to Get Into San Bernardino iPhone https://t.co/Uah6wyEeGw #tech #entrepreneur #digital #wired,Thu Apr 21 21:56:44 +0000 2016,en,0,False,0,False,,Sam Khoury,Hussamkhoury
Being 'Authentic' Doesn't Mean You Have to Stay Small https://t.co/naFvPmVP24 #startup #entrepreneur,Thu Apr 21 21:53:35 +0000 2016,en,0,False,0,False,,Sam Khoury,Hussamkhoury
"Facebook changes News Feed to favor time spent, publisher diversity https://t.co/WMMhwn2uX2 #digital #media",Thu Apr 21 21:46:30 +0000 2016,en,0,False,0,False,,Sam Khoury,Hussamkhoury
Alphabet profit misses expectations as cost per clicks falls https://t.co/6c3gTexh9u #news #technology,Thu Apr 21 21:28:36 +0000 2016,fr,0,False,0,False,,Sam Khoury,Hussamkhoury
"Microsoft profit misses estimates, shares fall https://t.co/1d8kNe08Mk #news #technology",Thu Apr 21 21:28:36 +0000 2016,fr,0,False,0,False,,Sam Khoury,Hussamkhoury
"As Microsoft soars on cloud, PC partner Intel seeks lift off https://t.co/JDT2tAVqFc #news #technology",Thu Apr 21 21:28:35 +0000 2016,en,0,False,0,False,,Sam Khoury,Hussamkhoury
"AMD revenue beats, company signs $293 million licensing agreement https://t.co/WX8TVpHFBh #news #technology",Thu Apr 21 21:28:35 +0000 2016,en,0,False,0,False,,Sam Khoury,Hussamkhoury
"Apple Inc. (AAPL) price at close, April 21, 2016, is 105.97.",Thu Apr 21 20:29:08 +0000 2016,en,0,False,0,False,,Sam Khoury,Hussamkhoury
"Alphabet Inc. (GOOG) price at close, April 21, 2016, is 759.14.",Thu Apr 21 20:28:46 +0000 2016,en,0,False,0,False,,Sam Khoury,Hussamkhoury
How This Woman and Her Friends Turned Heartache Into Helpfulness https://t.co/EQP1OyOwDG #startup #entrepreneur,Thu Apr 21 20:17:11 +0000 2016,en,0,False,1,False,,Sam Khoury,Hussamkhoury
AutoNews Now: Options for VW diesel owners  https://t.co/YNTZZcd1wK #auto #news,Thu Apr 21 20:16:19 +0000 2016,en,0,False,0,False,,Sam Khoury,Hussamkhoury
"We’ll Never Understand Prince, and That’s Why We Love Him https://t.co/gy1lEXQClE #tech #entrepreneur #digital #wired",Thu Apr 21 19:51:03 +0000 2016,en,0,False,0,False,,Sam Khoury,Hussamkhoury
Think You Know Everything About Viral Pet Videos? Think Again https://t.co/EhAkDPDSwF #tech #entrepreneur #digital #wired,Thu Apr 21 19:51:02 +0000 2016,en,0,False,1,False,,Sam Khoury,Hussamkhoury
"I Am Alex St. John’s Daughter, and He Is Wrong About Women in Tech https://t.co/EsBn8Egzqj #tech #entrepreneur #digital #wired",Thu Apr 21 19:51:02 +0000 2016,en,0,False,0,False,,Sam Khoury,Hussamkhoury
The Header Bidding Manifesto https://t.co/AMjaeHjuzl #digital #media,Thu Apr 21 19:40:23 +0000 2016,en,0,False,0,False,,Sam Khoury,Hussamkhoury
Letgo’s new tool lets users make blockbuster ads to sell their junk https://t.co/HRycIrfLEX #digital #media,Thu Apr 21 19:40:23 +0000 2016,en,0,False,1,False,,Sam Khoury,Hussamkhoury
Arrogance is the camouflage of insecurity. - Tim Fargo #quote,Thu Apr 21 19:16:40 +0000 2016,en,0,False,0,False,,Sam Khoury,Hussamkhoury
FBI paid more than $1.3 million to break into San Bernardino iPhone  https://t.co/2vYLSgRFWn #news #technology,Thu Apr 21 18:51:07 +0000 2016,en,0,False,0,False,,Sam Khoury,Hussamkhoury
Uber hit with record $11.4 million fine in Pennsylvania https://t.co/HQtn54wPAB #news #technology,Thu Apr 21 18:17:58 +0000 2016,en,0,False,0,False,,Sam Khoury,Hussamkhoury
Toyota partners with Texas Rangers as move to the Lone Star state approaches https://t.co/CD2j6gwuSP #auto #news,Thu Apr 21 18:10:59 +0000 2016,en,0,False,0,False,,Sam Khoury,Hussamkhoury
"Ashley Madison plaintiffs cannot sue anonymously over hack, judge says https://t.co/blcGWNSMj2 #news #technology",Thu Apr 21 17:45:15 +0000 2016,en,0,False,0,False,,Sam Khoury,Hussamkhoury
How Lucasfilm’s Master Foley Artist Perfected the Sounds in Your Favorite Movies https://t.co/mRtQHoFL8a #tech #entrepreneur #digital #wir…,Thu Apr 21 17:42:57 +0000 2016,en,0,False,0,False,,Sam Khoury,Hussamkhoury
Building Your Own Personal Weather Station Is a Breeze https://t.co/cS8dXsZP32 #tech #entrepreneur #digital #wired,Thu Apr 21 17:10:32 +0000 2016,en,0,False,0,False,,Sam Khoury,Hussamkhoury
Change is automatic. Progress is not. - Tony Robbins #quote,Thu Apr 21 16:16:07 +0000 2016,en,0,False,0,False,,Sam Khoury,Hussamkhoury
Rejoice! Matt Damon Is Back in Action in the New Jason Bourne Trailer https://t.co/AiKfhgGJKs #tech #entrepreneur #digital #wired,Thu Apr 21 16:02:40 +0000 2016,en,0,False,1,False,,Sam Khoury,Hussamkhoury
Review: Apple’s New MacBook Is a Gorgeous Laptop With 1 Drawback https://t.co/lBDCK8V11q @TIME https://t.co/SHu5Y7b0Ft,Thu Apr 21 15:43:52 +0000 2016,en,0,False,0,False,,Sam Khoury,Hussamkhoury
"""No Anonymity for Plaintiffs Suing Ashley Madison Over Hack, Judge Rules"" #tech #news @nytimes https://t.co/92sXWnMeEZ",Thu Apr 21 15:43:44 +0000 2016,en,0,False,0,False,,Sam Khoury,Hussamkhoury
The Totally Unnecessary Elegance of Rolls-Royce’s Silent Roof https://t.co/1JOxE0WFVr #tech #entrepreneur #digital #wired,Thu Apr 21 15:26:50 +0000 2016,en,0,False,1,False,,Sam Khoury,Hussamkhoury
Uber overtakes rental cars among business travelers https://t.co/ezv3loSXQu #auto #news,Thu Apr 21 15:22:53 +0000 2016,en,0,False,0,False,,Sam Khoury,Hussamkhoury
Facebook glitch causes pages to automatically like its own posts https://t.co/EzUkXDAOcS #digital #media,Thu Apr 21 15:14:19 +0000 2016,en,0,False,0,False,,Sam Khoury,Hussamkhoury
"Cape Watch: Don’t Worry, Age of Ultron Even Frustrated Joss https://t.co/Oixvzph0Z9 #tech #entrepreneur #digital #wired",Thu Apr 21 14:53:21 +0000 2016,en,0,False,0,False,,Sam Khoury,Hussamkhoury
"AOL co-founder on Mark Zuckerberg, the merger from hell and tech's future https://t.co/PQluIDqKUR #entrepreneur #startup #news",Thu Apr 21 14:35:05 +0000 2016,en,0,False,1,False,,Sam Khoury,Hussamkhoury
Amazon launches Fire tablet in three new colors with higher storage https://t.co/d7RCmZACgC #news #technology,Thu Apr 21 14:23:23 +0000 2016,en,0,False,0,False,,Sam Khoury,Hussamkhoury
"Bangladesh Bank exposed to hackers by cheap switches, no firewall: police https://t.co/qSh6h0cojF #news #technology",Thu Apr 21 14:23:22 +0000 2016,en,0,False,0,False,,Sam Khoury,Hussamkhoury
Lithia Q1 net eases 0.9%; revenue up 11% https://t.co/4kAbQaICzo #auto #news,Thu Apr 21 14:16:03 +0000 2016,en,0,False,0,False,,Sam Khoury,Hussamkhoury
Vodafone invites banks to pitch for $2-2.5 billion Indian IPO: sources https://t.co/tdyPP5idup #news #technology,Thu Apr 21 13:51:00 +0000 2016,en,0,False,0,False,,Sam Khoury,Hussamkhoury
Stop ruining the future https://t.co/ftFJncTbhm #tech #news cnn,Thu Apr 21 13:50:53 +0000 2016,en,0,False,0,False,,Sam Khoury,Hussamkhoury
"Opera browser, sought by Chinese buyers, embeds anti-censorship tool https://t.co/L1KdgGeAA6 #news #technology",Thu Apr 21 12:46:26 +0000 2016,en,0,False,0,False,,Sam Khoury,Hussamkhoury
Philippines arrests tech graduate suspected of hacking poll body's website https://t.co/ksj0OKphW1 #news #technology,Thu Apr 21 12:46:25 +0000 2016,en,0,False,0,False,,Sam Khoury,Hussamkhoury
Verizon's quarterly revenue rises 0.6 percent https://t.co/ZdQNdBfWHR #news #technology,Thu Apr 21 12:13:38 +0000 2016,en,0,False,0,False,,Sam Khoury,Hussamkhoury
China banks approved to invest in high tech firms: regulator  https://t.co/rU87JGmeMb #news #technology,Thu Apr 21 12:13:38 +0000 2016,en,0,False,0,False,,Sam Khoury,Hussamkhoury
Can You Tell These Real Crispr Projects From the Fake Ones? https://t.co/0SZAHZ6gAw #tech #entrepreneur #digital #wired,Thu Apr 21 12:11:26 +0000 2016,en,0,False,0,False,,Sam Khoury,Hussamkhoury
11 tips for creating (or changing) a logo that can grow with your company https://t.co/ZzEnJZSYd6 #entrepreneur #startup #news,Thu Apr 21 11:23:13 +0000 2016,en,0,False,0,False,,Sam Khoury,Hussamkhoury
"EU regulators extend Hutchison, Vimpelcom deal probe by a week https://t.co/4FVhUfFF4y #news #technology",Thu Apr 21 11:12:01 +0000 2016,en,0,False,0,False,,Sam Khoury,Hussamkhoury
Psyched About the Harriet Tubman $20? Prepare to Wait https://t.co/3WIJ3LkPZh #tech #entrepreneur #digital #wired,Thu Apr 21 11:09:15 +0000 2016,en,0,False,1,False,,Sam Khoury,Hussamkhoury
Civil War’s Winter Soldier Couldn’t Survive This Giant Jump https://t.co/76OS1LTixv #tech #entrepreneur #digital #wired,Thu Apr 21 11:09:14 +0000 2016,en,0,False,0,False,,Sam Khoury,Hussamkhoury
See How Your Town’s Transit Stacks Up to Hundreds of Other Cities https://t.co/ExROx1Zdai #tech #entrepreneur #digital #wired,Thu Apr 21 11:09:14 +0000 2016,en,0,False,0,False,,Sam Khoury,Hussamkhoury
Architecture Gets a Little Sweeter When It’s Made of Gum https://t.co/vLjtR29N4j #tech #entrepreneur #digital #wired,Thu Apr 21 11:09:13 +0000 2016,en,0,False,0,False,,Sam Khoury,Hussamkhoury
I Saw the Future of Netflix in a Japanese Reality Show https://t.co/e7Hi5u2G5s #tech #entrepreneur #digital #wired,Thu Apr 21 11:09:13 +0000 2016,en,0,False,1,False,,Sam Khoury,Hussamkhoury
Of Course Congress Is Clueless About Tech—It Killed Its Tutor https://t.co/gNdyitHUdv #tech #entrepreneur #digital #wired,Thu Apr 21 11:09:13 +0000 2016,en,0,False,0,False,,Sam Khoury,Hussamkhoury
"Honda to create green Clarity family with EV, plug-in hybrid variants https://t.co/mO4dFEj541 #auto #news",Thu Apr 21 10:49:05 +0000 2016,en,0,False,0,False,,Sam Khoury,Hussamkhoury
The Digital Marketing and Start Up Daily is out! https://t.co/vdQxDNfAnd Stories via @LondonBizParty,Thu Apr 21 09:18:59 +0000 2016,en,0,False,0,False,,Sam Khoury,Hussamkhoury
Review: Beoplay A1 https://t.co/Ruc5mGr4fg #tech #entrepreneur #digital #wired,Thu Apr 21 08:06:38 +0000 2016,en,0,False,0,False,,Sam Khoury,Hussamkhoury
Volvo sets goal to sell 1 million electrified cars by 2025 https://t.co/dPZ1lS1YU2 #auto #news,Thu Apr 21 07:02:16 +0000 2016,en,0,False,0,False,,Sam Khoury,Hussamkhoury
Lyft's nice-guy strategy leaves it struggling to catch Uber https://t.co/3XsU4CusFY #news #technology,Thu Apr 21 06:38:42 +0000 2016,en,0,False,0,False,,Sam Khoury,Hussamkhoury
It's official: Alibaba is coming to Australia https://t.co/pHipBzZysX,Thu Apr 21 05:06:40 +0000 2016,en,0,False,0,False,,Sam Khoury,Hussamkhoury
"Publishers find Google’s AMP speeds up pages, but ads are still slow https://t.co/InFNyK47az #digital #media",Thu Apr 21 04:25:07 +0000 2016,en,0,False,0,False,,Sam Khoury,Hussamkhoury
Food Network looks to influencers to grow on Snapchat Discover https://t.co/OVXP24E1de #digital #media,Thu Apr 21 04:25:06 +0000 2016,en,0,False,0,False,,Sam Khoury,Hussamkhoury
‘Things don’t go viral by themselves’: Inside the social media manager cabal https://t.co/XaHqkfUgfc #digital #media,Thu Apr 21 04:25:05 +0000 2016,en,0,False,0,False,,Sam Khoury,Hussamkhoury
Why British ad agencies fear leaving the European Union https://t.co/WZPyCtYniG #digital #media,Thu Apr 21 04:25:05 +0000 2016,en,0,False,0,False,,Sam Khoury,Hussamkhoury
Recycling PSA campaign brings live streaming to billboards across the US https://t.co/GicGA2bJLn #digital #media,Thu Apr 21 04:25:04 +0000 2016,en,0,False,0,False,,Sam Khoury,Hussamkhoury
Viral site LittleThings is building a $50 million ad business largely from programmatic https://t.co/FAxQVpFcQP #digital #media,Thu Apr 21 04:25:02 +0000 2016,en,0,False,0,False,,Sam Khoury,Hussamkhoury
‘Think monetization from day one’: Facebook’s tips for publishers using Instant Articles https://t.co/t46ndWOfqX #digital #media,Thu Apr 21 04:25:01 +0000 2016,en,0,False,0,False,,Sam Khoury,Hussamkhoury
Jaguar positions itself as ‘accessible luxury brand’ https://t.co/i6BibhB87b #digital #media,Thu Apr 21 04:24:58 +0000 2016,en,0,False,0,False,,Sam Khoury,Hussamkhoury
Australia PM launches cybersecurity campaign https://t.co/kbllX8TQHq #news #technology,Thu Apr 21 04:08:09 +0000 2016,en,3,False,1,False,,Sam Khoury,Hussamkhoury
Alibaba's Ma pledges not to interfere in SCMP editorial independence https://t.co/6TTCQzvc3r #news #technology,Thu Apr 21 03:38:06 +0000 2016,en,1,False,1,False,,Sam Khoury,Hussamkhoury
"VW Will Buy Back Your Cheating, Polluting Diesel https://t.co/dStHe6mm9K #tech #entrepreneur #digital #wired",Thu Apr 21 01:36:02 +0000 2016,en,0,False,0,False,,Sam Khoury,Hussamkhoury
Belgian mothers launch smartphone app for babysitters https://t.co/R6dTrX37hQ #news #technology,Thu Apr 21 00:38:47 +0000 2016,en,0,False,2,False,,Sam Khoury,Hussamkhoury
"""Down To Lunch Founders Pursue Less-Traveled Path to Success"" #tech #news @nytimes https://t.co/b4qY7fwUFM",Wed Apr 20 23:50:49 +0000 2016,en,0,False,0,False,,Sam Khoury,Hussamkhoury
Apple postpones reporting results by a day https://t.co/q8kRw5O9t7 #news #technology,Wed Apr 20 23:11:12 +0000 2016,en,0,False,0,False,,Sam Khoury,Hussamkhoury
EU Accuses Google of Antitrust Violations Over Android https://t.co/Q1WeF3lpJ8 #tech #entrepreneur #digital #wired,Wed Apr 20 22:38:38 +0000 2016,en,0,False,0,False,,Sam Khoury,Hussamkhoury
10 Qualities You Need to Keep Your Virtual Assistant Clients Happy https://t.co/wuLZyaXPgv #startup #entrepreneur,Wed Apr 20 22:06:13 +0000 2016,en,0,False,0,False,,Sam Khoury,Hussamkhoury
How Entrepreneurs Can Capitalize On Their Alma Mater https://t.co/x5Pb8LATmN #startup #entrepreneur,Wed Apr 20 22:06:13 +0000 2016,en,0,False,1,False,,Sam Khoury,Hussamkhoury
