Text,Created Date,Language,Retweet Count,Retweeted,Favorite Count,Favorited,co-ordinates,Tweeted By,Screen Name
Thiemo Rusch https://t.co/vHyMemH2Bo #auto #news,Mon Apr 11 04:17:21 +0000 2016,en,0,False,0,False,,Sam Khoury,Hussamkhoury
Derrick Hatami https://t.co/AjmoXFb0Bd #auto #news,Mon Apr 11 04:17:20 +0000 2016,en,0,False,0,False,,Sam Khoury,Hussamkhoury
1 million used-sales year for CarMax https://t.co/wnmdwrtrus #auto #news,Mon Apr 11 04:17:20 +0000 2016,en,0,False,0,False,,Sam Khoury,Hussamkhoury
Fleet sales soar in March https://t.co/KnB7qHd4GV #auto #news,Mon Apr 11 04:17:19 +0000 2016,en,0,False,0,False,,Sam Khoury,Hussamkhoury
Dealers start April with normal supply of vehicles https://t.co/nC94g1lDkf #auto #news,Mon Apr 11 04:17:19 +0000 2016,en,0,False,0,False,,Sam Khoury,Hussamkhoury
Locals hope tax hike will help Japan's auto sales https://t.co/cmxqKkPq1s #auto #news,Mon Apr 11 04:17:18 +0000 2016,en,0,False,0,False,,Sam Khoury,Hussamkhoury
Penske: Punching a problem? Slow the inventory; 'get the right mix' https://t.co/5xXN28nNlK #auto #news,Mon Apr 11 04:17:17 +0000 2016,en,0,False,0,False,,Sam Khoury,Hussamkhoury
Porsche Macan grounded in 13 CARB states https://t.co/wHKi7Jmrx7 #auto #news,Mon Apr 11 04:17:17 +0000 2016,en,0,False,0,False,,Sam Khoury,Hussamkhoury
Audi to focus on dealer profitability and an increased marketing spend https://t.co/1UmpAGD0hH #auto #news,Mon Apr 11 04:17:16 +0000 2016,en,0,False,1,False,,Sam Khoury,Hussamkhoury
Hyundai dealers get more crossovers https://t.co/Nspw0OhcWr #auto #news,Mon Apr 11 04:17:15 +0000 2016,en,0,False,0,False,,Sam Khoury,Hussamkhoury
China's auto market: House of cards or just catching its breath? https://t.co/kEU1J8tgLP #auto #news,Mon Apr 11 04:17:15 +0000 2016,en,0,False,0,False,,Sam Khoury,Hussamkhoury
Cadillac dealer-pay details due this summer https://t.co/76NFUJcEkR #auto #news,Mon Apr 11 04:17:14 +0000 2016,en,0,False,0,False,,Sam Khoury,Hussamkhoury
Mitsubishi promises a turbocharged future https://t.co/qGLbrBcrui #auto #news,Mon Apr 11 04:17:14 +0000 2016,es,0,False,0,False,,Sam Khoury,Hussamkhoury
"Pull-ahead, CPO leasing will help manage BMW off-lease volume https://t.co/5nfHtyQBXw #auto #news",Mon Apr 11 04:17:13 +0000 2016,en,0,False,0,False,,Sam Khoury,Hussamkhoury
Carter:  Toyota's bullish on U.S. sales https://t.co/2bLdlBpCOa #auto #news,Mon Apr 11 04:17:13 +0000 2016,en,0,False,0,False,,Sam Khoury,Hussamkhoury
"Subaru's Doll: ""Now is the time to get your house in order' https://t.co/ywUmX0opm5 #auto #news",Mon Apr 11 04:17:12 +0000 2016,en,0,False,0,False,,Sam Khoury,Hussamkhoury
"GM plans for more dealerships  to be owned by minorities, women https://t.co/jaalzfcHyV #auto #news",Mon Apr 11 04:17:12 +0000 2016,en,0,False,0,False,,Sam Khoury,Hussamkhoury
Kitty Van Bortel is Time dealer of the year https://t.co/ax00IS6zRO #auto #news,Mon Apr 11 04:17:11 +0000 2016,en,0,False,0,False,,Sam Khoury,Hussamkhoury
Dealers want to help luring customers to the Mazda3 https://t.co/l4RgphWOtT #auto #news,Mon Apr 11 04:17:11 +0000 2016,en,0,False,0,False,,Sam Khoury,Hussamkhoury
Mini is pushing its brand awareness in new ways https://t.co/s0PzfUyID3 #auto #news,Mon Apr 11 04:17:10 +0000 2016,en,0,False,0,False,,Sam Khoury,Hussamkhoury
From hit counters to cross-channel: The evolution of the pageview https://t.co/eqsbUuz3zN #digital #media,Mon Apr 11 04:13:39 +0000 2016,en,0,False,0,False,,Sam Khoury,Hussamkhoury
‘I feel like my granddad with a VHS’:  UK agency Gen Xers on Snapchat https://t.co/KubPi8Hpoh #digital #media,Mon Apr 11 04:13:38 +0000 2016,en,0,False,0,False,,Sam Khoury,Hussamkhoury
The changes the ad industry expects if Verizon buys Yahoo https://t.co/pZw2NMJgQF #digital #media,Mon Apr 11 04:13:37 +0000 2016,en,0,False,0,False,,Sam Khoury,Hussamkhoury
ModCloth and other online retailers want to shake up the traditional bridal gown industry https://t.co/BYUHw1enPD #digital #media,Mon Apr 11 04:13:37 +0000 2016,en,0,False,0,False,,Sam Khoury,Hussamkhoury
The publisher’s guide to mass layoffs https://t.co/x4Od4pwSlc #digital #media,Mon Apr 11 04:13:36 +0000 2016,en,0,False,0,False,,Sam Khoury,Hussamkhoury
Reality check: Video won’t save the day for digital publishers desperate for growth https://t.co/y1LZmCBqYc #digital #media,Mon Apr 11 04:13:36 +0000 2016,en,0,False,0,False,,Sam Khoury,Hussamkhoury
Day in the Life: What Burger King’s community manager does https://t.co/sgcXef717n #digital #media,Mon Apr 11 04:13:34 +0000 2016,en,0,False,0,False,,Sam Khoury,Hussamkhoury
This New Suicide Squad Trailer Isn’t Joker-ing Around https://t.co/Ej9d8yeC2u #tech #entrepreneur #digital #wired,Mon Apr 11 03:20:42 +0000 2016,en,0,False,1,False,,Sam Khoury,Hussamkhoury
"""Intuit Sheds Its PC Roots and Rises as a Cloud Software Company"" #tech #news @nytimes https://t.co/jDxs7wgTsd",Mon Apr 11 03:09:37 +0000 2016,en,0,False,0,False,,Sam Khoury,Hussamkhoury
RT @CrowdBoarders: @Hussamkhoury Love #technology? A social network where you can invest in tech startups: https://t.co/ZDCK6MjC8f,Mon Apr 11 01:43:47 +0000 2016,en,1,False,0,False,,Sam Khoury,Hussamkhoury
The Strange Case of the Woman Who Can’t Remember Her Past—Or Imagine Her Future https://t.co/3gyTZhXmwZ #tech #entrepreneur #digital #wired,Mon Apr 11 00:21:41 +0000 2016,en,0,False,1,False,,Sam Khoury,Hussamkhoury
Exquisite Origami … Made Out of Human Faces https://t.co/t2UsvcVuse #tech #entrepreneur #digital #wired,Mon Apr 11 00:21:40 +0000 2016,en,0,False,0,False,,Sam Khoury,Hussamkhoury
Tech start-ups snap at the heels of Asian private bankers https://t.co/KIjmYk9A7N #news #technology,Sun Apr 10 23:36:52 +0000 2016,en,1,False,2,False,,Sam Khoury,Hussamkhoury
Daily Mail parent in talks with private equity for Yahoo bid: WSJ https://t.co/Pj7Hq3mBpw #news #technology,Sun Apr 10 22:50:44 +0000 2016,en,0,False,0,False,,Sam Khoury,Hussamkhoury
"""Billing by Millionths of Pennies, Cloud Computing’s Giants Take In Billions"" #tech #news @nytimes https://t.co/FqlQxKNumS",Sun Apr 10 19:19:27 +0000 2016,en,0,False,0,False,,Sam Khoury,Hussamkhoury
Discipline is just choosing between what you want now and what you want most. - Unknown #quote,Sun Apr 10 19:16:10 +0000 2016,en,0,False,0,False,,Sam Khoury,Hussamkhoury
Ideas are easy. Implementation is hard. – Guy Kawasaki #quote #entrepreneur #startup,Sun Apr 10 16:16:23 +0000 2016,en,0,False,1,False,,Sam Khoury,Hussamkhoury
"RT @intlspectator: PREDICTION: US Presidential election, 2016.

Clinton: 54%
Trump: 21%
Cruz: 15%
Sanders: 10% https://t.co/rZXyyu7Kjh",Sun Apr 10 14:10:27 +0000 2016,en,413,False,0,False,,Sam Khoury,Hussamkhoury
What’s Inside That Magical Anti-Tangle Hair Spray https://t.co/L4gnX3E113 #tech #entrepreneur #digital #wired,Sun Apr 10 11:13:39 +0000 2016,en,0,False,0,False,,Sam Khoury,Hussamkhoury
While You Were Offline: #HillarySoQualified Quickly Turns Into #HashtagSoHijacked https://t.co/DfkJs7dj4o #tech #entrepreneur #digital #wi…,Sun Apr 10 11:13:39 +0000 2016,en,0,False,1,False,,Sam Khoury,Hussamkhoury
Layer3 TV’s Crazy Plan to Take on Comcast and Reinvent Cable https://t.co/9UJujPgDtt #tech #entrepreneur #digital #wired,Sun Apr 10 11:13:39 +0000 2016,en,0,False,0,False,,Sam Khoury,Hussamkhoury
"Come to Hong Kong for the Culture, Stay for the Enormous Laser Show https://t.co/oCmgq2mReX #tech #entrepreneur #digital #wired",Sun Apr 10 11:13:38 +0000 2016,en,0,False,0,False,,Sam Khoury,Hussamkhoury
"Outlander Is Back, But the Sex Isn’t—Yet https://t.co/ViNCxz22s5 #tech #entrepreneur #digital #wired",Sun Apr 10 11:13:38 +0000 2016,en,0,False,0,False,,Sam Khoury,Hussamkhoury
"If Smiling Made a Noise, This Is What It’d Sound Like https://t.co/eqwiNkGlRc #tech #entrepreneur #digital #wired",Sun Apr 10 11:13:38 +0000 2016,en,0,False,0,False,,Sam Khoury,Hussamkhoury
The Digital Marketing and Start Up Daily is out! https://t.co/MNjQJKvL53,Sun Apr 10 09:19:00 +0000 2016,en,0,False,0,False,,Sam Khoury,Hussamkhoury
"Japan government, Toyota, Nissan to step up efforts on intelligent maps: Nikkei https://t.co/X0JrGD1dw3 #news #technology",Sun Apr 10 06:52:29 +0000 2016,en,1,False,1,False,,Sam Khoury,Hussamkhoury
Watch live: Showtime CMO Don Buckley on how the cable giant is listening to its audience https://t.co/LyO03WSblf #digital #media,Sun Apr 10 05:00:00 +0000 2016,en,0,False,0,False,,Sam Khoury,Hussamkhoury
Dealer puts VW crisis on camera https://t.co/gqTXfWAcVh #auto #news,Sun Apr 10 04:19:56 +0000 2016,en,0,False,0,False,,Sam Khoury,Hussamkhoury
"RT @MagnificHQ: @Hussamkhoury Sam, you're one of the coolest on Twitter for following me (haha). Anything I can help with just ask! 🎩🍸🐈✔️",Sat Apr 09 19:48:00 +0000 2016,en,1,False,0,False,,Sam Khoury,Hussamkhoury
"""The Week in Tech: Facebook Live, a More Civil Reddit and Yahoo’s Odd Deal-Making"" #tech #news @nytimes https://t.co/JrHbmwZJYP",Sat Apr 09 19:36:11 +0000 2016,en,0,False,0,False,,Sam Khoury,Hussamkhoury
"Stay committed to your decisions, but stay flexible in your approach. - Tony Robbins #quote",Sat Apr 09 19:16:15 +0000 2016,en,0,False,0,False,,Sam Khoury,Hussamkhoury
A person who never made a mistake never tried anything new. – Albert Einstein #quote,Sat Apr 09 16:16:20 +0000 2016,en,0,False,0,False,,Sam Khoury,Hussamkhoury
https://t.co/mbxNP2Kaj7,Sat Apr 09 13:57:45 +0000 2016,und,0,False,0,False,,Sam Khoury,Hussamkhoury
4 ways colleges can empower student entrepreneurs to change the world https://t.co/f0NZJScDQj #entrepreneur #startup #news,Sat Apr 09 12:19:44 +0000 2016,en,0,False,0,False,,Sam Khoury,Hussamkhoury
A Map of the Brain Could Teach Machines to See Like You https://t.co/hN5UD5JDmQ #tech #entrepreneur #digital #wired,Sat Apr 09 11:12:46 +0000 2016,en,0,False,0,False,,Sam Khoury,Hussamkhoury
Orphan Black Doesn’t Think Human Cloning Is Such a Big Deal https://t.co/mUwtjPZ4qg #tech #entrepreneur #digital #wired,Sat Apr 09 11:12:45 +0000 2016,en,0,False,0,False,,Sam Khoury,Hussamkhoury
Space Photos of the Week: A Star Proves It’s Hip to Be Square https://t.co/yvwWu9JdsL #tech #entrepreneur #digital #wired,Sat Apr 09 11:12:45 +0000 2016,en,0,False,0,False,,Sam Khoury,Hussamkhoury
Security This Week: The Panama Papers Law Firm Had Seriously Shoddy Security https://t.co/2Qh49YlV4C #tech #entrepreneur #digital #wired,Sat Apr 09 11:12:44 +0000 2016,en,0,False,0,False,,Sam Khoury,Hussamkhoury
Beyond the Panama Papers: See Inside the World’s Tax Havens https://t.co/3QKxwxluAJ #tech #entrepreneur #digital #wired,Sat Apr 09 11:12:44 +0000 2016,en,0,False,0,False,,Sam Khoury,Hussamkhoury
The Digital Marketing and Start Up Daily is out! https://t.co/QWE0wJHOGi Stories via @sarahdruetlamy,Sat Apr 09 09:19:00 +0000 2016,en,0,False,0,False,,Sam Khoury,Hussamkhoury
"""Amazon Encounters a Bumpy Road in India"" #tech #news @nytimes https://t.co/74JJ8J9hAP",Sat Apr 09 07:03:19 +0000 2016,en,0,False,0,False,,Sam Khoury,Hussamkhoury
Porsche will keep its 15% margin target despite high EV investments https://t.co/SA1i0kMC4b #auto #news,Sat Apr 09 05:10:06 +0000 2016,en,0,False,0,False,,Sam Khoury,Hussamkhoury
Dissecting all those preorders for Tesla's Model 3 (and where the cash goes) https://t.co/UnLV3aA99M #auto #news,Sat Apr 09 05:10:05 +0000 2016,en,0,False,0,False,,Sam Khoury,Hussamkhoury
EchoPark will expand to Texas and the Carolinas https://t.co/StQaBN9Uv2 #auto #news,Sat Apr 09 05:10:05 +0000 2016,en,0,False,0,False,,Sam Khoury,Hussamkhoury
Chrysler enlists a deadpan comedian to pitch Pacifica to new audience https://t.co/v9vRCatB4r #auto #news,Sat Apr 09 05:10:04 +0000 2016,en,0,False,0,False,,Sam Khoury,Hussamkhoury
#Tripadvisor leads the way in mobile traffic among travel sites https://t.co/PCpCNgcw7x,Sat Apr 09 04:31:20 +0000 2016,en,0,False,1,False,,Sam Khoury,Hussamkhoury
#SpaceX rocket booster makes breakthrough landing at sea  https://t.co/uH6tJW3hcT,Sat Apr 09 04:29:25 +0000 2016,en,0,False,0,False,,Sam Khoury,Hussamkhoury
"WTF Download: Programmatic, OTT, Upfronts, NewFronts, OMG https://t.co/f2fV3UiKR5 #digital #media",Sat Apr 09 04:22:27 +0000 2016,en,1,False,0,False,,Sam Khoury,Hussamkhoury
"Your instincts won’t improve conversion rates, but this data will https://t.co/1UidgbNBg7 #digital #media",Sat Apr 09 04:22:26 +0000 2016,en,0,False,0,False,,Sam Khoury,Hussamkhoury
SpaceX Just Stuck a Historic Landing. So What Now? https://t.co/3PDnl5PXZ5 #tech #entrepreneur #digital #wired,Sat Apr 09 01:40:52 +0000 2016,en,0,False,0,False,,Sam Khoury,Hussamkhoury
4 Questions Entrepreneurs Should Ask Their 401(K) Providers https://t.co/Eyf8URwUjD #startup #entrepreneur,Sat Apr 09 00:08:13 +0000 2016,en,0,False,0,False,,Sam Khoury,Hussamkhoury
7 TV Shows with Fewer Viewers Than BuzzFeed’s Exploding Watermelon Video https://t.co/dShnjp8Gek #tech #entrepreneur #digital #wired,Sat Apr 09 00:08:11 +0000 2016,en,0,False,0,False,,Sam Khoury,Hussamkhoury
Gadget Lab Podcast: VR Is Finally Here. So Now What? https://t.co/82PTJXdkht #tech #entrepreneur #digital #wired,Fri Apr 08 23:16:37 +0000 2016,en,0,False,0,False,,Sam Khoury,Hussamkhoury
SAP first-quarter results fall short as U.S. license sales slow https://t.co/QwxtRwrnic #news #technology,Fri Apr 08 22:48:50 +0000 2016,en,0,False,0,False,,Sam Khoury,Hussamkhoury
Sony’s PlayStation VR Headset Is Already Pretty Amazing https://t.co/MTRVeLbASq @TIME https://t.co/U3wVNE0ABp,Fri Apr 08 22:08:31 +0000 2016,en,0,False,0,False,,Sam Khoury,Hussamkhoury
'How did I get here?' People react appropriately to watermelon explosion https://t.co/DoXR5N6VN7 #entrepreneur #startup #news,Fri Apr 08 21:53:43 +0000 2016,en,0,False,1,False,,Sam Khoury,Hussamkhoury
SpaceX’s Rocket Victorious Over Robot Boat at Last https://t.co/xcRQV4zHlS #tech #entrepreneur #digital #wired,Fri Apr 08 21:47:11 +0000 2016,en,0,False,0,False,,Sam Khoury,Hussamkhoury
Crown Castle buys Tower Development Corp for $461 million https://t.co/JQMyoXmDAc #news #technology,Fri Apr 08 21:19:24 +0000 2016,en,0,False,0,False,,Sam Khoury,Hussamkhoury
Game|Life Podcast: Our Favorite VR Experiences So Far https://t.co/uFdHfwhJ3H #tech #entrepreneur #digital #wired,Fri Apr 08 21:17:46 +0000 2016,en,0,False,0,False,,Sam Khoury,Hussamkhoury
"Automakers, safety advocates warn U.S. over rush to deploy autonomous cars https://t.co/Pb0rPGs8oo #auto #news",Fri Apr 08 20:57:47 +0000 2016,en,0,False,0,False,,Sam Khoury,Hussamkhoury
"Review: The Razer Blade Stealth Is a Gorgeous, Ultra-Thin Windows Laptop https://t.co/szIbbhBjWQ @TIME https://t.co/4gzX3TcMS4",Fri Apr 08 20:51:20 +0000 2016,en,0,False,0,False,,Sam Khoury,Hussamkhoury
"Apple Inc. (AAPL) price at close, April 08, 2016, is 108.66.",Fri Apr 08 20:34:57 +0000 2016,en,0,False,0,False,,Sam Khoury,Hussamkhoury
"Alphabet Inc. (GOOG) price at close, April 08, 2016, is 739.15.",Fri Apr 08 20:34:20 +0000 2016,en,0,False,0,False,,Sam Khoury,Hussamkhoury
Leak of Senate encryption bill prompts swift backlash https://t.co/kANKIdb9Va #news #technology,Fri Apr 08 20:16:53 +0000 2016,en,1,False,0,False,,Sam Khoury,Hussamkhoury
Automaker group warns timetable for self-driving vehicle guidance too aggressive https://t.co/LepP6tjAYh #news #technology,Fri Apr 08 20:01:06 +0000 2016,en,0,False,0,False,,Sam Khoury,Hussamkhoury
Radioactive Reindeer Roam Norway 30 Years After Chernobyl https://t.co/JqokKttfLO #tech #entrepreneur #digital #wired,Fri Apr 08 19:59:27 +0000 2016,en,0,False,0,False,,Sam Khoury,Hussamkhoury
BMW to Launch Car-Sharing Service in U.S. https://t.co/vgF152Gn14 @TIME https://t.co/s767wvg2ml,Fri Apr 08 19:48:47 +0000 2016,en,0,False,0,False,,Sam Khoury,Hussamkhoury
"At the Skywalker Sound Lab, Sometimes You Gotta Think Like a Bunny https://t.co/L8pPLaOo69 #tech #entrepreneur #digital #wired",Fri Apr 08 19:42:43 +0000 2016,en,0,False,0,False,,Sam Khoury,Hussamkhoury
The Feds Battle With Apple Isn’t Over—It’s Just Moved to New York https://t.co/1MebeXURsl #tech #entrepreneur #digital #wired,Fri Apr 08 19:42:43 +0000 2016,en,0,False,0,False,,Sam Khoury,Hussamkhoury
Who is attending programmatic io in San francisco next week? Message me to schedule a time to meet.,Fri Apr 08 19:26:05 +0000 2016,en,0,False,0,False,,Sam Khoury,Hussamkhoury
People lose their way when they lose their why.- Michael Hyatt #quote,Fri Apr 08 19:16:16 +0000 2016,en,0,False,0,False,,Sam Khoury,Hussamkhoury
Your Expert Guide For Using Facebook Live https://t.co/xs69s8Al8q @TIME https://t.co/xclOi7oluU,Fri Apr 08 19:03:27 +0000 2016,en,0,False,0,False,,Sam Khoury,Hussamkhoury
AutoNews Now: A rising star's vision for Mercedes https://t.co/XRI01Kfi9E #auto #news,Fri Apr 08 18:55:10 +0000 2016,en,0,False,0,False,,Sam Khoury,Hussamkhoury
This Tool Makes Turning Data Into Charts Stupid Simple https://t.co/pT6986JzTW #tech #entrepreneur #digital #wired,Fri Apr 08 18:41:50 +0000 2016,en,0,False,0,False,,Sam Khoury,Hussamkhoury
"Dang, the Death Star Is Coming Together Quick in the New Star Wars Trailer https://t.co/qHJV0XCEcy #tech #entrepreneur #digital #wired",Fri Apr 08 17:57:46 +0000 2016,en,0,False,0,False,,Sam Khoury,Hussamkhoury
BMW relaunches U.S. car-sharing program as ReachNow https://t.co/S2o65ZiUiE #auto #news,Fri Apr 08 17:55:44 +0000 2016,en,0,False,0,False,,Sam Khoury,Hussamkhoury
Feds Will Renew Apple Encryption Fight in Brooklyn iPhone Case https://t.co/B6YFoXv5NF @TIME https://t.co/7N07b7bt47,Fri Apr 08 17:48:51 +0000 2016,en,0,False,0,False,,Sam Khoury,Hussamkhoury
Which industries are the most digital? https://t.co/RQjskDu9B5,Fri Apr 08 17:16:48 +0000 2016,en,0,False,0,False,,Sam Khoury,Hussamkhoury
One Of These Designs Will Be The Tokyo 2020 Olympics Logo https://t.co/glrujEKFgy #tech #entrepreneur #digital #wired,Fri Apr 08 16:58:19 +0000 2016,en,0,False,0,False,,Sam Khoury,Hussamkhoury
NXP Semiconductor weighing sale of standard products business: Bloomberg https://t.co/6QHGdYYrd5 #news #technology,Fri Apr 08 16:44:55 +0000 2016,en,0,False,0,False,,Sam Khoury,Hussamkhoury
Bosch considers stake in digital mapping company HERE https://t.co/tdY7WehmZm #news #technology,Fri Apr 08 16:44:55 +0000 2016,en,0,False,0,False,,Sam Khoury,Hussamkhoury
Call of the Starseed Is a Riveting (if Brief) VR Adventure https://t.co/rhydp40Mrp #tech #entrepreneur #digital #wired,Fri Apr 08 16:28:32 +0000 2016,en,0,False,0,False,,Sam Khoury,Hussamkhoury
"""2 Twitter Directors to Be Replaced"" #tech #news @nytimes https://t.co/1KyK3gZhRP",Fri Apr 08 16:19:34 +0000 2016,en,0,False,0,False,,Sam Khoury,Hussamkhoury
Don't ask God to guide your footsteps if you're not willing to move your feet. - Unknown #quote,Fri Apr 08 16:16:13 +0000 2016,en,0,False,0,False,,Sam Khoury,Hussamkhoury
"PlayStation 4 Can Stream to PC, But I Wish It Worked Better https://t.co/EOK6WC4GH1 #tech #entrepreneur #digital #wired",Fri Apr 08 16:13:14 +0000 2016,en,0,False,0,False,,Sam Khoury,Hussamkhoury
Why I’m Not Replacing My Computer With a Tablet https://t.co/KwJ2VvxmSA @TIME https://t.co/PIWX92RZJR,Fri Apr 08 16:03:33 +0000 2016,en,0,False,0,False,,Sam Khoury,Hussamkhoury
The Senate’s Draft Encryption Bill Is a Privacy Nightmare https://t.co/us7q7VKASW #tech #entrepreneur #digital #wired,Fri Apr 08 15:40:26 +0000 2016,en,0,False,0,False,,Sam Khoury,Hussamkhoury
Twitter overhauls its board to be more than a 'country club of old white guys' https://t.co/ZT8q2rphQV #entrepreneur #startup #news,Fri Apr 08 15:31:34 +0000 2016,en,0,False,1,False,,Sam Khoury,Hussamkhoury
You Should Update Adobe Flash Right Now https://t.co/zWwXgnhKya @TIME https://t.co/WbFa13idfN,Fri Apr 08 15:31:12 +0000 2016,en,0,False,0,False,,Sam Khoury,Hussamkhoury
U.S. to continue appeal of iPhone data case in N.Y https://t.co/4GH9mpHzaY #news #technology,Fri Apr 08 15:27:07 +0000 2016,en,0,False,0,False,,Sam Khoury,Hussamkhoury
Take a 360-Degree Tour Through 25 Years of Ai Weiwei’s Art https://t.co/X2qZ9hJI4R #tech #entrepreneur #digital #wired,Fri Apr 08 15:25:46 +0000 2016,en,0,False,0,False,,Sam Khoury,Hussamkhoury
SpaceX launch to send expandable habitat to ISS https://t.co/d22rP4udQW #tech #news cnn,Fri Apr 08 15:11:38 +0000 2016,en,1,False,0,False,,Sam Khoury,Hussamkhoury
Read the Pope’s Advice on Using Your Smartphone Before Bed https://t.co/WdsikPWmUm @TIME https://t.co/aNIbQfkEvc,Fri Apr 08 15:00:50 +0000 2016,en,0,False,0,False,,Sam Khoury,Hussamkhoury
Russia's March car sales drop 10% as decline slows https://t.co/JqrfO1LRz0 #auto #news,Fri Apr 08 14:53:15 +0000 2016,en,0,False,0,False,,Sam Khoury,Hussamkhoury
Apple’s Cookie Monster Blooper Reel Will Melt Your Heart https://t.co/uz4Pd1RdGN @TIME https://t.co/O8KKrnhbnk,Fri Apr 08 14:30:33 +0000 2016,en,0,False,0,False,,Sam Khoury,Hussamkhoury
This Is Exactly What Not To Do When You Find a USB Stick https://t.co/rucnXs82yl @TIME https://t.co/zr9CO0Y3FR,Fri Apr 08 14:15:30 +0000 2016,en,0,False,0,False,,Sam Khoury,Hussamkhoury
Twitter appoints Hugh Johnston and Martha Lane Fox to its board https://t.co/mD2ZDdVY0O #news #technology,Fri Apr 08 14:11:30 +0000 2016,en,0,False,0,False,,Sam Khoury,Hussamkhoury
Interesting... https://t.co/LQcEVYu0Pa,Fri Apr 08 14:09:32 +0000 2016,en,0,False,0,False,,Sam Khoury,Hussamkhoury
"Expandable modules, cabbage headed to space station https://t.co/KlGahOO3bi #tech #news cnn",Fri Apr 08 13:55:32 +0000 2016,en,0,False,0,False,,Sam Khoury,Hussamkhoury
'There's no more land' https://t.co/z0IQMhjSk7 #tech #news cnn,Fri Apr 08 13:55:31 +0000 2016,en,0,False,0,False,,Sam Khoury,Hussamkhoury
Shades Are So 2015. These Airplane Windows Tint Themselves https://t.co/92lma91kX7 #tech #entrepreneur #digital #wired,Fri Apr 08 13:38:56 +0000 2016,en,0,False,0,False,,Sam Khoury,Hussamkhoury
SpaceX’s 0-for-5 Rocket Tries Yet Another Ocean Landing https://t.co/tqYRj91HRf #tech #entrepreneur #digital #wired,Fri Apr 08 13:38:56 +0000 2016,en,0,False,0,False,,Sam Khoury,Hussamkhoury
Bollore's London electric car club scheme faces delay https://t.co/vmmKnSqduk #news #technology,Fri Apr 08 13:25:29 +0000 2016,en,0,False,0,False,,Sam Khoury,Hussamkhoury
Yahoo extends deadline for bids by a week: Re/code https://t.co/SFam2d945p #news #technology,Fri Apr 08 13:25:28 +0000 2016,en,0,False,0,False,,Sam Khoury,Hussamkhoury
My Flight With the Wannabe Space Pilots of the Mojave https://t.co/Tehu4MazcH #tech #entrepreneur #digital #wired,Fri Apr 08 12:24:21 +0000 2016,en,0,False,0,False,,Sam Khoury,Hussamkhoury
Facebook opens to the door to branded content from top publishers https://t.co/xS9f1sEMft #digital #media,Fri Apr 08 12:02:52 +0000 2016,en,0,False,0,False,,Sam Khoury,Hussamkhoury
The $15 Minimum Wage Wins Where Silicon Valley Fails Hard https://t.co/k3zzC7RUMu #tech #entrepreneur #digital #wired,Fri Apr 08 11:23:55 +0000 2016,en,0,False,0,False,,Sam Khoury,Hussamkhoury
Facebook’s Plan to Stop People From Livestreaming Sex? You. https://t.co/WJudXjiQCx #tech #entrepreneur #digital #wired,Fri Apr 08 11:23:55 +0000 2016,en,0,False,0,False,,Sam Khoury,Hussamkhoury
You Know What? You Were Right to Stay a Star Wars Fan All Those Years https://t.co/qLk66nOokn #tech #entrepreneur #digital #wired,Fri Apr 08 11:23:54 +0000 2016,en,0,False,0,False,,Sam Khoury,Hussamkhoury
The Ruins and Lovely Landscapes of Soviet Nuke Sites https://t.co/wNQlipGUer #tech #entrepreneur #digital #wired,Fri Apr 08 11:23:54 +0000 2016,en,0,False,0,False,,Sam Khoury,Hussamkhoury
"The Pockulus VR Headset May Look Funky, But It’s Only $49 https://t.co/I4QKM8uhVM #tech #entrepreneur #digital #wired",Fri Apr 08 11:23:53 +0000 2016,en,0,False,0,False,,Sam Khoury,Hussamkhoury
How Microsoft Conjured Up Real-Life Star Wars Holograms https://t.co/b6OrwCWEWo #tech #entrepreneur #digital #wired,Fri Apr 08 10:54:32 +0000 2016,en,0,False,0,False,,Sam Khoury,Hussamkhoury
Why Our Crazy-Smart AI Still Sucks at Transcribing Speech https://t.co/Az62yFTt1W #tech #entrepreneur #digital #wired,Fri Apr 08 10:08:42 +0000 2016,en,0,False,1,False,,Sam Khoury,Hussamkhoury
U.S. says China internet censorship a burden for businesses https://t.co/TNIaYONIl0 #news #technology,Fri Apr 08 09:25:41 +0000 2016,en,0,False,0,False,,Sam Khoury,Hussamkhoury
The Digital Marketing and Start Up Daily is out! https://t.co/NdZnXLiIDb Stories via @Every_Social @edynamic @VeilleDeCM,Fri Apr 08 09:18:59 +0000 2016,en,0,False,0,False,,Sam Khoury,Hussamkhoury
Western Europe car sales rise 5% in March https://t.co/vJ0yWBxRTW #auto #news,Fri Apr 08 08:21:58 +0000 2016,en,0,False,0,False,,Sam Khoury,Hussamkhoury
"""Amazon May Violate India’s New Rules on Foreign E-Commerce"" #tech #news @nytimes https://t.co/1LYiaVhXZn",Fri Apr 08 04:45:54 +0000 2016,en,0,False,0,False,,Sam Khoury,Hussamkhoury
Are these agency management practices causing the talent crisis? https://t.co/zFOl46H7oE #digital #media,Fri Apr 08 04:25:56 +0000 2016,en,0,False,0,False,,Sam Khoury,Hussamkhoury
The surprising economics of in-image advertising https://t.co/hcKFWYflXn #digital #media,Fri Apr 08 04:25:52 +0000 2016,en,0,False,0,False,,Sam Khoury,Hussamkhoury
"Day in the life: How UK watchdog ASA polices 30,000 advertising complaints a year https://t.co/7PgVQRr3Do #digital #media",Fri Apr 08 04:06:46 +0000 2016,en,0,False,0,False,,Sam Khoury,Hussamkhoury
How Pinterest is targeting the UK market https://t.co/dLRD1rciF9 #digital #media,Fri Apr 08 04:06:45 +0000 2016,en,0,False,0,False,,Sam Khoury,Hussamkhoury
CNET’s Eric Johnson: Focus is what wins in media https://t.co/w81OYOvT5n #digital #media,Fri Apr 08 04:06:45 +0000 2016,en,0,False,0,False,,Sam Khoury,Hussamkhoury
From crop tops to Jimmy Choos: How Coachella became a fashion marketing hotbed https://t.co/0IyUHdngb9 #digital #media,Fri Apr 08 04:06:44 +0000 2016,en,0,False,0,False,,Sam Khoury,Hussamkhoury
Intel gets inside the wearable industry https://t.co/O52IySfwR8 #digital #media,Fri Apr 08 04:06:44 +0000 2016,en,0,False,0,False,,Sam Khoury,Hussamkhoury
