Text,Created Date,Language,Retweet Count,Retweeted,Favorite Count,Favorited,co-ordinates,Tweeted By,Screen Name
RT @TechCrunch: SF Engineer Dan Ha Has Been Missing Since Halloween Night http://t.co/ReBJlMqefn by @jordanrcrook,Fri Nov 07 06:03:31 +0000 2014,en,66,False,0,False,,Bill Trenchard,btrenchard
The Startup Built Internal Tools to Fuel Major Growth. Here's Their Approach: http://t.co/q3UhyUD1gm,Thu Nov 06 20:44:08 +0000 2014,en,1,False,2,False,,Bill Trenchard,btrenchard
The 5 Early Mistakes That Almost Killed This Founder's Startup and How He Survived: http://t.co/eRohRjfEYi,Tue Nov 04 17:27:39 +0000 2014,en,2,False,2,False,,Bill Trenchard,btrenchard
You should not lose candidates because another startup at a similar stage is paying them more cash: http://t.co/WiklOCYdvh,Thu Oct 30 18:19:51 +0000 2014,en,2,False,3,False,,Bill Trenchard,btrenchard
RT @joshk: So UberX has come to Philly -- and its free!  I'm an approved driver &amp; driving now. Who will be my first ride! cc: @Uber_Philly …,Sat Oct 25 22:13:59 +0000 2014,en,67,False,0,False,,Bill Trenchard,btrenchard
"Great new piece from @carlyguth3, ""This is Why People Leave Your Company"" http://t.co/n1Ic85MNU8",Thu Oct 23 16:19:08 +0000 2014,en,3,False,2,False,,Bill Trenchard,btrenchard
"When It Comes to Market Leadership, Be the Gorilla: http://t.co/5CQviewcXS",Tue Oct 21 19:15:24 +0000 2014,en,2,False,2,False,,Bill Trenchard,btrenchard
"No matter how good or bad things get, if you have a sustainable culture, you should be able to stay centered. http://t.co/zYJ0uk58t0",Thu Oct 16 16:18:08 +0000 2014,en,2,False,1,False,,Bill Trenchard,btrenchard
Win the War for Great Global Talent--Keys to International Recruiting: http://t.co/qhzF5Rzr4n,Tue Oct 14 16:49:55 +0000 2014,en,2,False,2,False,,Bill Trenchard,btrenchard
Find the best lawyer for your startup with this off-the-record advice: http://t.co/0hSRbX5HOu,Thu Oct 09 16:40:24 +0000 2014,en,2,False,2,False,,Bill Trenchard,btrenchard
Congrats to @illscience and the @trysnowball team! Super excited that Snowball is now available on Google Play: http://t.co/ReQAHIX924,Wed Oct 08 16:31:34 +0000 2014,en,7,False,2,False,,Bill Trenchard,btrenchard
Why founders should care about happiness: http://t.co/xjIbEndJV1 http://t.co/xjIbEndJV1,Tue Oct 07 16:12:23 +0000 2014,en,3,False,2,False,,Bill Trenchard,btrenchard
RT @brettkopf: Excited to announce @RemindHQ #SeriesC funding - onward and upward to connect #teachers http://t.co/8uhovBCQAB,Tue Sep 30 19:02:40 +0000 2014,en,10,False,0,False,,Bill Trenchard,btrenchard
How SendGrid Built Its Developer Evangelist Strategy to Reach Critical Mass: http://t.co/dYaWiTlMud,Tue Sep 30 16:40:55 +0000 2014,en,3,False,6,False,,Bill Trenchard,btrenchard
"RT @HLMorgan: Announcing  @CloudHelix, @firstround latest investment. If you have network infrastructure, you should know them http://t.co/…",Tue Sep 30 16:28:25 +0000 2014,en,4,False,0,False,,Bill Trenchard,btrenchard
WhatsApp Used This Pricing Strategy to Win and You Can Too: http://t.co/MKNVRyulOy,Thu Sep 25 17:20:47 +0000 2014,en,2,False,1,False,,Bill Trenchard,btrenchard
"New from @phineasb, ""7 Tactics to Get the Most Out of Your Startup's Advisors"" 

http://t.co/wbP3nEfQPI",Tue Sep 23 16:27:29 +0000 2014,en,4,False,7,False,,Bill Trenchard,btrenchard
Make Engineering Interns Truly Effective with This Startup's Program: http://t.co/2eswfMDfPg,Tue Sep 16 16:16:58 +0000 2014,en,2,False,1,False,,Bill Trenchard,btrenchard
This is how you get people to trust your product: http://t.co/PNsgWYmYv5,Thu Sep 11 16:55:36 +0000 2014,en,2,False,0,False,,Bill Trenchard,btrenchard
Annual Planning Is Killing Your Growth. Try This Plan Instead: http://t.co/XXLtbESwzo,Thu Sep 04 17:07:53 +0000 2014,en,2,False,2,False,,Bill Trenchard,btrenchard
Congrats to @jevering and everyone @luminate on the acquisition by @Yahoo!,Wed Sep 03 23:22:26 +0000 2014,en,3,False,4,False,,Bill Trenchard,btrenchard
"RT @readyforce: We are excited to launch ""Explore Your Options,"" featured in @TechCrunch today! Read more about the program here: http://t.…",Wed Sep 03 16:56:48 +0000 2014,en,21,False,0,False,,Bill Trenchard,btrenchard
"Awesome new piece by @carlyguth3, ""Employee Onboarding at Startups Is Broken. Here's How to Fix It"": http://t.co/YnrBbUIJNP",Tue Sep 02 16:36:18 +0000 2014,en,2,False,2,False,,Bill Trenchard,btrenchard
RT @RemindHQ: The Teaching Tool Topping the App Store: http://t.co/x7Fm1qhgkn via @BW @BradStone @BW_Tech  #edtech #tech #edchat http://t.c…,Thu Aug 28 20:09:46 +0000 2014,en,13,False,0,False,,Bill Trenchard,btrenchard
"""What I Learned As Pandora's First Data Scientist"": http://t.co/plNYFfDR5c",Thu Aug 28 16:10:14 +0000 2014,en,0,False,1,False,,Bill Trenchard,btrenchard
Power Your Team With Nonviolent Communication Principles: http://t.co/AqoOAYkeME,Thu Aug 21 17:03:41 +0000 2014,en,3,False,3,False,,Bill Trenchard,btrenchard
Nailing down your positioning from the beginning makes everything else easier: http://t.co/u5xdX2A0tD,Tue Aug 19 16:33:40 +0000 2014,en,3,False,1,False,,Bill Trenchard,btrenchard
RT @phineasb: So excited for @ahawkinson and @smartthings team as they become @firstround alumni and join @samsung. Thanks Guys. http://t.c…,Fri Aug 15 05:56:49 +0000 2014,en,15,False,0,False,,Bill Trenchard,btrenchard
Best Practices for crowd funding your startup from the founders of FundersClub: http://t.co/AUwTzyLcck,Thu Aug 14 16:15:45 +0000 2014,en,2,False,2,False,,Bill Trenchard,btrenchard
RT @joshk: Excited to see @Sproutling's first product - a wearable that tracks your infant's sleep patterns http://t.co/genirLyvIS,Thu Aug 07 15:55:39 +0000 2014,en,6,False,0,False,,Bill Trenchard,btrenchard
RT @AvisoInc: 'The Dark Age Of Enterprise #Software Is Ending' by @avisokv in @TechCrunch http://t.co/XFlRW5NHrG #saas,Tue Aug 05 17:24:33 +0000 2014,en,9,False,0,False,,Bill Trenchard,btrenchard
"The one tool startups need to brainstorm, test and win: http://t.co/en4Y1zG4fK",Tue Aug 05 16:07:32 +0000 2014,en,0,False,2,False,,Bill Trenchard,btrenchard
How to engage your users to build the product they actually want: http://t.co/qdpCjvMITa,Thu Jul 31 16:33:38 +0000 2014,en,2,False,1,False,,Bill Trenchard,btrenchard
Product Hunt is everywhere. This is how it got there: http://t.co/3VBaAl5EOu,Tue Jul 29 16:04:01 +0000 2014,en,2,False,3,False,,Bill Trenchard,btrenchard
How Startups Can Do Retail Right from the Inventor of the Apple Store: http://t.co/NdH0TPVplE,Thu Jul 24 16:29:49 +0000 2014,en,11,False,10,False,,Bill Trenchard,btrenchard
RT @firstround: Congratulations to @airware on raising $25M to power drones for commercial uses! (via @TechCrunch) http://t.co/pylhUhT63U,Wed Jul 23 23:17:38 +0000 2014,en,12,False,0,False,,Bill Trenchard,btrenchard
"@chrisfralic Turn off background location services.  As the iPhone gets close to a year old, battery dies fast. It's an upgrade reminder :)",Wed Jul 23 23:17:02 +0000 2014,en,0,False,2,False,,Bill Trenchard,btrenchard
"Congrats to @ericvishria as the newest member on the great team @benchmark!  @bgurley, @mattcohler, @mitchlasky, @peterfenton",Wed Jul 23 18:24:16 +0000 2014,en,2,False,5,False,,Bill Trenchard,btrenchard
"Today on First Round Capital Review, How Designers Can Earn a Seat at the Table: http://t.co/KvT0rgkaED",Tue Jul 22 17:39:01 +0000 2014,en,2,False,6,False,,Bill Trenchard,btrenchard
This 23 Year Old Built and Sold His Startup While in School. Here's How He Did It: http://t.co/TUOfbz66mu,Thu Jul 17 16:48:04 +0000 2014,en,1,False,2,False,,Bill Trenchard,btrenchard
The Case for Why Marketing Should Have Its Own Engineers: http://t.co/gRavkUtDEP,Tue Jul 15 16:55:08 +0000 2014,en,3,False,3,False,,Bill Trenchard,btrenchard
RT @geteverwise: Excited to be featured in @FastCompany! Check out an overview of how we turn hard data into the perfect #mentor match http…,Tue Jul 15 02:37:24 +0000 2014,en,8,False,0,False,,Bill Trenchard,btrenchard
Dropbox's Head of Design on the Dawn of Personalized Products: http://t.co/7kfVAIq500,Thu Jul 10 16:06:05 +0000 2014,en,3,False,1,False,,Bill Trenchard,btrenchard
RT @TechCrunch: Electric Objects Launches Kickstarter Campaign To Build Displays For Digital Art http://t.co/nqlyl44gbP by @anthonyha,Tue Jul 08 16:59:12 +0000 2014,en,28,False,0,False,,Bill Trenchard,btrenchard
What to learn from the man who managed Reddit's community of millions: http://t.co/sotKrQrx7a,Tue Jul 08 16:12:39 +0000 2014,en,0,False,2,False,,Bill Trenchard,btrenchard
"New piece on First Round, ""If you fall down and refuse to get up, you will be down for the rest of your life"" http://t.co/oRDZUzuuL2",Tue Jul 01 16:28:03 +0000 2014,en,4,False,4,False,,Bill Trenchard,btrenchard
"RT @ariesenfeld: ""People who do amazing things write it down. Startups don't do that enough.” | @btrenchard @firstround | http://t.co/Kxysv…",Fri Jun 27 19:26:24 +0000 2014,en,4,False,0,False,,Bill Trenchard,btrenchard
"New from @jmilinovich at URX, How Fast Growing Startups Can Fix Internal Communication Before it Breaks: http://t.co/7f7xpoIX6S",Tue Jun 24 16:07:05 +0000 2014,en,5,False,2,False,,Bill Trenchard,btrenchard
New piece on First Round Review. I've Worked with Hundreds of Recruiters. Here's What I Learned: http://t.co/i7fG94le4i,Thu Jun 19 15:49:40 +0000 2014,en,2,False,0,False,,Bill Trenchard,btrenchard
Spotify's Design Lead of Why Side Projects Should be Stupid: http://t.co/zq1uWmpgOt,Tue Jun 17 16:30:35 +0000 2014,en,2,False,1,False,,Bill Trenchard,btrenchard
This Culture Deck Powers the World's Toughest Work: http://t.co/wyKAMVLgW5,Thu Jun 12 16:37:28 +0000 2014,en,2,False,2,False,,Bill Trenchard,btrenchard
"How Lumosity Spiked Active Users 10% with Complexity, Not Simplicity: http://t.co/LfT5N4SRbq",Tue Jun 10 15:59:51 +0000 2014,en,3,False,3,False,,Bill Trenchard,btrenchard
RT @joshk: Congrats @danshipper &amp; @justinmeltzer on @usefirefly's acquisition by @Pega. (First @DormRoomFund exit) My post here: http://t.c…,Mon Jun 09 15:47:00 +0000 2014,en,24,False,0,False,,Bill Trenchard,btrenchard
"Huge congrats to @travisk, @ryangraves and the entire team @Uber on their fundraising today!  Incredible!",Fri Jun 06 22:19:31 +0000 2014,en,10,False,11,False,,Bill Trenchard,btrenchard
This startup cracked a $2.4 billion market with branding. Here's their formula: http://t.co/bGO3wLie0W,Fri Jun 06 16:35:36 +0000 2014,en,3,False,2,False,,Bill Trenchard,btrenchard
Spark Creativity with These Tips From Pixar's President: http://t.co/LU1PHffHcV,Tue Jun 03 16:31:04 +0000 2014,en,3,False,1,False,,Bill Trenchard,btrenchard
Software is eating hardware. Lessons for building magical devices: http://t.co/FJujWcTccG,Tue May 27 16:30:47 +0000 2014,en,3,False,1,False,,Bill Trenchard,btrenchard
The 39 best pieces of sales advice you'll hear this year: http://t.co/GQY41m5obl,Thu May 22 15:46:25 +0000 2014,en,4,False,1,False,,Bill Trenchard,btrenchard
Process is being told what to do by someone who has less information than you: http://t.co/b9qQaap6Ux,Tue May 20 15:13:09 +0000 2014,en,2,False,2,False,,Bill Trenchard,btrenchard
This startup launched in 30 cities in 6 months. Here's how they did it: http://t.co/89e1verzLw,Thu May 15 16:13:33 +0000 2014,en,3,False,1,False,,Bill Trenchard,btrenchard
Congrats to @jasontan and the entire team at @siftscience on their Series B! http://t.co/ny2qZGqR60,Wed May 14 15:15:52 +0000 2014,en,4,False,4,False,,Bill Trenchard,btrenchard
"Simple design is what you need, not what you want: http://t.co/NuJkBnVx3E",Tue May 13 16:23:10 +0000 2014,en,3,False,3,False,,Bill Trenchard,btrenchard
Shooting for an IPO? Take these steps now before it's too late: http://t.co/8zl4TsKVhl,Tue May 06 16:40:05 +0000 2014,en,2,False,1,False,,Bill Trenchard,btrenchard
An Inside Look at Facebook's Method for Hiring Designers: http://t.co/2f2fCyGKvU,Thu May 01 16:31:49 +0000 2014,en,3,False,3,False,,Bill Trenchard,btrenchard
How Squarespace's CEO pivoted to scale for millions: http://t.co/6pkoHtwFfA,Tue Apr 29 16:48:22 +0000 2014,en,2,False,3,False,,Bill Trenchard,btrenchard
"Very excited about @urxtech's latest $12M raise! They're creating links that work everywhere, check it out here: http://t.co/Ai86Gtz8XE",Mon Apr 28 15:47:33 +0000 2014,en,5,False,5,False,,Bill Trenchard,btrenchard
RT @firstround: “Make it simple but significant.” — Don Draper http://t.co/MCj3kOlNpy,Mon Apr 28 03:27:13 +0000 2014,en,152,False,0,False,,Bill Trenchard,btrenchard
Don't leave money on the table with this crash course in pricing: http://t.co/2Im1F07tt1,Fri Apr 25 17:33:33 +0000 2014,en,2,False,1,False,,Bill Trenchard,btrenchard
Your best hires are right under your nose. Use this system to never miss them again: http://t.co/gU659Jd4iV,Tue Apr 22 16:22:18 +0000 2014,en,2,False,1,False,,Bill Trenchard,btrenchard
This advice from IDEO's Nicole Kahn will transform the way you give presentations: http://t.co/8aISICVjsS,Thu Apr 17 17:04:48 +0000 2014,en,2,False,3,False,,Bill Trenchard,btrenchard
80% of your culture is your founder: http://t.co/opzvig7eTO,Tue Apr 15 16:53:52 +0000 2014,en,6,False,2,False,,Bill Trenchard,btrenchard
RT @readyforce: @Readyforce #HackerHub profiled via @Mashable: 'Hackathons Are the New Career Fairs' http://t.co/vYomabKyQs,Mon Apr 14 17:59:05 +0000 2014,en,10,False,0,False,,Bill Trenchard,btrenchard
Hyper growth done right. Lessons from the man who scaled engineering at Dropbox and Facebook: http://t.co/r5ULmTkp3E,Thu Apr 10 16:32:20 +0000 2014,en,2,False,4,False,,Bill Trenchard,btrenchard
Wearable Intelligence is transforming the enterprise through scalable products on Glass. Check out how: http://t.co/QPXJFuprb4 @wearableint,Tue Apr 08 21:27:34 +0000 2014,en,6,False,4,False,,Bill Trenchard,btrenchard
Wearable Intelligence is dreaming up uses for Google Glass that may actually help save lives: http://t.co/rYXo1fF9vV,Tue Apr 08 16:58:06 +0000 2014,en,5,False,3,False,,Bill Trenchard,btrenchard
The two most important days in your life are the day you are born and the day you find out why: http://t.co/zv6Q2XcjKJ,Tue Apr 08 16:01:55 +0000 2014,en,2,False,3,False,,Bill Trenchard,btrenchard
The two most important days in your life are the day you are born and the day you find out why: http://t.co/CWDw9dLbi2,Tue Apr 08 16:00:52 +0000 2014,en,0,False,0,False,,Bill Trenchard,btrenchard
Here's why you're not hiring the best and the brightest: http://t.co/jAeCktFnvH,Thu Apr 03 17:14:08 +0000 2014,en,3,False,4,False,,Bill Trenchard,btrenchard
RT @pkedrosky: Chris Boshuizen of @planetlabs: “The space industry has a peculiar constraint on it which is things have to work”,Thu Apr 03 05:49:14 +0000 2014,en,10,False,0,False,,Bill Trenchard,btrenchard
"Great post by @lloydtabb. My Client, the Dread Pirate Roberts, ""Sleep well. I'll most likely kill you in the morning"" http://t.co/qxDvxVSfgv",Wed Apr 02 17:58:26 +0000 2014,en,2,False,2,False,,Bill Trenchard,btrenchard
Give Criticism that Makes a Difference- Tips from Airbnb's Head of Experience Design: http://t.co/NXtib5puS7,Tue Apr 01 16:50:19 +0000 2014,en,1,False,2,False,,Bill Trenchard,btrenchard
"Just posted... The coolest talk from TED2014, these bionic legs are incredible! http://t.co/NfvAOFJcou",Fri Mar 28 18:04:11 +0000 2014,en,1,False,1,False,,Bill Trenchard,btrenchard
Great piece from @angusdav on navigating challenges and tough situations: http://t.co/yWXwCM0TJK,Thu Mar 27 18:45:30 +0000 2014,en,0,False,0,False,,Bill Trenchard,btrenchard
Eventbrite's Playbook for Building Amazing Customer Service from Scratch: http://t.co/nI6Xmyb7zm,Tue Mar 25 16:15:24 +0000 2014,en,0,False,1,False,,Bill Trenchard,btrenchard
"Cory Ondrejka, Facebook VP of Engineering on Solving Hard Things Early: http://t.co/ktPhHdVWY5",Thu Mar 20 16:28:53 +0000 2014,en,0,False,1,False,,Bill Trenchard,btrenchard
"My new post on productivity hacks, How the Best CEOs Get the Most Out of Every Day http://t.co/3YAKKKGbfw",Thu Mar 13 17:17:52 +0000 2014,en,3,False,10,False,,Bill Trenchard,btrenchard
"The Best PR Advice You've Never Heard, from Facebook's Head of Tech Communications: http://t.co/iFLa5zGa6A",Tue Mar 11 16:20:46 +0000 2014,en,0,False,1,False,,Bill Trenchard,btrenchard
The Do's and Don'ts of Rapid Scaling for Startups: http://t.co/neKfRJKIBY,Thu Mar 06 19:07:41 +0000 2014,en,0,False,2,False,,Bill Trenchard,btrenchard
How Modern Marketplaces Like Uber &amp; Airbnb Build Trust to Achieve Liquidity: http://t.co/iVN920V79D,Tue Mar 04 18:15:29 +0000 2014,en,2,False,3,False,,Bill Trenchard,btrenchard
Take your fundraising pitch from mediocre to memorable with these storytelling tips from @orenjacob: http://t.co/g8maOvmnkU,Thu Feb 27 17:20:53 +0000 2014,en,1,False,1,False,,Bill Trenchard,btrenchard
Congrats Kahuna and @adammStanford - Kahuna announces new customers including Yahoo and $11M Funding from @Sequoia_Capital! @kahuna,Wed Feb 26 22:40:19 +0000 2014,en,1,False,1,False,,Bill Trenchard,btrenchard
"From Kim Scott: My Management Lessons from Three Failed Startups, Google, Apple, Dropbox, Twitter and Square http://t.co/CZCtiWL3et",Tue Feb 25 17:53:25 +0000 2014,en,1,False,3,False,,Bill Trenchard,btrenchard
"Crisis Management, From the Man Who Helped Save eBay. Great insights from @maynard: http://t.co/u350ZqAUPI",Thu Feb 20 17:26:21 +0000 2014,en,0,False,2,False,,Bill Trenchard,btrenchard
RT @phineasb: Congrats to @firstround Community members @i2pi @shamir_k and the @simple team on joining @BBVA and continuing to make bankin…,Thu Feb 20 16:46:36 +0000 2014,en,12,False,0,False,,Bill Trenchard,btrenchard
23 Tools to Make Your Feedback Meaningful: http://t.co/jfm4SasfmS,Tue Feb 18 17:10:27 +0000 2014,en,0,False,1,False,,Bill Trenchard,btrenchard
@heyitsnoah Great to hear!  Enjoy and let me know if you come up with any new email hacks!,Fri Feb 14 01:37:32 +0000 2014,en,0,False,1,False,,Bill Trenchard,btrenchard
Six Friction-Free Ways to Help Your Network Help You: http://t.co/gAJ8wixWqL,Thu Feb 13 17:05:12 +0000 2014,en,0,False,1,False,,Bill Trenchard,btrenchard
The brain hacks top founders use to get the job done: http://t.co/9GxtJqyZfQ,Tue Feb 11 17:10:14 +0000 2014,en,0,False,3,False,,Bill Trenchard,btrenchard
Unlocking the Power of Stable Teams with Twitter's SVP of Engineering: http://t.co/onPHQ2XNIX,Thu Feb 06 17:10:52 +0000 2014,en,0,False,1,False,,Bill Trenchard,btrenchard
This product prioritization system nabbed Pandora 70 million monthly users with just 40 engineers: http://t.co/Tsb5YKstqU,Tue Feb 04 17:15:01 +0000 2014,en,0,False,2,False,,Bill Trenchard,btrenchard
Congrats to @kentgoldman on becoming a founder! http://t.co/HEAtRN9Lqm,Tue Feb 04 15:46:20 +0000 2014,en,2,False,5,False,,Bill Trenchard,btrenchard
RT @phineasb: Really excited to have the @GetConfide team joining the @firstround Community.  http://t.co/jQQBMer9UI,Tue Feb 04 15:04:57 +0000 2014,en,5,False,0,False,,Bill Trenchard,btrenchard
"Congrats to @scottbelsky on joining the fantastic team at Founder Collective with @epaley, @dafrankel and @micahjay1!",Mon Feb 03 23:31:46 +0000 2014,en,0,False,4,False,,Bill Trenchard,btrenchard
Asana's Justin Rosenstein on the one quality every startup needs to survive: http://t.co/dzfcmL7zgB,Thu Jan 30 17:18:33 +0000 2014,en,0,False,0,False,,Bill Trenchard,btrenchard
"An in-depth look at the top 5 mistakes startups make when developing for mobile platforms: 

http://t.co/0AeSKgAGda",Tue Jan 28 17:15:51 +0000 2014,en,8,False,13,False,,Bill Trenchard,btrenchard
"From Zero to 10,000 Clients in Two Years Using Channel Partners: http://t.co/s6laEyDpXJ",Thu Jan 23 19:43:39 +0000 2014,en,0,False,1,False,,Bill Trenchard,btrenchard
Rap Genius explains why worse is better: http://t.co/EjO7C0kCUA,Thu Jan 16 17:11:22 +0000 2014,en,0,False,1,False,,Bill Trenchard,btrenchard
RT @LookerData: Looker enables everyone at HotelTonight to access and share data - all the time. http://t.co/LVaLD1kmNP http://t.co/LkWP3RW…,Wed Jan 15 00:38:51 +0000 2014,en,8,False,0,False,,Bill Trenchard,btrenchard
What it takes to grow your startup 500% in months: http://t.co/G9kgTqC0gC,Tue Jan 14 17:29:20 +0000 2014,en,1,False,4,False,,Bill Trenchard,btrenchard
RT @joshk: My new blog post: On Data Persistence...and Confide http://t.co/QPjl0ocHDQ,Mon Jan 13 23:47:50 +0000 2014,en,32,False,0,False,,Bill Trenchard,btrenchard
RT @nest: Big news! @Google acquiring Nest to help fulfill our goal of reinventing unloved home products. Nest will stay Nest. http://t.co/…,Mon Jan 13 21:11:21 +0000 2014,en,1146,False,0,False,,Bill Trenchard,btrenchard
"RT @bgurley: Uber Slashes Fares In 16 Markets To Make It Cheapest Car Service Available Anywhere http://t.co/s3tf0PWzSw ""more accessible to…",Fri Jan 10 05:22:38 +0000 2014,en,16,False,0,False,,Bill Trenchard,btrenchard
How to make OKRs actually work at your startup: http://t.co/L4YwPLsKhH,Thu Jan 09 17:17:40 +0000 2014,en,0,False,2,False,,Bill Trenchard,btrenchard
The Seven Deadly Sins of Startup Storytelling: http://t.co/baNX635PT2,Tue Jan 07 17:10:25 +0000 2014,en,0,False,2,False,,Bill Trenchard,btrenchard
The 30 Best Pieces of Advice for Entrepreneurs in 2013: http://t.co/7TgqBfz5w9,Tue Dec 31 04:23:07 +0000 2013,en,10,False,9,False,,Bill Trenchard,btrenchard
RT @robgo: Best @firstround holiday video yet. Well done. There are some images that I will never get out of my mind. Particularly @davefel…,Thu Dec 19 18:49:40 +0000 2013,en,4,False,0,False,,Bill Trenchard,btrenchard
It's here! http://t.co/OKzQ5u1Wrh. Happy Holidays from @firstround!,Thu Dec 19 17:08:14 +0000 2013,en,2,False,1,False,,Bill Trenchard,btrenchard
"Hiring hack: ask candidates to create a ""brag sheet"" of their proudest accomplishments. Look for outliers in what they've specifically done.",Thu Dec 19 06:40:53 +0000 2013,en,16,False,21,False,,Bill Trenchard,btrenchard
"The Best Approach to the Worst Conversation: ""You're Fired""

http://t.co/VmADupc8ko",Tue Dec 17 17:50:56 +0000 2013,en,0,False,1,False,,Bill Trenchard,btrenchard
"How to win as a first time founder, a Drew Houston manifesto: http://t.co/HQ0bu4USQZ",Thu Dec 05 18:30:50 +0000 2013,en,0,False,2,False,,Bill Trenchard,btrenchard
Kawasaki on why your startup is dead if you can't enchant: http://t.co/LJJUrauAV2,Tue Dec 03 17:17:18 +0000 2013,en,2,False,7,False,,Bill Trenchard,btrenchard
The right way to grant equity to your employees: http://t.co/T1GcMAcDyX,Tue Nov 19 17:15:14 +0000 2013,en,16,False,36,False,,Bill Trenchard,btrenchard
"Fight like you're right, listen like you're wrong and other keys to great management: http://t.co/R519g5LUNm",Fri Nov 15 17:25:24 +0000 2013,en,0,False,0,False,,Bill Trenchard,btrenchard
RT @firstround: Epic lineup for Design+Startup w/@ideo including @matiascorea @dumbnamenumbers @ZackSultan - sign up now: http://t.co/3WY3Y…,Thu Nov 14 01:36:26 +0000 2013,en,12,False,0,False,,Bill Trenchard,btrenchard
Top hacks from a PM behind two of tech's hottest products: http://t.co/5RVeD283UX,Thu Nov 07 19:56:45 +0000 2013,en,4,False,12,False,,Bill Trenchard,btrenchard
"RT @joshk: Congrats to @ahpah, @davej95, @Claw &amp; the @AKintelligence team on the sale to @Neustar. It's been a wild 2904 days - http://t.co…",Wed Oct 30 21:55:58 +0000 2013,en,9,False,0,False,,Bill Trenchard,btrenchard
RT @joshk: Super excited to introduce our latest investment - Cover!  http://t.co/c0Jmm8q9as,Thu Oct 24 17:53:23 +0000 2013,en,14,False,0,False,,Bill Trenchard,btrenchard
The secret to making board meeting suck less: http://t.co/AaiXHbNrsl,Thu Oct 17 16:49:37 +0000 2013,en,1,False,1,False,,Bill Trenchard,btrenchard
Excited to announce FRC's investment in URX: http://t.co/DVwNALXSRm http://t.co/5U78G5a9Bx,Wed Oct 16 18:49:02 +0000 2013,en,0,False,1,False,,Bill Trenchard,btrenchard
"To get the most out of your investors, turn them into rubber ducks http://t.co/vG82Nky395 via @phineasb",Wed Oct 16 04:37:50 +0000 2013,en,0,False,1,False,,Bill Trenchard,btrenchard
"What everyone should know about how talent is bought &amp; sold 

http://t.co/2eTT9DLqYu http://t.co/ctQkFQKBgn",Thu Sep 26 16:05:52 +0000 2013,en,0,False,0,False,,Bill Trenchard,btrenchard
"New on First Round Review, Why Most Startups Don't 'Get' Press: 

http://t.co/bGgieodMHS",Tue Sep 24 16:31:50 +0000 2013,en,0,False,2,False,,Bill Trenchard,btrenchard
"Happy Birthday Dorm Room Fund!

http://t.co/qjYsMA8A7L",Tue Sep 24 15:21:00 +0000 2013,en,0,False,0,False,,Bill Trenchard,btrenchard
"@Remind101 Lands $3.5M to Modernize Teacher Communication 

http://t.co/xQnWM6cLpd",Wed Sep 18 16:17:17 +0000 2013,en,1,False,1,False,,Bill Trenchard,btrenchard
OH: The Moscow Mule is a life changer http://t.co/7hsWYXJZNF,Tue Sep 17 03:55:12 +0000 2013,en,0,False,5,False,,Bill Trenchard,btrenchard
RT @readyforce: Our @readyajm writes about today's most powerful recruiting tool: the #Hackathon on @ERE_net http://t.co/EMoExgFk2F,Wed Sep 04 22:26:16 +0000 2013,en,4,False,0,False,,Bill Trenchard,btrenchard
How to go from Google engineer to first-time CTO: http://t.co/BlniLF44nS,Wed Sep 04 16:24:01 +0000 2013,en,0,False,0,False,,Bill Trenchard,btrenchard
RT @VentureBeat: 100 top computer science students flock to SF for hacker Olympics (exclusive) http://t.co/v8tEsXlFtA by @bekahgrant,Fri Aug 30 20:15:11 +0000 2013,en,15,False,0,False,,Bill Trenchard,btrenchard
"Excited to announce First Round Capital's investment in Zendrive: 

http://t.co/8IrydxerCx",Thu Aug 29 21:37:45 +0000 2013,en,0,False,2,False,,Bill Trenchard,btrenchard
What to do when you're the only designer they've got: http://t.co/kyDSSyi8Uz,Tue Aug 27 18:47:41 +0000 2013,en,0,False,0,False,,Bill Trenchard,btrenchard
RT @firstround: Thrilled to announce our latest investment in @Cluster - more on why here: http://t.co/nhQkg8cwcH,Thu Aug 22 17:50:07 +0000 2013,en,9,False,0,False,,Bill Trenchard,btrenchard
