Text,Created Date,Language,Retweet Count,Retweeted,Favorite Count,Favorited,co-ordinates,Tweeted By,Screen Name
The Science of Speaking is the Art of Being Heard https://t.co/0wmwyy0EYf,Thu May 12 16:41:34 +0000 2016,en,0,False,3,False,,Bill Trenchard,btrenchard
Harnessing Happiness to Build Your Career — Advice from an Uber Product Leader https://t.co/ZgxeuAaD6x,Tue May 10 16:19:21 +0000 2016,en,0,False,3,False,,Bill Trenchard,btrenchard
Answers To Your Tough Questions About Growth — Learned While Scaling Eventbrite’s $5B+ Growth Engine https://t.co/nZt127hAHF,Thu May 05 16:33:19 +0000 2016,en,1,False,4,False,,Bill Trenchard,btrenchard
Reddit and Facebook Veteran On How to Troubleshoot Troublemakers https://t.co/XQIlYbNOO3,Tue May 03 16:48:00 +0000 2016,en,0,False,1,False,,Bill Trenchard,btrenchard
Practical Frameworks for Beating Burnout https://t.co/JH6P7pHxPb,Tue Apr 26 16:35:33 +0000 2016,en,0,False,2,False,,Bill Trenchard,btrenchard
The Remarkable Advantage of Abundant Thinking https://t.co/J7ve53ZAnL,Tue Apr 19 16:30:18 +0000 2016,en,1,False,2,False,,Bill Trenchard,btrenchard
Advice is Cheap — Context is Priceless https://t.co/cJix2O2QpR,Thu Apr 14 16:40:46 +0000 2016,en,1,False,4,False,,Bill Trenchard,btrenchard
Congrats to everyone @lendinghome!  Excited to be on the ride with @zellunit and team. https://t.co/NxsKPvwKWB,Tue Apr 12 19:15:58 +0000 2016,en,2,False,2,False,,Bill Trenchard,btrenchard
"One Founder, Both Sides of the M&amp;A Table — What All Startups Can Learn from His Experience https://t.co/mz8B7G8sOT",Tue Apr 12 16:42:15 +0000 2016,en,0,False,3,False,,Bill Trenchard,btrenchard
"Glad to see high 401k fees die. Big problem, esp. for small groups. https://t.co/AXqWGfnm5Y",Wed Apr 06 15:55:15 +0000 2016,en,0,False,1,False,,Bill Trenchard,btrenchard
"@micahjay1 Sign up for @SuperhumanCo, lightning fast search.",Wed Apr 06 14:53:22 +0000 2016,en,0,False,3,False,,Bill Trenchard,btrenchard
@kentgoldman @phineasb @brettberson I admit to using a lap desk for couch typing. May start wearing a matching fanny pack for the pencil. ;),Wed Apr 06 13:45:13 +0000 2016,en,0,False,7,False,,Bill Trenchard,btrenchard
@beninato Big one. Don't think I can type on the small keyboard.,Wed Apr 06 13:26:56 +0000 2016,en,0,False,1,False,,Bill Trenchard,btrenchard
"@phineasb @brettberson Go big. Split screen is awesome - deck on left, notes (ink or typed) on right.",Wed Apr 06 13:25:28 +0000 2016,en,0,False,0,False,,Bill Trenchard,btrenchard
"Get so much more done using the iPad Pro as my main device. Multitasking, tabs and windows conspire to kill productivity. #minimalism",Wed Apr 06 06:07:54 +0000 2016,en,0,False,8,False,,Bill Trenchard,btrenchard
Doing Data Science Right — Your Most Common Questions Answered https://t.co/EiQmRX9w54,Tue Apr 05 16:53:41 +0000 2016,en,0,False,0,False,,Bill Trenchard,btrenchard
RT @joshk: Looking for a job in venture capital?  Come join the @firstround team! https://t.co/WsXRj93Lyj,Wed Mar 30 15:37:45 +0000 2016,en,19,False,0,False,,Bill Trenchard,btrenchard
How Early-Stage Startups Can Enlist The Right Amount of Security As They Grow https://t.co/b5P0TsxxdD,Tue Mar 29 16:40:47 +0000 2016,en,0,False,1,False,,Bill Trenchard,btrenchard
"Shims, Jigs and Other Woodworking Concepts to Conquer Technical Debt https://t.co/AuA6BPCDtP",Tue Mar 22 16:41:48 +0000 2016,en,0,False,3,False,,Bill Trenchard,btrenchard
Transform Employee Equity Compensation in Two Steps — Here’s How https://t.co/1BlwKqmCKC,Thu Mar 03 17:12:16 +0000 2016,en,0,False,3,False,,Bill Trenchard,btrenchard
The Magical Benefits of the 'Quitter's Mindset' https://t.co/wf2W3uzQfs,Tue Mar 01 17:32:08 +0000 2016,en,0,False,0,False,,Bill Trenchard,btrenchard
Excited to announce our investment in @buddybuild today! Check them out at https://t.co/7xGQuI1bqK https://t.co/nfucXXoj5Q,Tue Feb 23 18:50:15 +0000 2016,en,0,False,5,False,,Bill Trenchard,btrenchard
The Tools Early-Stage Startups Actually Need to Understand Their Customers https://t.co/Sz46OAXANa,Tue Feb 23 17:24:46 +0000 2016,en,2,False,8,False,,Bill Trenchard,btrenchard
This Company Retains 95% of Its Employees — Here’s Its Secret https://t.co/C5cYJRcyVI,Thu Feb 18 17:17:54 +0000 2016,en,0,False,1,False,,Bill Trenchard,btrenchard
Very excited to announce @hayleybay joining @firstround today! https://t.co/WGnHpObeu0,Tue Feb 16 17:40:48 +0000 2016,en,1,False,7,False,,Bill Trenchard,btrenchard
This is How Effective Leaders Move Beyond Blame https://t.co/MZtPVJKP5Z,Thu Feb 11 17:21:05 +0000 2016,en,0,False,1,False,,Bill Trenchard,btrenchard
Starting Fires on Purpose — When and How Leaders Need to Break the Rules https://t.co/JiJHR5U8Bs,Tue Feb 09 17:19:50 +0000 2016,en,4,False,3,False,,Bill Trenchard,btrenchard
"Congrats to @benchmark on their newest general partner!  @scottbelsky is all around awesome, great move! https://t.co/NCkrw4A0M4",Mon Feb 08 20:14:27 +0000 2016,en,0,False,1,False,,Bill Trenchard,btrenchard
“The natural evolution of safety for the next wave of transportation innovation” @zendrive raises $13.5M in Series A https://t.co/Yx7SKjeo01,Fri Feb 05 17:49:49 +0000 2016,en,2,False,3,False,,Bill Trenchard,btrenchard
This Is How You Design a Lasting Brand — An Inside Look at Gusto's Reinvention https://t.co/vKMN9q5BlU,Tue Feb 02 17:40:52 +0000 2016,en,0,False,3,False,,Bill Trenchard,btrenchard
A Primer for Startups and Job Seekers to BOTH Win the Talent War https://t.co/2MgcPtegzg,Thu Jan 28 17:17:05 +0000 2016,en,1,False,2,False,,Bill Trenchard,btrenchard
"RT @DormRoomFund: We're so excited to announce our 100th Investment! 

Check out our new site and read more: https://t.co/VuxiUQPknn https:…",Thu Jan 21 17:26:32 +0000 2016,en,37,False,0,False,,Bill Trenchard,btrenchard
Facebook's VP of Tech Communications on Building a Bulletproof Comms Strategy https://t.co/MFwbNd7jOv,Tue Jan 12 17:22:25 +0000 2016,en,0,False,0,False,,Bill Trenchard,btrenchard
Take on Your Competition with These Lessons from Google Maps https://t.co/kHtN0LfIpg,Thu Jan 07 17:24:13 +0000 2016,en,0,False,0,False,,Bill Trenchard,btrenchard
The 30 Best Pieces of Advice for Entrepreneurs in 2015 https://t.co/bpFOUFCidO,Tue Jan 05 17:39:41 +0000 2016,en,1,False,3,False,,Bill Trenchard,btrenchard
RT @Inc: The Video That Puts All Company Holiday Cards to Shame @adamjanofsky https://t.co/TvK483iKdX https://t.co/dRLNxeMXFf,Fri Dec 18 00:22:39 +0000 2015,en,23,False,0,False,,Bill Trenchard,btrenchard
It's the happiest time of the year! The First Round Holiday Video is HERE: https://t.co/pSNkxpU6UG,Thu Dec 17 15:24:02 +0000 2015,en,0,False,3,False,,Bill Trenchard,btrenchard
The Power of Interviewing Customers the Right Way from Twitter’s Ex-VP Product https://t.co/x38faTc3uE,Thu Dec 10 18:26:53 +0000 2015,en,2,False,1,False,,Bill Trenchard,btrenchard
"Here are the Scripts for Sales Success — Emails, Calls and Demos That Close Deals https://t.co/ucJGnQ58vP",Thu Dec 03 17:13:48 +0000 2015,en,1,False,3,False,,Bill Trenchard,btrenchard
Wonder what it's like to be a startup founder? @firstround just surveyed 500+ of them and here's what they said: https://t.co/dugkH115Qw,Wed Dec 02 19:39:30 +0000 2015,en,5,False,7,False,,Bill Trenchard,btrenchard
Radical Candor — The Surprising Secret to Being a Good Boss https://t.co/ZE1rtfIsNl,Tue Nov 24 17:27:36 +0000 2015,en,0,False,0,False,,Bill Trenchard,btrenchard
Draw The Owl and Other Company Values You Didn’t Know You Should Have https://t.co/PzULkOywWe,Thu Nov 19 18:34:18 +0000 2015,en,0,False,2,False,,Bill Trenchard,btrenchard
The Keys to Scaling Yourself as a Technology Leader https://t.co/cC2kcvfiRG,Tue Nov 17 19:10:43 +0000 2015,en,2,False,1,False,,Bill Trenchard,btrenchard
"Indispensable Growth Frameworks from My Years at Facebook, Twitter and Wealthfront https://t.co/zkeCFB04L6",Thu Nov 12 17:35:55 +0000 2015,en,0,False,1,False,,Bill Trenchard,btrenchard
AltSchool's CEO Rebuilt Google's Performance Review System to Work for Startups — Here It Is https://t.co/C6iau6rrVZ,Thu Nov 05 17:25:24 +0000 2015,en,1,False,2,False,,Bill Trenchard,btrenchard
This Is How You Design Your Mobile App for Maximum Growth https://t.co/hGRvy0cSFM,Tue Oct 27 16:42:13 +0000 2015,en,0,False,0,False,,Bill Trenchard,btrenchard
RT @joshk: Well...that's one way to respond when a VC passes... https://t.co/C5WWYnk5KV,Thu Oct 22 17:01:39 +0000 2015,en,933,False,0,False,,Bill Trenchard,btrenchard
RT @Alfred_Lin: Congrats @claralabs on unveiling: http://t.co/pxSFjCa179! AI wired like a human: http://t.co/Q5RjTYsKdZ Waitlist: http://t.…,Thu Sep 24 17:47:52 +0000 2015,en,4,False,0,False,,Bill Trenchard,btrenchard
Hire a Top Performer Every Time with These Interview Questions https://t.co/lOiSI21uRx,Thu Sep 24 16:31:09 +0000 2015,en,0,False,2,False,,Bill Trenchard,btrenchard
"How This Startup’s Culture Won It an Awesome C-Suite, Funding and Partnerships https://t.co/KA5AlO72NE",Tue Sep 22 16:15:22 +0000 2015,en,0,False,2,False,,Bill Trenchard,btrenchard
Here's What a Real Growth Strategy Looks Like--Road Tested by Facebook and Remind: http://t.co/1GcEzXNrSv,Thu Sep 17 16:11:08 +0000 2015,en,2,False,6,False,,Bill Trenchard,btrenchard
RT @TechCrunch: Zenmarketing․io Helps Developers Measure The Payoff For Their Marketing Dollars http://t.co/rct91mb4Vd by @anthonyha,Wed Sep 16 23:18:18 +0000 2015,en,26,False,0,False,,Bill Trenchard,btrenchard
The Simple Rules That Could Transform How You Launch Your Product: http://t.co/x3k2JB9xs4,Tue Sep 15 16:16:55 +0000 2015,en,0,False,3,False,,Bill Trenchard,btrenchard
Check out @packetzoom on Product Hunt today!  https://t.co/zkit8RD8q6,Mon Sep 14 18:08:24 +0000 2015,en,5,False,10,False,,Bill Trenchard,btrenchard
"#PredictiveAnalytics, CRM and easy comm tools can significantly improve your sales team process, via @avisoinc: http://t.co/Zi6sf3Hn7Q",Thu Sep 10 22:47:25 +0000 2015,en,1,False,3,False,,Bill Trenchard,btrenchard
"""Give Away Your Legos"" and Other Commandments for Scaling Startups: http://t.co/Xcd59a7HS8",Thu Sep 10 16:23:43 +0000 2015,en,0,False,0,False,,Bill Trenchard,btrenchard
This is How You Build Products for the New Generation of 'Data Natives': http://t.co/tnMPVYq3oC,Thu Sep 03 17:14:22 +0000 2015,en,0,False,2,False,,Bill Trenchard,btrenchard
@joshk takes a look at autonomous vehicles and new opportunities in the space: http://t.co/D5MJyi34k1,Wed Sep 02 16:35:36 +0000 2015,en,0,False,1,False,,Bill Trenchard,btrenchard
"""The Right Way to Ship Software,"" by @jgoldfein: http://t.co/4yhF3kvhSG",Tue Sep 01 16:21:15 +0000 2015,en,0,False,2,False,,Bill Trenchard,btrenchard
The Story Behind How Pocket Hit 20M Users with 20 People https://t.co/ZlORUPwtJe,Thu Aug 27 16:44:02 +0000 2015,en,1,False,1,False,,Bill Trenchard,btrenchard
"Great new piece by @Kazanjy, ""10 Ways You Need to Change How You Think and Talk to Succeed at Sales"" http://t.co/ulutXA90SF",Tue Aug 25 16:22:20 +0000 2015,en,0,False,1,False,,Bill Trenchard,btrenchard
"Influencers Aren't Born, They're Built — Here's How https://t.co/kkHpBYr3es",Thu Aug 20 16:28:21 +0000 2015,en,5,False,4,False,,Bill Trenchard,btrenchard
The Most Dangerous Leadership Traps — and the 15-Minute Daily Practice That Will Save You http://t.co/6BBEVRBhGh,Thu Aug 13 17:02:40 +0000 2015,en,1,False,4,False,,Bill Trenchard,btrenchard
The Three Tools Netflix Used to Build Its World-Class Brand: http://t.co/q3VKVxsQhs,Tue Aug 11 16:18:19 +0000 2015,en,1,False,1,False,,Bill Trenchard,btrenchard
Great new piece about Dropbox's approach to product development as the company scales. Also touches on how to tweak…http://t.co/IGZdtN5N6u,Thu Aug 06 16:18:56 +0000 2015,en,1,False,5,False,,Bill Trenchard,btrenchard
Why Mobile Will Win First in VR: http://t.co/uIz0pjsiQf,Wed Aug 05 16:20:27 +0000 2015,en,1,False,2,False,,Bill Trenchard,btrenchard
Build software to bring solar to the developing world - work for @JoinBright http://t.co/ZdSnO5mNDX,Tue Aug 04 17:02:33 +0000 2015,en,1,False,3,False,,Bill Trenchard,btrenchard
What Startups Can Learn from General McChrystal about Combining Strategy and Execution: http://t.co/lTTp4i4I6h,Tue Aug 04 16:04:54 +0000 2015,en,0,False,3,False,,Bill Trenchard,btrenchard
This 90 Day Plan Turns Engineers Into Remarkable Managers: http://t.co/ASHpAtxoRk,Thu Jul 30 16:31:17 +0000 2015,en,1,False,2,False,,Bill Trenchard,btrenchard
"RT @trysnowball: Snowball 2.0 is here! Get the notifications you need, and none of the rest. Grab it now: http://t.co/aihMphXKbC",Wed Jul 29 16:30:49 +0000 2015,en,16,False,0,False,,Bill Trenchard,btrenchard
Check out this great post about the electronic freight release process @flexportinc! http://t.co/gN5J3YbjlL,Wed Jul 29 15:19:05 +0000 2015,en,0,False,3,False,,Bill Trenchard,btrenchard
@BrettHagler Thanks for reading!  We are so grateful to have an amazing team working on Review @firstround.,Wed Jul 29 04:09:55 +0000 2015,en,0,False,0,False,,Bill Trenchard,btrenchard
"AppNexus' First Pitch: Before It Steered Around the Cloud to Win Big in AdTech   

http://t.co/tzllbGIfYk",Tue Jul 28 16:43:07 +0000 2015,en,0,False,3,False,,Bill Trenchard,btrenchard
"""The golden rule of email is that personalized content always works better."" http://t.co/idIKYnBXw9",Thu Jul 16 16:25:29 +0000 2015,en,1,False,1,False,,Bill Trenchard,btrenchard
Product Leadership Rules to Live By From My Experience at Pandora https://t.co/i03z5rlHqx,Thu Jul 09 16:16:19 +0000 2015,en,2,False,2,False,,Bill Trenchard,btrenchard
first-round-capital https://t.co/Cef4EXuH4s,Tue Jul 07 20:30:39 +0000 2015,en,0,False,0,False,,Bill Trenchard,btrenchard
Great new piece from Pete Kazanjy on First Round Capital Review https://t.co/ktCSj3afIc,Tue Jul 07 16:33:01 +0000 2015,en,0,False,1,False,,Bill Trenchard,btrenchard
"I'm Sorry, But Agile Won't Fix Your Products: http://t.co/KehZrX5KFQ",Thu Jul 02 16:53:05 +0000 2015,en,0,False,0,False,,Bill Trenchard,btrenchard
"What transparency looks like in practice at a startup. New First Round Capital piece from @yesware, CEO of Yesware: http://t.co/d8w0wz7Aiy",Tue Jun 30 16:40:05 +0000 2015,en,0,False,2,False,,Bill Trenchard,btrenchard
RT @joshk: 1/ There’s been a good discussion recently about the state of tech startup/venture market recently. Our thoughts: https://t.co/V…,Mon Jun 29 16:04:27 +0000 2015,en,140,False,0,False,,Bill Trenchard,btrenchard
"RT @TechCrunch: With $10 Million In Seed, Sano Is Building A Metabolic Health Tracker http://t.co/Tu6PF5Ct4Z by @c_magee27",Fri Jun 19 20:05:32 +0000 2015,en,29,False,0,False,,Bill Trenchard,btrenchard
Designing your sales stack so that customers come to you: http://t.co/QVmiZzNRMh,Tue Jun 16 16:45:57 +0000 2015,en,1,False,3,False,,Bill Trenchard,btrenchard
"Startup advising is broken, here's what First Round Capital is doing to fix it: http://t.co/mfSpn2Zd94",Wed Jun 10 16:07:07 +0000 2015,en,4,False,7,False,,Bill Trenchard,btrenchard
"RT @joshk: Congrats to @mvanhorn &amp; @nikbhogal on launch of @June! http://t.co/vzfwGevj9D (Pro tip to hit a launch deadline, put the date in…",Wed Jun 10 00:22:33 +0000 2015,en,4,False,0,False,,Bill Trenchard,btrenchard
Great new piece from Selina Tobaccowala on how SurveyMonkey cracked the international market: http://t.co/gsTfyujNx8,Tue Jun 02 16:25:25 +0000 2015,en,0,False,1,False,,Bill Trenchard,btrenchard
@cboshuizen @ Planet Labs on how to find &amp; work with interns so they become leaders: http://t.co/8jQ7gEIVeF https://t.co/H3OfruDI0x,Thu May 28 16:11:51 +0000 2015,en,0,False,1,False,,Bill Trenchard,btrenchard
"Leslie's Law: When Small Meets Large, Small (Almost) Always Wins: http://t.co/ZmOa20F8Sl",Tue May 26 16:39:34 +0000 2015,en,0,False,2,False,,Bill Trenchard,btrenchard
"New Review piece from Ben Porterfield at Looker: ""Your Data Is Your Lifeblood--Set up the Analytics It Deserves"" http://t.co/4xgaoiUf0d",Thu May 21 16:40:22 +0000 2015,en,1,False,3,False,,Bill Trenchard,btrenchard
RT @joshk: Great story on @firstround's own @camillericketts!   How Camille Ricketts Is Building a How-To Manual for Startups https://t.co/…,Tue May 19 21:54:55 +0000 2015,en,23,False,0,False,,Bill Trenchard,btrenchard
Fixing Engineering's Loyalty and Longevity Problem: http://t.co/IZUppFW4oD,Tue May 19 16:04:01 +0000 2015,en,1,False,2,False,,Bill Trenchard,btrenchard
"New piece on @First Round Capital Review, ""Bureaucracy Isn't Inevitable--Here's How Airbnb Beat It"" http://t.co/srSOqOjwUJ",Thu May 14 16:11:21 +0000 2015,en,2,False,1,False,,Bill Trenchard,btrenchard
RT @EricNewcomer: There are plenty of eat-the-world Silicon Valley startups ideas. But @flexportinc might have the biggest eyes yet. http:/…,Mon May 11 17:19:47 +0000 2015,en,17,False,0,False,,Bill Trenchard,btrenchard
Here's How Adobe's Director of Product Marketing Navigates the Paradox of Choice: http://t.co/JGaYXU3wt3,Thu May 07 18:20:10 +0000 2015,en,2,False,1,False,,Bill Trenchard,btrenchard
"RT @bgurley: My personal reflections on Dave Goldberg (@davegoldberg), and why I will always strive to ""be like Dave."" http://t.co/jSLfJVtS…",Wed May 06 04:56:48 +0000 2015,en,93,False,0,False,,Bill Trenchard,btrenchard
"""Making bets draws out the people who are willing to put in a huge level of effort to achieve outstanding results."" http://t.co/VGsp3PLkHi",Thu Apr 30 16:32:00 +0000 2015,en,2,False,4,False,,Bill Trenchard,btrenchard
One Rubric Changed Box's Engineering Performance. Here's How: http://t.co/AgZ7SKj9QP,Tue Apr 28 16:28:22 +0000 2015,en,0,False,0,False,,Bill Trenchard,btrenchard
Are you a journalist? Content expert? @firstround is hiring a full-time writer/editor to join The First Round Review http://t.co/ha9oVl4GxS,Thu Apr 16 17:36:16 +0000 2015,en,0,False,0,False,,Bill Trenchard,btrenchard
"RT @urxtech: Announcing AppViews - matching user context with relevant actions 
http://t.co/o9opDwy4aX",Wed Apr 15 22:28:47 +0000 2015,en,18,False,0,False,,Bill Trenchard,btrenchard
"""What I Learned Scaling Engineering Teams Through Euphoria and Horror"" http://t.co/AE3p20pdio",Tue Apr 14 16:17:16 +0000 2015,en,3,False,5,False,,Bill Trenchard,btrenchard
Congrats to the @lendinghome team on a great launch! http://t.co/mPU8bXA0nT,Mon Apr 13 17:53:29 +0000 2015,en,1,False,0,False,,Bill Trenchard,btrenchard
Everything We Wish We'd Known About Building Data Projects: http://t.co/Wd5rnpofdB,Thu Apr 09 16:14:30 +0000 2015,en,1,False,2,False,,Bill Trenchard,btrenchard
RT @yeeguy: Super happy to introduce Vouch to the world http://t.co/pDSXUFv3w6 @vouch,Wed Apr 08 03:31:56 +0000 2015,en,6,False,0,False,,Bill Trenchard,btrenchard
Simple numbers that could change how you hire: http://t.co/baC5EWJVo0,Tue Apr 07 17:34:22 +0000 2015,en,1,False,1,False,,Bill Trenchard,btrenchard
"Now anyone can build an ""OnStar in your pocket"" app, with @zendrive 's Accident Detection SDK: http://t.co/y4RLhS0XDA",Mon Apr 06 15:16:37 +0000 2015,en,3,False,4,False,,Bill Trenchard,btrenchard
"RT @ProductHunt: @johnpjoseph FYI, you've been added as a maker of PacketZoom on @ProductHunt http://t.co/BMt1bJFSia h/t @rrhoover 🙌",Mon Apr 06 15:13:39 +0000 2015,en,1,False,0,False,,Bill Trenchard,btrenchard
Congrats to @sethjs and team on the launch of @honor!,Fri Apr 03 05:16:12 +0000 2015,en,2,False,3,False,,Bill Trenchard,btrenchard
Here's Why You Should Care About Holacracy: http://t.co/2J1akWTT3U,Thu Apr 02 17:06:32 +0000 2015,en,2,False,1,False,,Bill Trenchard,btrenchard
RT @FounderLine: Going LIVE in 10 minutes with @btrenchard from @firstround. Send your startup questions now via tweet or email help@founde…,Wed Apr 01 23:51:31 +0000 2015,en,3,False,0,False,,Bill Trenchard,btrenchard
I'm going live on @FounderLine today at 5pm PT. Tweet your questions now or email help@founderline.com!,Wed Apr 01 17:40:19 +0000 2015,en,1,False,2,False,,Bill Trenchard,btrenchard
The anatomy of the perfect sales hiring process: http://t.co/5OizWtEvls,Tue Mar 31 17:29:12 +0000 2015,en,0,False,3,False,,Bill Trenchard,btrenchard
Really looking forward to joining @beninato on @FounderLine LIVE this Wednesday at 5pm PDT. Tweet us your questions!,Mon Mar 30 16:01:38 +0000 2015,en,4,False,4,False,,Bill Trenchard,btrenchard
How to Consistently Hire Remarkable Data Scientists https://t.co/xy79RZv11O,Thu Mar 26 16:42:51 +0000 2015,en,2,False,2,False,,Bill Trenchard,btrenchard
This is how Coursera competes against Google and Facebook for the best talent: http://t.co/A56heJiWN1,Tue Mar 24 16:22:30 +0000 2015,en,0,False,2,False,,Bill Trenchard,btrenchard
"Thrilled to announce our investment in Notable Labs, working to find drug treatment combinations for brain cancer. http://t.co/gyrh88mcil",Thu Mar 12 00:14:55 +0000 2015,en,2,False,3,False,,Bill Trenchard,btrenchard
@bentoapp announces. Go check it out https://t.co/LbLxalgQgi @chandhok,Wed Mar 11 21:01:42 +0000 2015,en,1,False,1,False,,Bill Trenchard,btrenchard
Huge congrats to the entire team at Looker on their new $30m round! @LookerData @frankbien @lloydtabb http://t.co/kta1MUgnkS,Wed Mar 11 14:59:16 +0000 2015,en,0,False,8,False,,Bill Trenchard,btrenchard
"""I think founders vastly underestimate the risk of busted financing."" New piece from @joshk:

http://t.co/kyTZIy6ePi",Tue Mar 10 16:30:26 +0000 2015,en,3,False,5,False,,Bill Trenchard,btrenchard
You Aren't Getting the Most Out of Your Investors--This is How to Start: http://t.co/mlJLa13NlR,Tue Mar 03 17:57:46 +0000 2015,en,3,False,5,False,,Bill Trenchard,btrenchard
Survive the Leap to Hyper-Growth with This Advice from Steve Blank: http://t.co/nQQGjAm0Rc,Thu Feb 26 17:53:50 +0000 2015,en,3,False,1,False,,Bill Trenchard,btrenchard
"The One Thing Every Leader Needs to Learn: How to Scale Change 

http://t.co/aMF5NZvHn3",Tue Feb 24 17:09:42 +0000 2015,en,3,False,2,False,,Bill Trenchard,btrenchard
Get the most out of your space. Secrets from the designer behind Airbnb and SoundCloud: http://t.co/uvA5nPhKw4,Thu Feb 19 18:04:11 +0000 2015,en,2,False,2,False,,Bill Trenchard,btrenchard
Powerful Tips from Tech's Top Media Trainer and Speaking Coach: http://t.co/26wCwnm8Uq,Tue Feb 17 17:47:44 +0000 2015,en,2,False,2,False,,Bill Trenchard,btrenchard
The Arc of Company Lief and How to Prolong It: http://t.co/rtN8ntk8cL,Thu Feb 12 17:20:59 +0000 2015,en,0,False,1,False,,Bill Trenchard,btrenchard
How This Founder Turned Slow Burn Rate into a Big Exit: http://t.co/pgzT4OrfmP,Tue Feb 10 17:24:10 +0000 2015,en,2,False,3,False,,Bill Trenchard,btrenchard
"To Build An Amazing Sales Team, Start Here First: http://t.co/J9ekAlXFwh",Thu Feb 05 17:10:04 +0000 2015,en,2,False,1,False,,Bill Trenchard,btrenchard
RT @geteero: WiFi is broken. So we're fixing it. Introducing eero. http://t.co/U3QouFyX9n,Wed Feb 04 03:03:27 +0000 2015,en,25,False,0,False,,Bill Trenchard,btrenchard
From $0 to $1 B--Slack's Founder Shares Their Epic Launch Strategy: http://t.co/R4c5hEQA9v,Tue Jan 27 17:16:18 +0000 2015,en,2,False,6,False,,Bill Trenchard,btrenchard
Letting Go of Efficiency Can Accelerate Your Company--Here's How: http://t.co/ry32iKP15Q,Thu Jan 15 18:01:28 +0000 2015,en,4,False,1,False,,Bill Trenchard,btrenchard
"Great new piece from my partner, @robhayes. ""Here's the Advice I Give All of Our First Time Founders"" http://t.co/7ieVCASskr",Tue Jan 13 17:24:19 +0000 2015,en,4,False,7,False,,Bill Trenchard,btrenchard
Great new piece from @gabelunao: Looking to Scale Your Sales? Seven Bullets to Dodge http://t.co/mQ1BEsECfq,Thu Jan 08 17:13:25 +0000 2015,en,4,False,4,False,,Bill Trenchard,btrenchard
The 30 Best Pieces of Advice for Entrepreneurs in 2014: http://t.co/R6mkSAZ7Ub,Tue Jan 06 17:46:07 +0000 2015,en,2,False,2,False,,Bill Trenchard,btrenchard
RT @firstround: Looking for a holiday soundtrack with Silicon Valley pizzazz? Here’s your new jam: https://t.co/PuahfBRLxm,Thu Dec 25 00:43:31 +0000 2014,en,25,False,0,False,,Bill Trenchard,btrenchard
RT @ajs: Didn’t think @HLMorgan could outdue riding on a wrecking ball but his nude leotard might do it http://t.co/ntTujCWyOo http://t.co/…,Thu Dec 18 16:41:36 +0000 2014,en,14,False,0,False,,Bill Trenchard,btrenchard
"Holidays @firstround, the most wonderful time of the year! http://t.co/7ZjLAeLln4",Thu Dec 18 16:27:30 +0000 2014,en,0,False,2,False,,Bill Trenchard,btrenchard
To found a tech startup with an entirely non-technical team would be like opening a restaurant without a chef http://t.co/lnqAocAqmG,Tue Dec 16 20:13:32 +0000 2014,en,2,False,9,False,,Bill Trenchard,btrenchard
Mechanize Your Hiring Process to Make Better Decisions: http://t.co/nbON2Q0sjl,Thu Dec 11 17:53:37 +0000 2014,en,3,False,1,False,,Bill Trenchard,btrenchard
Here's What I Learned from Working with 50  PR Firms: http://t.co/uGCRgl1kin,Tue Dec 09 19:43:52 +0000 2014,en,0,False,4,False,,Bill Trenchard,btrenchard
"This is How You Build Partnerships to Make Your Startup Better, Faster, Stronger: http://t.co/yt1uDCC4QS",Thu Dec 04 17:57:08 +0000 2014,en,2,False,2,False,,Bill Trenchard,btrenchard
An Inside Look at a Flat Organization That Serves Millions: http://t.co/JE4Naa1Cpc,Tue Dec 02 17:25:05 +0000 2014,en,2,False,0,False,,Bill Trenchard,btrenchard
Excited to announce @zendrive is bringing big data to the On Demand driving economy w/ smartphone-based analytics http://t.co/HAjRo9MGBg,Tue Nov 25 19:36:40 +0000 2014,en,4,False,3,False,,Bill Trenchard,btrenchard
"""Good demos don't have to be perfect for the product. They have to be perfect for the audience."" http://t.co/ZDNlJQhZyT",Tue Nov 25 17:57:41 +0000 2014,en,2,False,2,False,,Bill Trenchard,btrenchard
"""What I Learned the Hard Way Building an eCommerce Site"" http://t.co/UjjyZaMK82",Thu Nov 13 17:41:42 +0000 2014,en,3,False,1,False,,Bill Trenchard,btrenchard
"""Find the partners who like your product so much that they will find the funds to promote it for you"" http://t.co/hMct6zKJoW",Tue Nov 11 17:50:03 +0000 2014,en,2,False,1,False,,Bill Trenchard,btrenchard
