Text,Created Date,Language,Retweet Count,Retweeted,Favorite Count,Favorited,co-ordinates,Tweeted By,Screen Name
"I really like what @waterfwd are trying to do, and joined up once I saw the @charitywater founder's video at http://t.co/7S7jn04P. Like it?",Mon Feb 06 14:14:19 +0000 2012,en,1,False,0,False,,Simon Murdoch,smrdch
Claim one of my spaces on @waterfwd and @charitywater will get $10 http://t.co/VPsuoOcc.,Mon Feb 06 14:01:43 +0000 2012,en,1,False,0,False,,Simon Murdoch,smrdch
Aren't 14 year old sons so much fun?!,Tue Apr 05 19:33:43 +0000 2011,en,0,False,0,False,,Simon Murdoch,smrdch
CHEESE!,Tue Apr 05 19:33:22 +0000 2011,en,0,False,0,False,,Simon Murdoch,smrdch
"Apple Reportedly Blocks Sony Reader App, May Foreshadow War With Amazon Kindle http://t.co/efwfdOV via @techcrunch",Tue Feb 01 11:52:25 +0000 2011,en,2,False,0,False,,Simon Murdoch,smrdch
@jdh Hi josh and thanks for the mention - I will add that you are another great person entrepreneurs can get to me through,Fri Aug 13 11:29:40 +0000 2010,en,0,False,0,False,,Simon Murdoch,smrdch
I just joined @angellist http://j.mp/asnQLR. It's @venturehack's directory of angel investors. You can pitch me through http://j.mp/bfSPUX,Fri Aug 13 09:22:13 +0000 2010,en,0,False,0,False,,Simon Murdoch,smrdch
"I'm looking at Explosive Nutrition which is now on Twitter, follow for great deals and offers! http://bit.ly/3pugkw",Mon Nov 16 15:47:09 +0000 2009,en,0,False,0,False,,Simon Murdoch,smrdch
"Trying out #quietriots at quietriots.com, the new start up service from Simon Darling and his team.",Wed Nov 11 09:44:56 +0000 2009,en,0,False,0,False,,Simon Murdoch,smrdch
Shamlessly plugging http://www.explosivenutrition.co.uk/ now we've got it working well - great place for any supplements at very low prices,Tue Sep 15 12:30:16 +0000 2009,en,0,False,0,False,,Simon Murdoch,smrdch
Great great article by the awesome Avinash Kaushik (just retweeted),Sat Aug 29 05:40:06 +0000 2009,en,0,False,0,False,,Simon Murdoch,smrdch
RT @tweetmeme Six Tips For Improving High Bounce / Low Conversion Web Pages | Occam's Razor by Avinash Kaushik http://bit.ly/47ysGX,Sat Aug 29 05:39:13 +0000 2009,en,0,False,0,False,,Simon Murdoch,smrdch
"lost two hours today stuck in traffic jam on m40 - at least I wasn't in the massive pile up though, i suppose",Wed Jul 01 17:44:36 +0000 2009,en,0,False,0,False,,Simon Murdoch,smrdch
Reading Amazon to clueless lawmakers: we're not playing games http://bit.ly/3qeI9 from @econsultancy,Tue Jun 30 06:21:37 +0000 2009,en,0,False,0,False,,Simon Murdoch,smrdch
waiting for google to load....,Thu May 14 16:00:48 +0000 2009,en,0,False,0,False,,Simon Murdoch,smrdch
ironically i'm an investor in a company that understands twitter and is making a lot of noise about it. See www.tweetmeme.com (by fav.or.it),Wed May 06 10:56:40 +0000 2009,en,0,False,0,False,,Simon Murdoch,smrdch
Strong recommendation from Fred Destin - try tweetdeck,Fri May 01 11:34:13 +0000 2009,en,0,False,0,False,,Simon Murdoch,smrdch
At Zoopla board meeting talking about how best to use twitter,Fri May 01 11:33:43 +0000 2009,en,0,False,0,False,,Simon Murdoch,smrdch
"Listening to They Might Be Giants on Spotify, drinking rioja and cooking Peking duck for the mrs. Life doesn't get much better than this!",Mon Mar 30 19:07:47 +0000 2009,en,0,False,0,False,,Simon Murdoch,smrdch
just going to lunch,Mon Mar 30 12:45:11 +0000 2009,en,0,False,0,False,,Simon Murdoch,smrdch
