Text,Created Date,Language,Retweet Count,Retweeted,Favorite Count,Favorited,co-ordinates,Tweeted By,Screen Name
Train-blog post: Intermittent Fasting + Carbo Back Loading = Success https://t.co/3zAnrMW2rr,Sun Feb 28 00:47:18 +0000 2016,en,1,False,1,False,,David Shen,dshen
Train-blog post: Total Immersion: Can't Seem to Get the 2BK? Try Cross Crawling https://t.co/a69w6bBMNl,Thu Feb 11 04:11:09 +0000 2016,en,0,False,0,False,,David Shen,dshen
Train-blog post: Breath Training for Intra-Abdominal Pressure from the Total Immersion @tiswim Forums https://t.co/OP4LHADDRS,Tue Feb 09 18:27:33 +0000 2016,en,0,False,0,False,,David Shen,dshen
We update our early stage investing model w/ @cbinsights new funnel data. Now even farther from bkeven at 35.7% loss https://t.co/XcJuCTiPe6,Sat Dec 12 23:37:44 +0000 2015,en,4,False,14,False,,David Shen,dshen
Biz-blog post: Early Stage Investing Take 2: CBInsights Updates Their Funnel and We Update Our Model https://t.co/ZoQUpCp2CA,Sat Dec 12 09:43:24 +0000 2015,en,2,False,7,False,,David Shen,dshen
Early Stage Investing Take 2: CBInsights Updates Their Funnel and We Update Our Model https://t.co/Z6QwQA5szE #lcnews #lcblog,Sat Dec 12 05:05:53 +0000 2015,en,0,False,5,False,,David Shen,dshen
How to Ace Your Entrepreneur Class https://t.co/mAtB68P3pM #lcnews #lcblog,Wed Nov 25 16:31:54 +0000 2015,en,0,False,1,False,,David Shen,dshen
Biz-blog post: How to Ace Your Entrepreneur Class https://t.co/sK7iBrfWBl,Wed Nov 25 16:07:46 +0000 2015,en,0,False,0,False,,David Shen,dshen
Training-blog post: Total Immersion: Ankle Mobility http://t.co/s9CmoyvYEW,Fri Aug 28 22:16:29 +0000 2015,en,0,False,0,False,,David Shen,dshen
Training-blog post: Total Immersion: The Dead Bug http://t.co/ahFB5QClE4,Fri Aug 28 21:55:41 +0000 2015,en,0,False,0,False,,David Shen,dshen
Training-blog post: Total Immersion: An Assessment for Swimmers Part I http://t.co/3oBAjblWgs,Thu Aug 13 00:01:46 +0000 2015,en,0,False,1,False,,David Shen,dshen
Early Stage Marketplace Investing http://t.co/3uj7UHLLOg #lcnews #lcblog @edwcoady @jlanahan @launchlife @thomas_egan,Wed Aug 12 20:30:31 +0000 2015,en,3,False,8,False,,David Shen,dshen
Biz-blog post: Early Stage Marketplace Investing http://t.co/GVyeydAx4P,Wed Aug 12 20:10:25 +0000 2015,en,0,False,1,False,,David Shen,dshen
Train-blog post: Total Immersion: Neck Mobility for Swimming http://t.co/s3n1lysx2f,Sun Jun 14 02:24:57 +0000 2015,en,0,False,3,False,,David Shen,dshen
Many thx @cbinsights @pitchbook for their data help: Angel Investing at Today’s Market Rates is a Losing Proposition http://t.co/1OHCNOJ6Ak,Thu May 07 17:57:53 +0000 2015,en,5,False,6,False,,David Shen,dshen
@semil @bryce we built a model showing fund economics. Result is worse.,Wed May 06 23:18:30 +0000 2015,en,0,False,1,False,,David Shen,dshen
Biz-blog post: Angel Investing at Today's Market Rates is a Losing Proposition http://t.co/LAH8hTN0Ug,Wed May 06 22:35:20 +0000 2015,en,0,False,4,False,,David Shen,dshen
Angel Investing at Today’s Market Rates is a Losing Proposition http://t.co/1OHCNOJ6Ak #lcnews #lcblog,Wed May 06 22:12:35 +0000 2015,en,3,False,7,False,,David Shen,dshen
I'm #ReadyToRun! Working to be injury free &amp; improve performance. Buy the book here: http://t.co/XEvIAgcEFJ http://t.co/67tEjuI9nd,Wed Apr 22 17:13:22 +0000 2015,en,0,False,0,False,,David Shen,dshen
"The Tweetstorm that Spawned the 10,000X Startup http://t.co/BCMjoGyvy6 #lcnews #lcblog",Fri Mar 13 22:07:30 +0000 2015,en,7,False,13,False,,David Shen,dshen
"Biz-blog post: The Tweetstorm that Spawned the 10,000X Startup http://t.co/ZvYVwmbdZF",Fri Mar 13 21:45:25 +0000 2015,en,0,False,0,False,,David Shen,dshen
Tri-blog post: How to Train for Abdominal Breathing and Generating Intra-Abdominal Pressure http://t.co/2JpwDW2voT,Sun Jan 25 19:23:34 +0000 2015,en,0,False,0,False,,David Shen,dshen
One of my investments @yourmechanic is hiring in all disciplines http://t.co/g7yKMUu3wk - check it out!,Sun Jan 25 18:17:31 +0000 2015,en,2,False,2,False,,David Shen,dshen
Biz-blog post: The Customer Adoption Problem for Health Startups http://t.co/6gx0efpLVb,Sat Jan 24 02:38:12 +0000 2015,en,0,False,2,False,,David Shen,dshen
The Customer Adoption Problem for Health Startups http://t.co/8iONBduEpQ #lcnews #lcblog,Sat Jan 24 02:17:35 +0000 2015,en,2,False,1,False,,David Shen,dshen
Tri-blog post: Optimal Breathing: The Case for Diaphragmatic Breathing http://t.co/h86xzlApsc,Fri Jan 02 00:28:51 +0000 2015,en,2,False,0,False,,David Shen,dshen
Tri-blog post: The New Alleva-Wave: Healing via Pulsed Electro-Magnetic Fields http://t.co/AwitgkRNIZ,Thu Dec 11 00:30:40 +0000 2014,en,0,False,1,False,,David Shen,dshen
Tri-blog post: About Nasal Breathing http://t.co/x7QAmVwtqJ,Wed Nov 19 19:04:31 +0000 2014,en,0,False,0,False,,David Shen,dshen
Tri-blog post: Swim Pro at Menlo Swim with Team Sheeper http://t.co/eux9CKMJ5x,Mon Nov 10 23:41:31 +0000 2014,en,0,False,0,False,,David Shen,dshen
Biz-blog post: All About US Investors for International Startups http://t.co/VBWjnpo2BS,Thu Nov 06 01:08:54 +0000 2014,en,1,False,5,False,,David Shen,dshen
All About US Investors for International Startups http://t.co/6HNpGvSbQu #lcnews #lcblog,Thu Nov 06 00:47:26 +0000 2014,en,3,False,5,False,,David Shen,dshen
@Neighborly can I get access to your awesome platform? Thx!!,Tue Oct 21 21:32:18 +0000 2014,en,0,False,3,False,,David Shen,dshen
Upstream and Downstream http://t.co/J8zAJsmt7C #lcblog #lcnews,Wed Sep 03 00:20:47 +0000 2014,en,0,False,1,False,,David Shen,dshen
Biz-blog post: Upstream and Downstream http://t.co/8BR4UmCbA3,Tue Sep 02 23:59:36 +0000 2014,en,0,False,0,False,,David Shen,dshen
I just backed pd.id: date rape drug detector in drinks http://t.co/tYbVId5k41 #indiegogo via @indiegogo,Thu Aug 14 17:33:22 +0000 2014,en,0,False,1,False,,David Shen,dshen
Biz-blog post: The Billions of Dollars Opportunity http://t.co/wGxbSCWcjH,Thu Jul 03 19:05:36 +0000 2014,en,0,False,2,False,,David Shen,dshen
The Billions of Dollars Opportunity http://t.co/0u6Vy63bBA #lcblog #lcnews,Thu Jul 03 18:44:58 +0000 2014,en,1,False,2,False,,David Shen,dshen
The Pre-Emptive Bridge http://t.co/SG0ST5tk7t #lcblog #lcnews,Sat Jun 28 20:13:54 +0000 2014,en,0,False,2,False,,David Shen,dshen
Biz-blog post: The Pre-Emptive Bridge http://t.co/kbB1IQdg1u,Sat Jun 28 16:47:49 +0000 2014,en,0,False,2,False,,David Shen,dshen
Tri-blog post: ARPWave Search and Destroy for Left Shoulder Part II http://t.co/5YNQcyQrpS,Fri May 09 23:44:07 +0000 2014,en,0,False,0,False,,David Shen,dshen
Tri-blog post: Dynamic Neuromuscular Stabilization: Awesome! http://t.co/nMeYauQZKf,Thu May 01 18:31:22 +0000 2014,en,0,False,0,False,,David Shen,dshen
Tri-blog post: @MobilityWOD Quick Start Guide http://t.co/foHFB75LLd,Thu Apr 17 20:30:19 +0000 2014,en,0,False,3,False,,David Shen,dshen
The State of Early Stage in March 2014 http://t.co/jw3Q2UfMsP #lcblog #lcnews,Thu Apr 17 18:57:22 +0000 2014,en,4,False,0,False,,David Shen,dshen
Biz-blog post: The State of Early Stage in March 2014 http://t.co/JlD9g0Wy7Z,Thu Apr 17 18:35:59 +0000 2014,en,0,False,0,False,,David Shen,dshen
Tri-blog post: ARPWave Search and Destroy for Knee Tweak Part I http://t.co/kW2tKBIctW,Tue Apr 15 19:45:21 +0000 2014,en,0,False,0,False,,David Shen,dshen
Biohacking as the Next Opportunity http://t.co/q6agj65Rth #lcblog #lcnews,Thu Apr 10 19:01:31 +0000 2014,en,1,False,2,False,,David Shen,dshen
Biz-blog post: Biohacking as the Next Opportunity http://t.co/G7AxJoovHG,Thu Apr 10 18:40:17 +0000 2014,en,0,False,1,False,,David Shen,dshen
"""I've Never Heard Of That Before"" http://t.co/pRXcD7bXtm #lcblog",Thu Mar 27 22:45:52 +0000 2014,en,0,False,3,False,,David Shen,dshen
"Biz-blog post: ""I've Never Heard Of That Before"" http://t.co/0nOjLehTri",Thu Mar 27 22:25:09 +0000 2014,en,0,False,0,False,,David Shen,dshen
Tri-blog post: Somapulse/Alleva-Wave: Healing and Recovery via Pulsed Electro-Magnetic Fields http://t.co/knA2ACVkhO,Thu Mar 27 21:41:40 +0000 2014,en,0,False,1,False,,David Shen,dshen
Biz-blog post: Hiatus from Facebook and Twitter http://t.co/JNzF8bfMue,Thu Mar 27 19:08:35 +0000 2014,en,1,False,1,False,,David Shen,dshen
anyone use bitscope: http://t.co/lOGbWj5VlQ love to hear feedback on it thx,Wed Mar 19 03:22:52 +0000 2014,en,0,False,0,False,,David Shen,dshen
Eyes are still mush. Brain is now mush,Wed Mar 19 01:38:24 +0000 2014,en,0,False,1,False,,David Shen,dshen
RT @Jason: 'Star Wars Episode VII' begins filming in May https://t.co/gQpgaIfPPv,Wed Mar 19 01:35:15 +0000 2014,en,10,False,0,False,,David Shen,dshen
Reading Ghost Wave- love surfing books,Wed Mar 19 00:54:07 +0000 2014,en,0,False,1,False,,David Shen,dshen
"Money quote:  “What should Russia be making money from, mortgage foreclosures?” http://t.co/hJbs8vDZx3",Tue Mar 18 22:58:51 +0000 2014,en,0,False,0,False,,David Shen,dshen
Ugh eyes dilated can’t focus,Tue Mar 18 22:37:10 +0000 2014,en,0,False,0,False,,David Shen,dshen
Setting the record straight http://t.co/ZSG38tqNtF /v @whatsapp,Tue Mar 18 15:49:37 +0000 2014,en,1,False,0,False,,David Shen,dshen
"never ceases to amaze me - for elderly person, using the ipad is a ton easier than figuring out a current generation TV",Tue Mar 18 15:36:28 +0000 2014,en,0,False,2,False,,David Shen,dshen
hydrating,Tue Mar 18 02:08:44 +0000 2014,en,0,False,0,False,,David Shen,dshen
how nice of flux to turn my monitor's blue items green for st. paddy's day. but it's monday and the effect is still here. flux off,Mon Mar 17 13:58:02 +0000 2014,en,0,False,0,False,,David Shen,dshen
Just one more word to end the day: SAKE. BTW it’s also a four letter word,Fri Mar 14 02:20:42 +0000 2014,en,0,False,0,False,,David Shen,dshen
Today only four letter words are appropriate,Thu Mar 13 20:01:29 +0000 2014,en,1,False,1,False,,David Shen,dshen
@IanGertler @ceonyc but like ducks they'll be migrating back soon (sigh),Wed Mar 12 23:45:35 +0000 2014,en,0,False,0,False,,David Shen,dshen
"@ceonyc if thats what happened, thats also ok by me",Wed Mar 12 23:45:07 +0000 2014,en,0,False,0,False,,David Shen,dshen
@kouroshk NO I CANNOT,Wed Mar 12 22:43:39 +0000 2014,en,0,False,1,False,,David Shen,dshen
"what an amazingly quiet, sedate week here in Palo Alto. can we have more SXSWs?",Wed Mar 12 22:43:28 +0000 2014,en,0,False,3,False,,David Shen,dshen
CUTTING THROUGH THE BULLSHIT SURROUNDING FLIGHT MH370 http://t.co/7EX4Gv5HfM,Wed Mar 12 22:41:44 +0000 2014,en,0,False,0,False,,David Shen,dshen
sump pumps are the bane of my existence,Wed Mar 12 19:26:06 +0000 2014,en,0,False,0,False,,David Shen,dshen
@pkedrosky you'd think HW would be smart enough now to reset itself and recover from problems,Tue Mar 11 19:12:36 +0000 2014,en,0,False,0,False,,David Shen,dshen
"just fixed my home internet again. can't we move beyond turning everything off, waiting 10-30 seconds, and turning everything back on?",Tue Mar 11 18:37:23 +0000 2014,en,0,False,0,False,,David Shen,dshen
started @BeStrongFirst ladders with Pullups and Ring Dips today - time to up the ante @DrMarkCheng @markrif1,Mon Mar 10 18:03:59 +0000 2014,en,0,False,0,False,,David Shen,dshen
my new project: how to pass solid waste after every meal - preparation is lacking in this aspect - digestion not quite right @evoultrafit,Mon Mar 10 18:01:13 +0000 2014,en,0,False,0,False,,David Shen,dshen
My daughter made me realize Adventure Time is just a cartoon parody of The Omega Man,Sun Mar 09 22:43:26 +0000 2014,en,0,False,1,False,,David Shen,dshen
RT @jrlevine: DRM for shitty coffee RT @dskok: Own a Keurig coffee maker? Your pods days may be numbered: http://t.co/24lgbCzfTm,Sun Mar 09 14:40:25 +0000 2014,en,2,False,0,False,,David Shen,dshen
"POV power=100, 245pps. still buzzin'. refueling like a you wouldn't believe. cc @evoultrafit",Sat Mar 08 22:40:51 +0000 2014,en,0,False,1,False,,David Shen,dshen
The Scary New Evidence on BPA-Free Plastics http://t.co/EbbdixvZhx,Fri Mar 07 15:30:42 +0000 2014,en,0,False,0,False,,David Shen,dshen
"@tolar @soniasaraiya well if you put it that way, then it makes sense",Fri Mar 07 04:07:09 +0000 2014,en,0,False,0,False,,David Shen,dshen
@tolar @soniasaraiya dude that's kinda weird man,Fri Mar 07 04:05:03 +0000 2014,en,0,False,1,False,,David Shen,dshen
@ericnakagawa everyone is forced to sign up for it esp for health. even the law requires auto insurance. there must be a better way,Thu Mar 06 22:28:33 +0000 2014,en,0,False,1,False,,David Shen,dshen
hey @lareedraper will you create a DVD on KB correctives for mvmt screen professional? i see that by brett jones is teaching at FMSummit,Thu Mar 06 22:10:05 +0000 2014,en,0,False,0,False,,David Shen,dshen
WILL SOMEONE PLEASE DISRUPT INSURANCE? PLEASE PLEASE,Thu Mar 06 19:33:36 +0000 2014,en,0,False,2,False,,David Shen,dshen
wishing i had another 2 somapulses today cc @BobTroia @DrPawluk,Wed Mar 05 15:11:55 +0000 2014,en,1,False,0,False,,David Shen,dshen
amazing how @mobilitywod somehow knows exactly whats wrong with me every day in dailyRx: http://t.co/WtFmeFollV,Wed Mar 05 15:09:41 +0000 2014,en,0,False,1,False,,David Shen,dshen
"""I encouraged them to offer the seed investors the right to participate in the round."" http://t.co/jtoxpUKIYH thx @fredwilson!",Tue Mar 04 21:28:08 +0000 2014,en,0,False,0,False,,David Shen,dshen
"unbelievable - after multiple attempts to boot up laptop, trying restore after unsuccessful restore, the laptop magically comes alive. WTF",Tue Mar 04 00:36:56 +0000 2014,en,0,False,0,False,,David Shen,dshen
"Whenever I walk in here, I feel a palpable drop in IQ by several hundred points",Mon Mar 03 18:07:32 +0000 2014,en,0,False,0,False,,David Shen,dshen
More health care hell,Mon Mar 03 17:58:05 +0000 2014,en,0,False,0,False,,David Shen,dshen
"bought a Windows 7 laptop, boots up, loads a bunch of updates, shuts down, and now won't startup again. MSFT sucks",Mon Mar 03 16:15:24 +0000 2014,en,0,False,2,False,,David Shen,dshen
14 Year Old Boy Just Wrote The Most Significant Poem This Decade http://t.co/UkYCkHFvug,Sun Mar 02 17:36:16 +0000 2014,en,1,False,2,False,,David Shen,dshen
@cwodtke it’s amazing how many good delivery startups are operating in Palo Alto. No idea how they got funding,Sun Mar 02 15:24:08 +0000 2014,en,0,False,0,False,,David Shen,dshen
Another rainy day trip to LA. Hope I get back before midnight. Dang sfo delays,Sun Mar 02 15:23:12 +0000 2014,en,0,False,0,False,,David Shen,dshen
@cwodtke door dash? Fluc?,Sun Mar 02 02:33:27 +0000 2014,nl,0,False,1,False,,David Shen,dshen
@giordanobc pics?,Sun Mar 02 02:32:53 +0000 2014,en,0,False,1,False,,David Shen,dshen
is the drought over yet? geez pounding rain all night,Fri Feb 28 19:26:31 +0000 2014,en,0,False,0,False,,David Shen,dshen
An internet company (@betaworks) imagines itself as a book http://t.co/7FT1w4IJ8F,Fri Feb 28 14:46:43 +0000 2014,en,0,False,0,False,,David Shen,dshen
just one of those days where i'm wishing i had two more somapulses @DrPawluk @bulletproofexec,Tue Feb 25 23:55:02 +0000 2014,en,0,False,0,False,,David Shen,dshen
"Yes it was an asswhuppin’ via push-ups, medicine ball cleans and sit ups",Sun Feb 23 19:24:58 +0000 2014,en,0,False,0,False,,David Shen,dshen
Day 2 Crossfit level 1 trainer cert- a bit stiff but ready to go for another ass whuppin,Sun Feb 23 16:50:38 +0000 2014,en,0,False,2,False,,David Shen,dshen
Thank god for POV loosen cc @evoultrafit,Sun Feb 23 02:34:05 +0000 2014,en,0,False,0,False,,David Shen,dshen
Day 1 Crossfit level 1 almost over- ass kicked by thrusters and burpees,Sun Feb 23 00:59:54 +0000 2014,en,0,False,0,False,,David Shen,dshen
Crossfit level 1 trainer cert!,Sat Feb 22 16:49:12 +0000 2014,en,1,False,3,False,,David Shen,dshen
.@LaunchLife I think some cosmic event happened where human IQ just dropped to all time low cc @ericnakagawa,Fri Feb 21 23:41:18 +0000 2014,en,0,False,0,False,,David Shen,dshen
@ericnakagawa I wanna move to canada.,Fri Feb 21 23:32:14 +0000 2014,en,0,False,0,False,,David Shen,dshen
This is a fucken joke. All. Of. This.,Fri Feb 21 23:01:14 +0000 2014,en,0,False,1,False,,David Shen,dshen
"""affordable care act"" should be renamed ""everyone can get insurance which may or may not be affordable but stop complaining act""",Fri Feb 21 17:28:03 +0000 2014,en,0,False,0,False,,David Shen,dshen
RT @VentureBeat: Amazon reportedly planning March rollout for web TV box http://t.co/KSX8zi8qRR by @EricBlattberg,Fri Feb 21 16:34:04 +0000 2014,en,13,False,0,False,,David Shen,dshen
"""CoveredCA is experiencing technical difficulties with the enrollment website, which led to an unplanned system outage beg yesterday""",Thu Feb 20 21:00:10 +0000 2014,en,0,False,0,False,,David Shen,dshen
Tri-blog post: 12 Months Training with @EVOUltrafit and the ARPWave POV http://t.co/2wiY7hcbpx,Thu Feb 20 20:58:08 +0000 2014,en,0,False,0,False,,David Shen,dshen
it's amazing that hospitals will tout nutritional recommendations but yet serve the crappiest food I've ever seen,Thu Feb 20 18:13:49 +0000 2014,en,3,False,2,False,,David Shen,dshen
@LaunchLife @launchcapital @thomas_egan @jlanahan @EdwCoady @ecslaunch did i miss some drinking party where you're getting sentimental?,Thu Feb 20 05:44:38 +0000 2014,en,0,False,2,False,,David Shen,dshen
Great info: Carbohydrate recommendations for optimal health http://t.co/Uxr7HVdOno,Wed Feb 19 21:07:18 +0000 2014,en,0,False,0,False,,David Shen,dshen
i need some shoes with stim pads built into the footbed. anyone got any? cc @evoultrafit,Wed Feb 19 19:32:15 +0000 2014,en,0,False,0,False,,David Shen,dshen
AWSM: can’t wait to start night training protocol with @evoultrafit. SUCKS: no time to train in daytime,Wed Feb 19 03:27:26 +0000 2014,en,0,False,0,False,,David Shen,dshen
wow CoveredCA online chat and phone system totally overwhelmed. so sad,Tue Feb 18 18:37:10 +0000 2014,en,0,False,0,False,,David Shen,dshen
Women’s Curling! I had no idea it existed,Tue Feb 18 00:03:35 +0000 2014,en,0,False,0,False,,David Shen,dshen
FTW: Why you should move that button 3px to the left http://t.co/8rV343lfVn,Mon Feb 17 21:27:41 +0000 2014,en,0,False,0,False,,David Shen,dshen
Ugh don’t think I could have taken Gravity in IMAX ugh ugh ugh,Mon Feb 17 03:11:04 +0000 2014,en,0,False,0,False,,David Shen,dshen
Funny word: Manny- a man nanny lol,Sun Feb 16 18:51:40 +0000 2014,en,0,False,0,False,,David Shen,dshen
Just wanted to say my Flappy Bird high score is 1. Yep a 1. I suck.,Sun Feb 16 18:47:19 +0000 2014,en,0,False,0,False,,David Shen,dshen
"RT @sama: ""i'm raising an angel fund"" is the new ""i'm starting a startup""",Sun Feb 16 04:19:09 +0000 2014,en,59,False,0,False,,David Shen,dshen
RT @zerohedge: The Drugging Of America Summarized In 19 Mind-Altering Facts http://t.co/x7BajwXWT1,Sat Feb 15 19:55:08 +0000 2014,en,53,False,0,False,,David Shen,dshen
@matte @ireneau yep first Caltrain ride in my 26 years in SF bay!,Sat Feb 15 18:43:35 +0000 2014,en,0,False,0,False,,David Shen,dshen
Riding Caltrain for the first time,Sat Feb 15 18:18:36 +0000 2014,en,0,False,1,False,,David Shen,dshen
@carlpaoli @gymnasticswod i dont get it. been looking 4 beginner pull up progression. nobody has one cept for you. whats up with that,Wed Feb 12 17:54:11 +0000 2014,en,0,False,0,False,,David Shen,dshen
wow the content on @gymnasticswod is awesome - love the progressions HT @carlpaoli,Wed Feb 12 17:06:42 +0000 2014,en,1,False,1,False,,David Shen,dshen
Conflating running a business with starting a business is what I consider to be the problem with getting an MBA. http://t.co/ezhmYM1o66,Wed Feb 12 15:43:28 +0000 2014,en,1,False,2,False,,David Shen,dshen
there is a fundamental difference between starting a company and running a company http://t.co/ezhmYM1o66,Wed Feb 12 15:42:57 +0000 2014,en,0,False,3,False,,David Shen,dshen
Anonymity breeds meanness--the Internet has proven this time and time again.  http://t.co/jVD0hLeZBg,Tue Feb 11 16:56:16 +0000 2014,en,1,False,1,False,,David Shen,dshen
@danbragiel @vlauria @bragiel ooo cool. got a medium?,Tue Feb 11 15:02:59 +0000 2014,en,0,False,0,False,,David Shen,dshen
@vlauria @bragiel @danbragiel dang it i never got a meetro shirt!,Tue Feb 11 04:43:58 +0000 2014,en,0,False,0,False,,David Shen,dshen
whats the easier book publishing platform out there? upload word doc -&gt;book? tumblr-&gt;book? thx!,Mon Feb 10 21:15:38 +0000 2014,en,0,False,0,False,,David Shen,dshen
@m3thdman @dumbstarbucks awesome,Mon Feb 10 16:20:28 +0000 2014,en,0,False,0,False,,David Shen,dshen
i wish i could buy an itunes album full of phone on hold music. it seems that's all the music i listen to these days.,Mon Feb 10 16:17:05 +0000 2014,en,0,False,2,False,,David Shen,dshen
what the heck is a @dumbstarbucks ?,Mon Feb 10 15:58:13 +0000 2014,en,0,False,0,False,,David Shen,dshen
.@larrysalibra apps are becoming like linkbait. downloadbait?,Mon Feb 10 15:34:33 +0000 2014,en,0,False,0,False,,David Shen,dshen
"i guess i should download Secret. i'm just an brainless internet lemming after all. Before Secret, it was Flappy Birds...",Mon Feb 10 15:10:14 +0000 2014,en,0,False,2,False,,David Shen,dshen
"Just hangin’ with @EdwCoady at lax, another rainy delay into sfo on @VirginAmerica",Mon Feb 10 05:13:02 +0000 2014,en,0,False,0,False,,David Shen,dshen
looking fwd to this one by @mobilitywod: Ready to Run https://t.co/0P1Xq0N66V,Sat Feb 08 15:20:59 +0000 2014,en,0,False,0,False,,David Shen,dshen
looking fwd to new book by @carlpaoli! free+style | maximize sport and life performance with four basic movements http://t.co/pVkJu4Xj4m,Sat Feb 08 15:10:58 +0000 2014,en,1,False,0,False,,David Shen,dshen
"RT @brentgrinna: ""larger seed rounds substantially increase the odds of raising a Series A"" nice analysis from @ttunguz 
http://t.co/p2BtQu…",Fri Feb 07 16:28:09 +0000 2014,en,16,False,0,False,,David Shen,dshen
@sammandel does NY health insurance cover rats?,Fri Feb 07 01:39:47 +0000 2014,en,0,False,0,False,,David Shen,dshen
"RT @TheRealNimoy: Smokers, please understand. If you quit after you're diagnosed with lung damage it's too late. Grandpa says learn my less…",Thu Feb 06 17:45:08 +0000 2014,en,4365,False,0,False,,David Shen,dshen
Just saw a rat run across the hall at Santa Clara Valley Medical. Faith in healthcare system drops from -100 to -500,Thu Feb 06 17:36:32 +0000 2014,en,1,False,2,False,,David Shen,dshen
"High-Performance, No BS Correctives by Dan John http://t.co/rM6RxbElZn",Thu Feb 06 16:07:09 +0000 2014,en,0,False,0,False,,David Shen,dshen
Why This May Have Been The Last Time We See Such Outrageously Expensive Super Bowl Commercials http://t.co/sCiWWPhgIj,Wed Feb 05 15:34:58 +0000 2014,en,0,False,0,False,,David Shen,dshen
@cwodtke trolling FB won't work. i just made a facebook movie which showed how boring my life was...,Wed Feb 05 04:27:21 +0000 2014,en,0,False,0,False,,David Shen,dshen
@cwodtke can i be in your deck?,Wed Feb 05 04:22:52 +0000 2014,en,0,False,0,False,,David Shen,dshen
@ericnakagawa asked my financial guy. he'll know.,Wed Feb 05 03:46:34 +0000 2014,en,0,False,0,False,,David Shen,dshen
i'm so behind -whats causing this: @zerohedge: Japan Re-Crisis-ing; Nikkei Plunges 300; S&amp;P's Dead-Cat-Bounce Dead http://t.co/rzA1MSQ5Ub,Wed Feb 05 03:04:28 +0000 2014,en,0,False,0,False,,David Shen,dshen
just got my copy of @DrMarkCheng prehab/rehab - wow @lareedraper is fast! looking fwd to watching,Wed Feb 05 02:08:15 +0000 2014,en,1,False,0,False,,David Shen,dshen
"@jlanahan hmm upon further reflection, it's probably untrue and linkbait. so much false crap on the net now",Tue Feb 04 21:05:28 +0000 2014,en,0,False,0,False,,David Shen,dshen
@jlanahan they are coming out of the woodwork with gen solicitation and popularity/fame of startup investing,Tue Feb 04 20:48:11 +0000 2014,en,0,False,0,False,,David Shen,dshen
How In-app Purchases Have Destroyed The Industry http://t.co/N7aUzhQEb4,Tue Feb 04 20:46:09 +0000 2014,en,0,False,1,False,,David Shen,dshen
"The fake VC, eccentric German Millionaire and the Sociopath http://t.co/E0OF5L3xVA HT @davemcclure",Tue Feb 04 19:09:07 +0000 2014,en,2,False,1,False,,David Shen,dshen
RT @zerohedge: Why This Harvard Economist Is Pulling All His Money From Bank Of America http://t.co/c9TM5ueVhK,Sat Feb 01 00:28:03 +0000 2014,en,82,False,0,False,,David Shen,dshen
Thus ends another thrilling episode of “Healthcare Hell” next up: “The Price is Right: Your Life”,Sat Feb 01 00:21:28 +0000 2014,en,1,False,1,False,,David Shen,dshen
"Looking fwd to The Roll Model by @yogatuneup ht @mobilitywod 
http://t.co/rSbG4U687e",Sat Feb 01 00:03:48 +0000 2014,en,0,False,0,False,,David Shen,dshen
VC Lip Reading Video Is The Best VC Video You’ll See Today ht @hunterwalk http://t.co/CGPDM9Gxn6,Fri Jan 31 23:19:00 +0000 2014,en,0,False,1,False,,David Shen,dshen
funny how everything seems much more happier and clearer after a whole bottle of sake,Fri Jan 31 04:25:56 +0000 2014,en,0,False,2,False,,David Shen,dshen
both my @Meta_Watch_Help and @Pebble totally flaky performance due to BT. whole industry flattened by crappy BT tech,Fri Jan 31 00:16:49 +0000 2014,en,2,False,2,False,,David Shen,dshen
RT @FastCoDesign: Frog chief creative officer leaves to start his own UX company. http://t.co/bZJAhaAZ5r http://t.co/FZgsJLRS6D,Thu Jan 30 16:00:05 +0000 2014,en,18,False,0,False,,David Shen,dshen
"RT @christinelu: LOL! - Heard on @NPR: ""Bitcoin is the Kim Kardashian of money. It keeps gaining in popularity, but no one knows why."" (via…",Thu Jan 30 15:35:01 +0000 2014,en,46,False,0,False,,David Shen,dshen
@neilw @verge ugh can't download yet!,Thu Jan 30 15:34:26 +0000 2014,en,0,False,0,False,,David Shen,dshen
whoa: Lenovo To Buy Motorola Mobility From Google For $2.91 Billion | TechCrunch http://t.co/nwbSRVnSMI,Thu Jan 30 14:09:10 +0000 2014,en,0,False,0,False,,David Shen,dshen
