Text,Created Date,Language,Retweet Count,Retweeted,Favorite Count,Favorited,co-ordinates,Tweeted By,Screen Name
"""Are you just unhappy with your current situation or will there always be a reason not to be happy, regardless?"" &lt;- powerful question.",Sat Jul 18 09:01:48 +0000 2015,en,0,False,3,False,,Mitchell Harper,mitchellharper
"In a world of bulk emails, never forget the value of a single email with a passionate user, customer, partner or employee.",Fri Jul 17 04:40:19 +0000 2015,en,2,False,2,False,,Mitchell Harper,mitchellharper
The right idea at the wrong time is still the wrong idea.,Fri Jul 17 03:58:51 +0000 2015,en,1,False,2,False,,Mitchell Harper,mitchellharper
... and were (almost) convinced they were right many times along the way. https://t.co/ruQaOa1GLU,Fri Jul 17 03:57:55 +0000 2015,en,1,False,4,False,,Mitchell Harper,mitchellharper
The only way to consistently get in better shape is to like your workout. Lift less and change exercises if it means you'll stay committed.,Fri Jul 17 03:54:28 +0000 2015,en,0,False,4,False,,Mitchell Harper,mitchellharper
"Without a doubt the HARDEST skill to master as an entrepreneur is patience. The bigger your idea, the harder it is to be patient.",Fri Jul 17 03:36:13 +0000 2015,en,5,False,12,False,,Mitchell Harper,mitchellharper
"Don't think about your product in terms of features, but in metrics that can be improved via iteration - engagement, retention, etc.",Fri Jul 17 00:09:24 +0000 2015,en,1,False,3,False,,Mitchell Harper,mitchellharper
"Just used @getannotate by @DrifttHQ &amp; @dcancel instead of annotating a screenshot in @evernote and it works great. Much faster, fewer steps.",Thu Jul 16 22:39:06 +0000 2015,en,5,False,4,False,,Mitchell Harper,mitchellharper
"When you're proud of your work, you do better work and it has more meaning.",Thu Jul 16 22:23:18 +0000 2015,en,0,False,1,False,,Mitchell Harper,mitchellharper
You become what you think about.,Thu Jul 16 21:44:14 +0000 2015,en,2,False,1,False,,Mitchell Harper,mitchellharper
“What Does a Startup COO Actually Do?” by @SparksZilla https://t.co/MoWGsTr4wx,Thu Jul 16 20:56:01 +0000 2015,en,0,False,1,False,,Mitchell Harper,mitchellharper
"Acquire for $2.5B, sell 4 years later for $900M. Hard to take a business-unit approach to a best-of-breed category with strong competitors.",Thu Jul 16 09:49:01 +0000 2015,en,0,False,0,False,,Mitchell Harper,mitchellharper
"Netflix at well over 1M Aussie subscribers in just 2 months, killing @presto and @stancomau at 90K each. Laughable. http://t.co/xxTI18vHgx",Wed Jul 15 12:42:30 +0000 2015,en,1,False,4,False,,Mitchell Harper,mitchellharper
"""Even if you don't know now, believe in yourself enough to know you'll find the right answer soon enough.""",Wed Jul 15 01:13:51 +0000 2015,en,2,False,3,False,,Mitchell Harper,mitchellharper
"The more you feel the need to take the credit, the worse of a leader you'll be.",Tue Jul 14 09:36:04 +0000 2015,en,1,False,4,False,,Mitchell Harper,mitchellharper
"Career advice in your 20s: optimize for learning and mentorship over salary. Aim to take your boss's role in 2 years, not earn $20K more.",Tue Jul 14 09:31:38 +0000 2015,en,2,False,6,False,,Mitchell Harper,mitchellharper
"You can learn almost anything in the world on Kindle, so it (literally) pays to invest your time learning how to be a great learner.",Tue Jul 14 09:26:47 +0000 2015,en,2,False,2,False,,Mitchell Harper,mitchellharper
"On days when you don't feel productive in one area of your life (work), focus on another (family, learning). You'll be productive tomorrow.",Tue Jul 14 08:08:58 +0000 2015,en,1,False,5,False,,Mitchell Harper,mitchellharper
@michalnaka Hey Michal. This should help - it's the system I've used for years: http://t.co/eaa2iyKdeB,Mon Jul 13 02:22:46 +0000 2015,en,0,False,0,False,,Mitchell Harper,mitchellharper
"If you invest 30 minutes every Monday morning to plan your week, that compounds into a massive increase in productivity over the year.",Mon Jul 13 01:41:26 +0000 2015,en,1,False,4,False,,Mitchell Harper,mitchellharper
Sometimes your entire strategy can be wrong and not your approach. Re-assess early and often if you're walking down the right path.,Mon Jul 13 01:36:50 +0000 2015,en,0,False,1,False,,Mitchell Harper,mitchellharper
Clarity provides confidence.,Mon Jul 13 01:27:15 +0000 2015,en,0,False,0,False,,Mitchell Harper,mitchellharper
Important lesson from @bchesky's Medium post: VCs can't measure TAM and CAGR for blue oceans in which you're a market-maker.,Sun Jul 12 22:48:46 +0000 2015,en,0,False,2,False,,Mitchell Harper,mitchellharper
I'm sure I could dig up about 20 of these emails as well. Great post. https://t.co/h5jOI89fRG,Sun Jul 12 22:44:19 +0000 2015,en,1,False,3,False,,Mitchell Harper,mitchellharper
"RT @expa: The best founders have felt the pain of the problem, have a clear vision for the solution, and won't give up until it becomes rea…",Sun Jul 12 22:41:15 +0000 2015,en,49,False,0,False,,Mitchell Harper,mitchellharper
Over the long term it's hard to not succeed if you have an insatiable passion for learning and self improvement.,Sun Jul 12 22:35:19 +0000 2015,en,0,False,3,False,,Mitchell Harper,mitchellharper
@TYSELEE 👍,Sun Jul 12 22:23:06 +0000 2015,und,0,False,0,False,,Mitchell Harper,mitchellharper
"@BillyMurph All of the classics from legendary investors. Easy to find, harder to read and understand without experience/context.",Sun Jul 12 22:23:00 +0000 2015,en,0,False,0,False,,Mitchell Harper,mitchellharper
@igor Indeed. Trying to solve too many problems at once.,Sun Jul 12 22:22:25 +0000 2015,en,0,False,0,False,,Mitchell Harper,mitchellharper
Patience and timing are only everything: https://t.co/1ePrMWgbxX,Sun Jul 12 01:52:14 +0000 2015,en,0,False,1,False,,Mitchell Harper,mitchellharper
"Most investment books and blogs are written for the average person, so follow their strategies and no surprise, you'll get average returns.",Sat Jul 11 22:21:41 +0000 2015,en,7,False,4,False,,Mitchell Harper,mitchellharper
"If you can't describe your startup without saying ""and"", you've built too much too early.",Sat Jul 11 22:19:50 +0000 2015,en,0,False,5,False,,Mitchell Harper,mitchellharper
"Even with data that disagrees, your gut is rarely wrong.",Fri Jul 10 03:35:23 +0000 2015,en,0,False,3,False,,Mitchell Harper,mitchellharper
"""You are the sum of all your future successes, not past failures"" - Anon.",Fri Jul 10 02:19:09 +0000 2015,en,15,False,14,False,,Mitchell Harper,mitchellharper
Slack is winning because it understands better than any other company right now how to add emotion to its product. https://t.co/pXVTROnslT,Thu Jul 09 21:57:45 +0000 2015,en,1,False,1,False,,Mitchell Harper,mitchellharper
"The more balls you're trying to keep in the air, the more stressed you'll be.",Thu Jul 09 21:44:33 +0000 2015,en,0,False,1,False,,Mitchell Harper,mitchellharper
"RT @priceintel: One size does not fit all. Optimize and get rid of some features. 
http://t.co/c2uf4Nrnet",Thu Jul 09 20:49:02 +0000 2015,en,1,False,0,False,,Mitchell Harper,mitchellharper
"RT @EconBizFin: China's stockmarket is down, but economic stability is not in peril. Why then the panic? http://t.co/J4EzpPK3r5 http://t.co…",Thu Jul 09 09:48:46 +0000 2015,en,62,False,0,False,,Mitchell Harper,mitchellharper
Try to build a product that's everything for everyone and it'll end up being of no use to anyone.,Thu Jul 09 02:59:08 +0000 2015,en,2,False,4,False,,Mitchell Harper,mitchellharper
"A backdoor listing through a shell company means VCs wouldn't touch you, so you're planning to play retail investors for their cash. Simple.",Thu Jul 09 00:03:53 +0000 2015,en,1,False,2,False,,Mitchell Harper,mitchellharper
Every company succeeds just as much by what it choses NOT to do as what it chooses TO do. Doing nothing is a (sometimes great) decision too.,Wed Jul 08 03:07:23 +0000 2015,en,0,False,4,False,,Mitchell Harper,mitchellharper
Complexity is the inverse of revenue growth.,Wed Jul 08 03:01:07 +0000 2015,en,0,False,1,False,,Mitchell Harper,mitchellharper
"""The danger of the product CEO is that when you love product, every solution is a product solution."" http://t.co/GfHFxiJxZq",Tue Jul 07 03:12:09 +0000 2015,en,0,False,2,False,,Mitchell Harper,mitchellharper
You're never done making your product easier to use. Twitter is a perfect example.,Tue Jul 07 01:49:10 +0000 2015,en,0,False,1,False,,Mitchell Harper,mitchellharper
Best/worst/probable scenario modeling is a great way to approach both personal and professional challenges and decisions.,Tue Jul 07 00:00:37 +0000 2015,en,0,False,1,False,,Mitchell Harper,mitchellharper
"""Economists have predicted 9 out of the last 2 recessions.""",Mon Jul 06 09:57:59 +0000 2015,en,3,False,5,False,,Mitchell Harper,mitchellharper
"Solicit and listen to feedback from fewer, better early users as opposed to more, kinda-interested-but-not-really users.",Mon Jul 06 01:46:23 +0000 2015,en,0,False,0,False,,Mitchell Harper,mitchellharper
Time and time again the best way for me to solve a problem has been to step away from it for a few days then come back with a clear mind.,Mon Jul 06 01:44:45 +0000 2015,en,0,False,3,False,,Mitchell Harper,mitchellharper
"""When the Sephora flagship store opened in 1994, it earned revenues of $150 million in its first year"" http://t.co/B2VhNKAQRh",Sun Jul 05 03:41:06 +0000 2015,en,0,False,0,False,,Mitchell Harper,mitchellharper
The smartest way to solve a problem - find the best person you can who has solved the problem before and ask them how they did it.,Sun Jul 05 03:31:10 +0000 2015,en,3,False,5,False,,Mitchell Harper,mitchellharper
"One of the best quotes to live your life by: ""Everything will be all right in the end. If it’s not all right, it is not yet the end.""",Sun Jul 05 03:06:29 +0000 2015,en,5,False,9,False,,Mitchell Harper,mitchellharper
"""The only two true recession-proof industries are alcohol and video games."" (and non-discretionary spend SaaS companies)",Sun Jul 05 02:59:04 +0000 2015,en,0,False,1,False,,Mitchell Harper,mitchellharper
Remember that when things take a dive some time in the next 2 years that the best time to start a company is during a recession.,Sun Jul 05 02:46:17 +0000 2015,en,1,False,4,False,,Mitchell Harper,mitchellharper
The most powerful investing concept is that of the infinite return followed at a distant second by compounding interest.,Sun Jul 05 02:42:07 +0000 2015,en,1,False,3,False,,Mitchell Harper,mitchellharper
67% of successful people watch less than 1 hour of TV per day.,Sun Jul 05 02:37:34 +0000 2015,en,0,False,2,False,,Mitchell Harper,mitchellharper
If 1 in 2 marriages end in divorce then surely there should be an Uber/Postmates/Airbnb (latent demand) type service for marriage?,Sun Jul 05 02:34:29 +0000 2015,en,0,False,1,False,,Mitchell Harper,mitchellharper
@appear_in With. Chrome. Mac latest OS X.,Sat Jul 04 09:24:08 +0000 2015,en,0,False,0,False,,Mitchell Harper,mitchellharper
@appear_in Screens are tiny Mac laptops. Do ANYTHING on a chat (use another app etc) and it grinds to a halt.,Sat Jul 04 06:02:49 +0000 2015,en,0,False,0,False,,Mitchell Harper,mitchellharper
@appear_in Calls grind to a halt lag-wise when one of us shares our screen. Any idea why and when a fix is coming?,Fri Jul 03 22:28:32 +0000 2015,en,0,False,0,False,,Mitchell Harper,mitchellharper
Just bought @ThatSugarFilm through @vhxtv - very cool.,Fri Jul 03 10:32:18 +0000 2015,en,0,False,2,False,,Mitchell Harper,mitchellharper
The worst thing you can do in 2015 is build a minimally viable product. If it's not a minimally sellable product (MSP) you're toast.,Fri Jul 03 00:50:20 +0000 2015,en,0,False,5,False,,Mitchell Harper,mitchellharper
"Finally, using an ""agile methodology"" won't save a product+engineering team with poor communication or disrespect for each other.",Thu Jul 02 22:17:37 +0000 2015,en,1,False,3,False,,Mitchell Harper,mitchellharper
"When you think engineers ""get"" the feature, have them explain it back to you. Know if they're audio, visual or kinesthetic learners.",Thu Jul 02 22:16:21 +0000 2015,en,0,False,1,False,,Mitchell Harper,mitchellharper
Ambiguity in specs and a poor communication loop between PMs and engineers can blow out a feature's delivery time easier than anything else.,Thu Jul 02 22:14:46 +0000 2015,en,0,False,3,False,,Mitchell Harper,mitchellharper
"Product management rule 101 - when writing specs, even if you think you're being too verbose &amp; detailed, be even MORE verbose &amp; detailed.",Thu Jul 02 22:14:03 +0000 2015,en,0,False,6,False,,Mitchell Harper,mitchellharper
RT @DavidRoads: Prove yourself to yourself not others.,Thu Jul 02 09:51:39 +0000 2015,en,497,False,0,False,,Mitchell Harper,mitchellharper
"""If you took U.S. healthcare and made a country out of it, it'd be the 5th biggest in the world"" - @johndoerr",Thu Jul 02 06:52:46 +0000 2015,en,1,False,1,False,,Mitchell Harper,mitchellharper
@surfichris Same. Except I use the stop watch in the gym instead of the (terrible) fitness tracker. Sad face.,Thu Jul 02 05:57:17 +0000 2015,en,0,False,0,False,,Mitchell Harper,mitchellharper
Write the copy in your product in a conversational tone as if you're talking casually to a work colleague or friend. &lt;- No one does this.,Thu Jul 02 04:20:54 +0000 2015,en,0,False,1,False,,Mitchell Harper,mitchellharper
"Great lecture by @johndoerr: Ideas are easy, execution is everything https://t.co/WQKvlkOPmQ",Thu Jul 02 03:56:48 +0000 2015,en,1,False,2,False,,Mitchell Harper,mitchellharper
"Working on a blog post titled ""Understanding (And Forcing) Market Consolidation To Win"".",Thu Jul 02 03:23:22 +0000 2015,en,0,False,1,False,,Mitchell Harper,mitchellharper
"After 6 weeks with my Apple Watch, I rarely wear it. The UX is almost as bad as Apple Music. You can feel the lack of Steve's perfectionism.",Thu Jul 02 02:59:21 +0000 2015,en,2,False,5,False,,Mitchell Harper,mitchellharper
"For every company generating strong CAC:LTV using inbound marketing, there are 10 others using old-school outbounding with better ratios.",Thu Jul 02 02:57:58 +0000 2015,en,1,False,0,False,,Mitchell Harper,mitchellharper
New enterprise SaaS lead gen strategy - create a conference around your blue ocean product category and give the keynote.,Thu Jul 02 02:47:39 +0000 2015,en,0,False,3,False,,Mitchell Harper,mitchellharper
"I dream of a world where joining a conference call doesn't start with ""Please enter your 65 digit meeting ID, followed by the pound key"".",Wed Jul 01 23:16:08 +0000 2015,en,8,False,18,False,,Mitchell Harper,mitchellharper
The rebranding of The Resumator to @JazzDotCo is easily the best I've seen this year. Talk about making a boring category exciting.,Wed Jul 01 23:06:40 +0000 2015,en,3,False,3,False,,Mitchell Harper,mitchellharper
"Best web-based, free HD video chat conferencing system I've ever used - http://t.co/AVrHMmbBdJ @appear_in",Tue Jun 30 23:34:31 +0000 2015,en,0,False,3,False,,Mitchell Harper,mitchellharper
"A calm, well rested mind makes the best decisions.",Tue Jun 30 22:35:40 +0000 2015,en,0,False,1,False,,Mitchell Harper,mitchellharper
"Remember: first to market has to pay the cost of educating the market on the product category, benefits, best practices, etc.",Mon Jun 29 02:00:43 +0000 2015,en,5,False,10,False,,Mitchell Harper,mitchellharper
So many great points here. Love the detail as well. https://t.co/rKz8KaZ2Iq,Sun Jun 28 22:00:47 +0000 2015,en,0,False,1,False,,Mitchell Harper,mitchellharper
"Be excited when you discover a new competitor, especially if they've raised money. It validates your market and its potential.",Sun Jun 28 06:58:35 +0000 2015,en,10,False,8,False,,Mitchell Harper,mitchellharper
"A common rebranding trend - simplify, simplify then simplify some more: http://t.co/TtGWpczLR5",Sun Jun 28 01:36:20 +0000 2015,en,1,False,1,False,,Mitchell Harper,mitchellharper
Watching YouTube without AdBlocker could be the most frustrating experience I've ever encountered. Terrible user experience.,Sat Jun 27 23:14:46 +0000 2015,en,0,False,3,False,,Mitchell Harper,mitchellharper
@Bellroy None for the iPhone 6 plus?,Fri Jun 26 04:55:04 +0000 2015,en,0,False,0,False,,Mitchell Harper,mitchellharper
"""4.9 million people now have car-share memberships worldwide. By 2020, that number is expected to skyrocket to 26 million.""",Wed Jun 24 11:19:17 +0000 2015,en,0,False,1,False,,Mitchell Harper,mitchellharper
@roflpiano Awesome to hear. You helped create that culture - I remember the jam sessions in the Austin kitchen! 💥🎤🎸🎶,Wed Jun 24 10:20:22 +0000 2015,en,0,False,1,False,,Mitchell Harper,mitchellharper
"""Limited thinking brings limited success. Abundant thinking brings an abundance of success.""",Wed Jun 24 10:17:02 +0000 2015,en,2,False,3,False,,Mitchell Harper,mitchellharper
A-player people won't work at B-player companies.,Wed Jun 24 09:45:55 +0000 2015,en,2,False,4,False,,Mitchell Harper,mitchellharper
There are still many industries software hasn't (yet) eaten. Even industries where there are zero unicorns in sight 🐴,Wed Jun 24 09:07:05 +0000 2015,en,0,False,1,False,,Mitchell Harper,mitchellharper
@roflpiano Bobby! How are you?,Wed Jun 24 09:05:06 +0000 2015,en,0,False,0,False,,Mitchell Harper,mitchellharper
"RT @PocketHits: Why Startups Are More Successful than Ever at Unbundling Incumbents - http://t.co/BUIzN3ApTq (@htaneja, @HarvardBiz)",Wed Jun 24 08:08:35 +0000 2015,en,3,False,0,False,,Mitchell Harper,mitchellharper
"RT @BenedictEvans: My updated mobile deck had 100k views in the last week. if you've not seen it yet, you can be in the second hundred k ht…",Wed Jun 24 08:06:26 +0000 2015,en,140,False,0,False,,Mitchell Harper,mitchellharper
"RT @stevencorona: Current status: Writing 360 Reviews like eBay Feedback

""Super A++++ Good team contribution, fast shipping, would work wi…",Wed Jun 24 08:05:51 +0000 2015,en,4,False,0,False,,Mitchell Harper,mitchellharper
Still great music 👌🎧 http://t.co/yxYJv287Wc,Wed Jun 24 08:04:30 +0000 2015,en,0,False,4,False,,Mitchell Harper,mitchellharper
"If you can understand the macro trends changing an industry, you can get behind them and build an important company. http://t.co/opDaXI628Z",Tue Jun 23 02:33:34 +0000 2015,en,2,False,5,False,,Mitchell Harper,mitchellharper
Copywriting is interface design: http://t.co/YXeAaQksnz,Tue Jun 23 02:25:26 +0000 2015,en,1,False,1,False,,Mitchell Harper,mitchellharper
These Nine Charts Show the Shenzhen Stock Market Is Like No Other Market in the World: http://t.co/Wef4GAUIXx via @Bloomberg,Sun Jun 21 03:26:28 +0000 2015,en,0,False,0,False,,Mitchell Harper,mitchellharper
"By 2022, 630 million Chinese — or 75% of the nation’s urban population — will be classified as middle class.",Sun Jun 21 02:00:08 +0000 2015,en,0,False,0,False,,Mitchell Harper,mitchellharper
Stay laser focused on the problem you're passionate about solving but never stay fixed to a single approach.,Sat Jun 20 01:47:20 +0000 2015,en,1,False,6,False,,Mitchell Harper,mitchellharper
Momentum creates confidence and that confidence leads to more progress which creates more momentum.,Sat Jun 20 01:30:39 +0000 2015,en,1,False,3,False,,Mitchell Harper,mitchellharper
"""I suck at a lot of things but tenacity is not one of them."" http://t.co/VLK3vNPxlR - @msuster nails it. I live by what he mentions here.",Sat Jun 20 00:25:04 +0000 2015,en,4,False,2,False,,Mitchell Harper,mitchellharper
RT @sarahfrier: Twitter's e-commerce effort starts to take shape: https://t.co/F5pxMuqqq9 $TWTR,Sat Jun 20 00:08:14 +0000 2015,en,27,False,0,False,,Mitchell Harper,mitchellharper
You don't fail from lack of resources. You fail from lack of resourcefulness. Big difference.,Fri Jun 19 02:02:55 +0000 2015,en,46,False,51,False,,Mitchell Harper,mitchellharper
The calls and meetings you don't want to take are generally the ones that end up going amazingly well and making your day.,Thu Jun 18 23:57:12 +0000 2015,en,1,False,0,False,,Mitchell Harper,mitchellharper
Backing up my previous tweet is an incredible 30 minutes from @TonyRobbins that's all about psychology and excuses: https://t.co/wFP2q3B8ZZ,Thu Jun 18 02:07:25 +0000 2015,en,0,False,5,False,,Mitchell Harper,mitchellharper
"Being a CEO is 50% psychologist, 50% everything else. But you have to manage your own psychology before you can help your team.",Thu Jun 18 01:15:58 +0000 2015,en,2,False,6,False,,Mitchell Harper,mitchellharper
"RT @sama: in general, hiring before you get product/market fit slows you down, and hiring after you get product market fit speeds you up.",Tue Jun 16 23:12:45 +0000 2015,en,397,False,0,False,,Mitchell Harper,mitchellharper
Today I discovered image annotation in @Evernote. Such a cool feature that works exactly as you'd expect it to.,Tue Jun 16 06:39:43 +0000 2015,en,0,False,1,False,,Mitchell Harper,mitchellharper
A great recap of our all-hands Q&amp;A last week where we introduced Brent to the company. Great job RA! @RA__Alvarez https://t.co/HGJDiKz1hA,Tue Jun 16 05:10:01 +0000 2015,en,0,False,4,False,,Mitchell Harper,mitchellharper
Read this back in 2011 and then raised a $15M series A a few months later. Game changing book for first-timers: http://t.co/6QBfsZDaYl,Tue Jun 16 05:05:41 +0000 2015,en,1,False,3,False,,Mitchell Harper,mitchellharper
Most unicorns are also Trojan horses - they arrive to solve one problem but quickly add adjacent products to own a whole biz function.,Mon Jun 15 21:02:50 +0000 2015,en,3,False,2,False,,Mitchell Harper,mitchellharper
1999 vs 2014 for startups. A bubble is not a bubble: http://t.co/4gGbkkgfq8,Mon Jun 15 20:40:14 +0000 2015,en,4,False,3,False,,Mitchell Harper,mitchellharper
More incredible writing from @mrp comparing the founding team transitions at @twitter and @Bigcommerce. https://t.co/aaVKKRn8Cm,Mon Jun 15 20:27:08 +0000 2015,en,4,False,6,False,,Mitchell Harper,mitchellharper
"You can't force creativity. If you're not in the zone, do something else and come back later.",Sun Jun 14 23:22:30 +0000 2015,en,1,False,4,False,,Mitchell Harper,mitchellharper
You build v1 of your product based on what you think. You iterate to product-market fit based on continuous early user feedback.,Sun Jun 14 21:58:51 +0000 2015,en,4,False,5,False,,Mitchell Harper,mitchellharper
RT @sama: the meta mistake founders make is focusing on the wrong thing. the boring stuff of selling and building is what drives success.,Sat Jun 13 01:53:29 +0000 2015,en,169,False,0,False,,Mitchell Harper,mitchellharper
"RT @sama: founders always ask me for ""the trick"". but there isn't one-either you build something people love and figure out distribution or…",Sat Jun 13 01:53:22 +0000 2015,en,264,False,0,False,,Mitchell Harper,mitchellharper
"The economic clock continues to be spot on, cycle after cycle... http://t.co/K25ZVPmnTU",Sat Jun 13 01:47:25 +0000 2015,en,2,False,6,False,,Mitchell Harper,mitchellharper
RT @andrewchen: TIL adding a 🔥to your email subject line drops your open rate by 25%. Reverting.,Fri Jun 12 00:30:49 +0000 2015,en,21,False,0,False,,Mitchell Harper,mitchellharper
Artist -&gt; entrepreneur -&gt; manager https://t.co/hDQ99nXh87,Thu Jun 11 21:38:11 +0000 2015,fr,2,False,0,False,,Mitchell Harper,mitchellharper
... And know which is needed at various stages. Artist (build the product) -&gt; entrepreneur (build the business) -&gt; manager (scale the biz).,Thu Jun 11 21:37:13 +0000 2015,en,1,False,3,False,,Mitchell Harper,mitchellharper
"Twitter letting go of a great manager and bringing in an artist to do his job. Know whether you're the artist, entrepreneur or manager.",Thu Jun 11 21:34:50 +0000 2015,en,0,False,0,False,,Mitchell Harper,mitchellharper
First step is to just keep a note of when you feel mentally alert and when you can't focus. See patterns over a week or two then adjust.,Wed Jun 10 04:49:12 +0000 2015,en,1,False,1,False,,Mitchell Harper,mitchellharper
Manage to your energy levels not time. Example: I hit the gym at 2pm and work early+late because energy is low in the afternoons from 3-7pm.,Wed Jun 10 04:48:33 +0000 2015,en,3,False,7,False,,Mitchell Harper,mitchellharper
"Zenefits is trying to become the hub and position ADP as the spoke. Incumbents are slow, but they aren't stupid when they see a threat.",Wed Jun 10 04:03:10 +0000 2015,en,0,False,1,False,,Mitchell Harper,mitchellharper
@surfichris 👏👏👌🚀🚀🚀🚀,Tue Jun 09 23:17:49 +0000 2015,und,0,False,0,False,,Mitchell Harper,mitchellharper
@tommoor Just speaking the truth of our incredible ride so far...,Tue Jun 09 05:40:04 +0000 2015,en,0,False,0,False,,Mitchell Harper,mitchellharper
"Final thought: don't listen to the people who tell you it can't be done. That you can't hire that person or scale, etc. They are all wrong.",Tue Jun 09 05:31:54 +0000 2015,en,3,False,6,False,,Mitchell Harper,mitchellharper
Bigcommerce fun fact #10: I like tweeting about things I find interesting about Bigcommerce over the last 6 years.,Tue Jun 09 05:27:54 +0000 2015,en,0,False,1,False,,Mitchell Harper,mitchellharper
"Bigcommerce fun fact #9: we were initially nervous about opening an SF office, but pleasantly surprised by how fast we could hire A players.",Tue Jun 09 05:27:28 +0000 2015,en,0,False,3,False,,Mitchell Harper,mitchellharper
"Bigcommerce fun fact #8: we ended up in Austin by chance, based on a recommendation from an early mentor @chanimalted.",Tue Jun 09 05:26:54 +0000 2015,en,0,False,2,False,,Mitchell Harper,mitchellharper
Bigcommerce fun fact #7: the company is a success because of early mentors including @caseygollan and @TonyRobbins and his master coaches.,Tue Jun 09 05:25:30 +0000 2015,en,0,False,2,False,,Mitchell Harper,mitchellharper
Bigcommerce fun fact #6: Ed and I played Street Fighter in the early days til 3am. We have Street Fighter in every company office today.,Tue Jun 09 05:24:28 +0000 2015,en,0,False,5,False,,Mitchell Harper,mitchellharper
