Text,Created Date,Language,Retweet Count,Retweeted,Favorite Count,Favorited,co-ordinates,Tweeted By,Screen Name
I am relying on the energy and ideas of young voters to help build A New California. Join us today at http://bit.ly/dxyMQA #CAGOP #CAGOV,Sat Mar 27 00:41:19 +0000 2010,en,6,False,0,False,,Meg Whitman,MegWhitman
Released a new radio ad today. Voters should know where candidates stand on the issues. Find out where I stand at www.MegsPlan.com #cagov,Fri Mar 26 20:17:58 +0000 2010,en,9,False,0,False,,Meg Whitman,MegWhitman
http://twitpic.com/1awumi - I had a great time speaking with the Modesto Chamber of Commerce. Check out this photo taken by a member of my t,Fri Mar 26 00:09:49 +0000 2010,en,1,False,0,False,,Meg Whitman,MegWhitman
Thanks to the many Californians who joined me tonight for our tele-townhall in San Diego! Share your ideas @ www.talktomeg.com #cagov #cagop,Thu Mar 25 02:22:29 +0000 2010,en,0,False,0,False,,Meg Whitman,MegWhitman
Just spoke at the 18th Annual Law Enforcement Legislative Day in Sac. We must unite to make California safer for its citizens. #CAGOP #CAGOV,Wed Mar 24 20:08:26 +0000 2010,en,1,False,0,False,,Meg Whitman,MegWhitman
Wrapped up speaking with Cal-Tax. We must eliminate the start-up tax for small businesses to help bring jobs back to CA. #CAGOP #CAGOV,Tue Mar 23 19:43:31 +0000 2010,en,12,False,0,False,,Meg Whitman,MegWhitman
"Thx to everyone in the OC who joined me for my tele-townhall. I enjoyed hearing from you! If you missed it, share your ideas @ talktomeg.com",Tue Mar 23 03:47:04 +0000 2010,en,1,False,0,False,,Meg Whitman,MegWhitman
Great debate on the issues that matter most to Californians! Thx to all who emailed in questions to NM and tuned in. See you on the trail!,Tue Mar 16 02:04:17 +0000 2010,en,3,False,0,False,,Meg Whitman,MegWhitman
"Looking forward to joining my great friend @MittRomney, the many elected officials, and delegates at CRP this weekend. #CRP #CAGOV #CAGOP",Fri Mar 12 17:02:16 +0000 2010,en,6,False,0,False,,Meg Whitman,MegWhitman
It's time to get Californians back to work and rebuild our state. Share your ideas with me at www.TalktoMeg.com #cagop #cagov,Mon Mar 08 21:20:10 +0000 2010,en,4,False,0,False,,Meg Whitman,MegWhitman
Looking forward to the Oscars! Fingers crossed that the Oscar goes to...The Blind Side.,Sun Mar 07 23:55:10 +0000 2010,en,1,False,1,False,,Meg Whitman,MegWhitman
Was at CRA convention in Buena Park. I discussed important issues for our party to consider. #CAGOV #CAGOP,Sun Mar 07 00:12:20 +0000 2010,en,2,False,0,False,,Meg Whitman,MegWhitman
"Show your support. Text '2010' to 46634 (GOMEG) to receive a FREE Meg 2010 Bumper Sticker. Tell your friends,too. #cagop #cagov",Fri Mar 05 01:08:14 +0000 2010,en,3,False,0,False,,Meg Whitman,MegWhitman
Strong turnout in San Bernardino. Off to Bakersfield! Looking fwd to another day on the trail. #cagop #cagov,Tue Mar 02 03:26:44 +0000 2010,en,3,False,1,False,,Meg Whitman,MegWhitman
Join us on facebook. www.facebook.com/megwhitman It's going to take all of us to turn CA around. #cagop #cagov,Mon Mar 01 20:36:42 +0000 2010,en,8,False,0,False,,Meg Whitman,MegWhitman
Excited to announce the endorsement of former Sec. of State Condoleezza Rice today! www.MegWhitman.com #cagop #cagov #gop,Mon Mar 01 18:12:37 +0000 2010,en,10,False,1,False,,Meg Whitman,MegWhitman
Check out my new ad campaign click here www.CantTrustSteve.com #cagop #cagov,Fri Feb 26 19:58:45 +0000 2010,en,4,False,1,False,,Meg Whitman,MegWhitman
"@U92antdog Thx for your support! Check out our website, www.MegWhitman.",Thu Feb 25 22:17:34 +0000 2010,en,2,False,0,False,,Meg Whitman,MegWhitman
"Grt day for campaign-endorsed by Fred Ruiz, fmr chair of CA Chamber of Commerce and UC Regent. Off to the SD Chamber! http://bit.ly/bv6EvZ",Thu Feb 25 19:36:47 +0000 2010,en,4,False,0,False,,Meg Whitman,MegWhitman
http://twitpic.com/14xp8u - Hundreds of supporters at OC HQ Opening last night. We're all focused on one thing - getting CA back on track!,Tue Feb 23 18:34:30 +0000 2010,en,2,False,0,False,,Meg Whitman,MegWhitman
http://twitpic.com/14uaud - Great night opening our campaign office in Orange County. Lots of momentum toward A New California.,Tue Feb 23 04:00:16 +0000 2010,en,3,False,1,False,,Meg Whitman,MegWhitman
@sdandersonjr Thank you for your support! Check out www.MegWhitman.com to learn how to get plugged in.,Mon Feb 22 19:05:13 +0000 2010,en,0,False,0,False,,Meg Whitman,MegWhitman
I’m honored to announce that the Howard Jarvis Taxpayers Association has endorsed my campaign and vision for A New CA http://bit.ly/aHJUsv,Mon Feb 22 16:54:40 +0000 2010,en,5,False,1,False,,Meg Whitman,MegWhitman
http://twitpic.com/14gk2k - Loved the race today. Already looking forward to my next NASCAR experience.,Sun Feb 21 03:44:57 +0000 2010,en,2,False,0,False,,Meg Whitman,MegWhitman
"@okeegan Thx for your msg. I look forward to working with you to build A New CA. Pls visit my website, www.MegWhitman.com, and sign up.",Sat Feb 20 23:22:46 +0000 2010,en,0,False,0,False,,Meg Whitman,MegWhitman
Big day as official starter for NASCAR at Auto Club Speedway in Fontana.,Sat Feb 20 23:20:55 +0000 2010,en,2,False,0,False,,Meg Whitman,MegWhitman
Terrific week on the road talking to voters. One thing is clear: it's time for A New CA. Join us at www.MegWhitman.com #cagop,Sat Feb 20 00:40:50 +0000 2010,en,1,False,0,False,,Meg Whitman,MegWhitman
Great grassroots event last night in Los Angeles. Check out the video http://bit.ly/dpbtkv #cagov #cagop,Thu Feb 18 21:07:38 +0000 2010,en,2,False,0,False,,Meg Whitman,MegWhitman
http://twitpic.com/13z9v8 - Getting first-hand look at operations at the Port of Los Angeles this morning.,Thu Feb 18 19:06:27 +0000 2010,en,2,False,0,False,,Meg Whitman,MegWhitman
http://twitpic.com/13w81c - Introducing my campaign staff to Souplantation - one of Griff and my favorites,Thu Feb 18 05:57:23 +0000 2010,en,2,False,1,False,,Meg Whitman,MegWhitman
I’m on the road talking to voters today. Text your zip to 46634 (GOMEG) and we'll let you know when we come to your area.,Thu Feb 18 01:34:51 +0000 2010,en,1,False,2,False,,Meg Whitman,MegWhitman
I am looking forward to meeting with the @cwclub Bay Area chapter this evening.,Wed Feb 17 01:49:09 +0000 2010,en,1,False,0,False,,Meg Whitman,MegWhitman
@tobedawg I appreciate your support! Log on to www.MegWhitman.com to learn how to get involved.,Tue Feb 16 23:26:53 +0000 2010,en,0,False,0,False,,Meg Whitman,MegWhitman
"To build a confident California, we must say what we mean, mean what we say, and do it. Share your ideas at www.TalkToMeg.com",Mon Feb 15 22:22:34 +0000 2010,en,4,False,1,False,,Meg Whitman,MegWhitman
"@womanoftheworld Thx for your support. Please visit my website, www.MegWhitman.com, sign up and we'll get you plugged in.",Mon Feb 15 00:25:43 +0000 2010,en,0,False,0,False,,Meg Whitman,MegWhitman
"http://twitpic.com/138v8s - Happy Valentines Day! Griff and I celebrated by driving down Highway  
1 and stopped to see the sea lions and H",Sun Feb 14 18:28:09 +0000 2010,en,0,False,0,False,,Meg Whitman,MegWhitman
"Happy birthday President Lincoln. You said it best, “Let us strive on to finish the work we are in.”",Sat Feb 13 01:00:31 +0000 2010,en,4,False,0,False,,Meg Whitman,MegWhitman
It will take all of us to build a new California. Share your ideas at www.talktomeg.com,Fri Feb 12 00:31:30 +0000 2010,en,4,False,0,False,,Meg Whitman,MegWhitman
http://twitpic.com/12a2xg - Enjoyed meeting with these young basketball players at a book signing last night in Menlo Park. They understand,Tue Feb 09 21:24:46 +0000 2010,en,1,False,0,False,,Meg Whitman,MegWhitman
"I’m the only one for Gov to support solutions for CA's water crisis. In Fresno today, check out my op-ed in the Bee: http://bit.ly/cbdAl8",Tue Feb 09 16:54:25 +0000 2010,en,5,False,1,False,,Meg Whitman,MegWhitman
Good discussion with Chris Daniel on KMJ this afternoon. Looking forward to heading back to the Central Valley tomorrow!,Tue Feb 09 00:51:19 +0000 2010,en,2,False,0,False,,Meg Whitman,MegWhitman
"Students deserve an affordable, first-class education. Text ‘STUDENT’ to 46634 (GOMEG) to join Students for Meg or visit http://ow.ly/15bug",Mon Feb 08 20:44:06 +0000 2010,en,4,False,1,False,,Meg Whitman,MegWhitman
Enjoying Super Bowl Sunday. Go Saints! Could be a great story.,Sun Feb 07 23:01:02 +0000 2010,en,3,False,1,False,,Meg Whitman,MegWhitman
Met a MEGaWoman on my flight this morning! Join us at www.megwhitman.com/megawomen http://www.megwhitman.com/megawomen,Fri Feb 05 18:18:20 +0000 2010,en,4,False,0,False,,Meg Whitman,MegWhitman
"Path to a confident New California begins today. See the launch of my TV 
ad campaign here http://bit.ly/daWx #cagov #cagop",Thu Feb 04 18:48:24 +0000 2010,en,9,False,0,False,,Meg Whitman,MegWhitman
RT @conannolan: Meg Whitman on at 6p. Channel 4.,Thu Feb 04 00:41:38 +0000 2010,ht,4,False,0,False,,Meg Whitman,MegWhitman
"Thank you to @FresnoMayor, Ashley Swearengin, for making tonight's tele-forum in the Central Valley a great success!",Wed Feb 03 04:05:05 +0000 2010,en,2,False,0,False,,Meg Whitman,MegWhitman
Thanks to DA Jan Scully for the kind words of support today on Flash Report! http://bit.ly/cg0llq #cagov #cagop,Fri Jan 29 21:37:53 +0000 2010,en,1,False,0,False,,Meg Whitman,MegWhitman
AP: “Poll: Californians Say State Is On Wrong Course” http://bit.ly/dDBgN1. Join my team at http://bit.ly/7AvR0 and help me build A New CA,Thu Jan 28 19:22:28 +0000 2010,en,0,False,0,False,,Meg Whitman,MegWhitman
"Good morning! Please tune in to NBC's ""Today Show"" at 8:45PST for my interview with Matt Lauer.",Wed Jan 27 16:36:41 +0000 2010,en,2,False,0,False,,Meg Whitman,MegWhitman
"Interested in a copy of my new book, The Power of Many? Text POWER to 46634 (GOMEG) & enter a drawing for 1 of 25 books being given away",Tue Jan 26 20:23:52 +0000 2010,en,1,False,0,False,,Meg Whitman,MegWhitman
RT @CAmpMeg2010: Our team put together a new video about Meg's background and experiences. Check it out at http://bit.ly/8PStdu #cagop,Tue Jan 26 17:11:49 +0000 2010,en,4,False,0,False,,Meg Whitman,MegWhitman
I’m honored to have  the support of former CA Secretary of State Bruce McPherson http://bit.ly/61b1nx #cagov #cagop,Mon Jan 25 23:23:02 +0000 2010,en,2,False,0,False,,Meg Whitman,MegWhitman
"Are you a MEGaWoman? If so, TEXT ‘MEGa’ to 46634 (GOMEG) to receive coalition updates and for the chance to earn MEGa gear",Wed Jan 13 19:47:17 +0000 2010,en,1,False,0,False,,Meg Whitman,MegWhitman
CA budget is out today. Our top priority must be jobs.  And it’s time for fiscal discipline. http://bit.ly/7WrLwM #cagop,Fri Jan 08 23:50:12 +0000 2010,en,9,False,0,False,,Meg Whitman,MegWhitman
Do you want to show your support ? Text ‘2010’ to 46634 (GOMEG) to receive a FREE bumper sticker #cagop #tcot,Fri Jan 08 19:10:41 +0000 2010,en,2,False,0,False,,Meg Whitman,MegWhitman
I hope everyone enjoyed their holidays. We're excited about 2010 and ready to work hard for victory! Onward and upward.,Sun Jan 03 19:26:58 +0000 2010,en,4,False,1,False,,Meg Whitman,MegWhitman
Happy Holidays  http://bit.ly/7AvR0,Tue Dec 22 18:11:23 +0000 2009,en,3,False,0,False,,Meg Whitman,MegWhitman
"Thanks to everyone following me on Scribd. I have over 10,000 subscribers. Check out www.scribd.com/megwhitman",Tue Dec 15 17:37:15 +0000 2009,en,6,False,0,False,,Meg Whitman,MegWhitman
Terrific evening at the Pasadena GOP Club. Appreciate your questions. Share your ideas at TalktoMeg.com,Fri Dec 11 03:56:19 +0000 2009,en,4,False,0,False,,Meg Whitman,MegWhitman
I'm in LA for Valley Industry & Commerce Assn 60th anniversary meeting. Valley is home to dreamers and doers.,Thu Dec 10 22:12:25 +0000 2009,en,1,False,1,False,,Meg Whitman,MegWhitman
"Are you a MEGaWoman? If so, TEXT ‘MEGa’ to 46634 (GOMEG) to receive coalition updates and for the chance to earn MEGa gear.",Tue Dec 08 23:12:11 +0000 2009,en,2,False,1,False,,Meg Whitman,MegWhitman
Thanks to @MittRomney for helping us build A New CA http://bit.ly/4sbvsL,Tue Dec 08 19:06:12 +0000 2009,en,9,False,1,False,,Meg Whitman,MegWhitman
http://twitpic.com/rz9qw - Great evening in San Diego with my friends @MarkWyland and @MittRomney.,Thu Dec 03 16:36:36 +0000 2009,en,1,False,0,False,,Meg Whitman,MegWhitman
"Do you want to show your support? To receive a FREE Meg 2010 Bumper Sticker, text '2010' to 46634 (GOMEG) and tell your friends! #cagop",Wed Dec 02 18:37:59 +0000 2009,en,6,False,0,False,,Meg Whitman,MegWhitman
Looking forward to seeing friends at the Sacramento County GOP Central Committee tonight.,Tue Dec 01 23:34:14 +0000 2009,en,2,False,0,False,,Meg Whitman,MegWhitman
Happy Thanksgiving. Busy enjoying a day filled with family and blessings.,Thu Nov 26 23:12:24 +0000 2009,en,5,False,2,False,,Meg Whitman,MegWhitman
"Do you want to show your support? To receive a FREE Meg 2010 Bumper Sticker, text '2010' to 46634 (GOMEG) and tell your friends!",Mon Nov 23 20:43:01 +0000 2009,en,7,False,0,False,,Meg Whitman,MegWhitman
Terrific evening sharing my vision with GOP faithful in San Luis Obispo. Thanks to Bill Simon for joining me.,Thu Nov 19 03:04:15 +0000 2009,en,3,False,0,False,,Meg Whitman,MegWhitman
RT @KSBY: Meg Whitman scheduled to visit San Luis Obispohttp://www.ksby.com/news/meg-whitman-scheduled-to-visit-san-luis-obispo/,Wed Nov 18 21:43:50 +0000 2009,en,0,False,0,False,,Meg Whitman,MegWhitman
"I believe that every student deserves an affordable, first-class education. If you’re one of these students, text ‘STUDENT’ to 46634",Wed Nov 18 21:14:33 +0000 2009,en,2,False,0,False,,Meg Whitman,MegWhitman
@Baires_Liz  thanks for coming to my event! Happy to have you there and grateful for your support!,Tue Nov 17 23:55:09 +0000 2009,en,1,False,0,False,,Meg Whitman,MegWhitman
"In S. El Monte to announce Latino Coalition at Teresa Hernandez' Cielito Lindo restaurant. Teresa and I agree, it's all about job creation.",Tue Nov 17 21:47:56 +0000 2009,en,1,False,2,False,,Meg Whitman,MegWhitman
"http://twitpic.com/piojn - At the CFRW Southern Convention - an influential group of CA women.  
Thanks for inviting me.  Visit www.MegWhit",Sat Nov 14 19:35:00 +0000 2009,en,2,False,0,False,,Meg Whitman,MegWhitman
Do you want to show your support? Text ‘2010’ to 46634 (GOMEG) to receive a FREE Meg 2010 bumper sticker.,Fri Nov 13 20:00:27 +0000 2009,en,1,False,0,False,,Meg Whitman,MegWhitman
At the Lincoln Club of Northern CA. Looking forward to hearing Condi speak.,Fri Nov 13 03:26:46 +0000 2009,en,1,False,0,False,,Meg Whitman,MegWhitman
"Met with small biz leaders this morning. They are the backbone of  
our economy and will be a big part of our recovery.",Thu Nov 12 22:51:50 +0000 2009,en,2,False,0,False,,Meg Whitman,MegWhitman
"Today we celebrate the sacrifices of our servicemen and women.  
California is home to more than 2 million veterans. We thank you.",Wed Nov 11 17:29:38 +0000 2009,en,0,False,0,False,,Meg Whitman,MegWhitman
I'm at Western Growers mtg talking abt how impt ag is to CA - water is priority. Got ideas on how to help ag? Let me know at TalktoMeg.com,Tue Nov 10 22:36:51 +0000 2009,en,0,False,0,False,,Meg Whitman,MegWhitman
Toured SD airport this afternoon and saw new safety system.  New expansion will bring needed jobs to San Diego.,Tue Nov 10 03:06:37 +0000 2009,en,0,False,1,False,,Meg Whitman,MegWhitman
"In SD for economic policy and political mtgs, also a SD airport tour. Special hello to @stevepoizner we shared SW flight this morning.",Mon Nov 09 19:46:29 +0000 2009,en,1,False,0,False,,Meg Whitman,MegWhitman
RT @CAmpMeg2010: ABC: @StevePoizner refuses to reimburse taxpayers for CHP protection at partisan campaign events. http://bit.ly/3XmT3b,Fri Nov 06 18:36:04 +0000 2009,en,0,False,0,False,,Meg Whitman,MegWhitman
Please visit MegWhitman.com and read my statement on Sacramento H20 legislation. http://bit.ly/85OeA #talktomeg #meg2010,Thu Nov 05 19:49:36 +0000 2009,en,0,False,0,False,,Meg Whitman,MegWhitman
"RT @CAmpMeg2010 CapWkly: Whitman opens up wide lead in poll: @Whitman2010 34.3, @talktotom 12.5, @StevePoizner 5.5 http://bit.ly/1cFoQR",Thu Nov 05 17:50:45 +0000 2009,en,0,False,1,False,,Meg Whitman,MegWhitman
RT @CAmpMeg2010: Check out Meg’s interview on LA's KFWB from this morning http://bit.ly/1ggaVk #talktomeg #meg2010 #cagop #catcot,Wed Nov 04 19:40:56 +0000 2009,en,0,False,0,False,,Meg Whitman,MegWhitman
"Are you a MEGaWoman? If so, TEXT ‘MEGa’ to 46634 (GOMEG) to receive coalition updates and for the chance to earn MEGa schwag #meg2010",Mon Nov 02 18:04:38 +0000 2009,en,0,False,0,False,,Meg Whitman,MegWhitman
Interesting but concerning visit to U.S.-Mexico border today. More work to be done. Thanks to all of the border agents for their hard work.,Wed Oct 28 22:48:29 +0000 2009,en,0,False,0,False,,Meg Whitman,MegWhitman
Was in San Diego today for the 16th Annual Women Who Mean Business Luncheon. Grateful to speak to more than 800 professionals.,Wed Oct 28 01:15:28 +0000 2009,en,0,False,0,False,,Meg Whitman,MegWhitman
"Honored to announce endorsement of Rick Riordan, former mayor of
LA & CA Secretary of Education. We must fix education.http://bit.ly/1WFrQF",Mon Oct 26 18:56:22 +0000 2009,en,0,False,0,False,,Meg Whitman,MegWhitman
Happy to be at the NAACP CA Convention celebrating 100 years nationally. Great crowd. Thanks for the invitation to join you.,Sun Oct 25 04:45:38 +0000 2009,en,0,False,0,False,,Meg Whitman,MegWhitman
With @FresnoMayor at the San Joaquin Valley Partnership Meeting in Fresno; a key group in the Central Valley.,Fri Oct 23 22:24:57 +0000 2009,en,0,False,0,False,,Meg Whitman,MegWhitman
Informative meeting with the California Peace Officers Association & terrific tour of the 2009 COPSWest Premier Law Enforcement Expo today,Wed Oct 21 00:02:21 +0000 2009,en,0,False,0,False,,Meg Whitman,MegWhitman
At the CFRW Convention. Appreciate the opportunity to be w/so many CA women. Join our women's coalition. Sign up at megwhitman.com/megawomen,Sat Oct 17 21:46:39 +0000 2009,en,0,False,0,False,,Meg Whitman,MegWhitman
"Join our mobile program. Stay up to date with the campaign. Text ""NewCA” to 46634 (GOMEG)",Thu Oct 15 18:44:45 +0000 2009,en,0,False,0,False,,Meg Whitman,MegWhitman
Announced our Agriculture Coalition Leadership team today in Fresno. Ag is key for our future in CA. http://bit.ly/2IMrKX,Wed Oct 14 17:57:40 +0000 2009,en,0,False,0,False,,Meg Whitman,MegWhitman
"Excited to announce leadership of our public safety coalition today -  
a team that's crucial for our state's future. http://bit.ly/3rARbZ",Tue Oct 13 18:56:51 +0000 2009,en,0,False,0,False,,Meg Whitman,MegWhitman
"RT @CAmpMeg2010: ""America's Mayor"" Rudy Giuliani Endorses Meg Whitman for CA Gov. http://bit.ly/S7G1X #meg2010 #cagop #catcot",Wed Oct 07 20:58:00 +0000 2009,und,0,False,0,False,,Meg Whitman,MegWhitman
"RT @CAmpMeg2010: Fun With ""Journalists"": Sacramento Bee Ed. http://bit.ly/16OuoO #meg2010 #cagop #catcot",Mon Oct 05 23:37:08 +0000 2009,en,0,False,0,False,,Meg Whitman,MegWhitman
Great to be in Santa Clarita with Sharon Runner meeting w/Californians who want to bring jobs back to our state. Interesting questions too.,Sat Oct 03 05:48:06 +0000 2009,en,0,False,0,False,,Meg Whitman,MegWhitman
http://twitpic.com/jvzkx - Thanks to Riverside Greater Chambers for inviting me to speak today. All agreed- time to get spending under c ...,Thu Oct 01 23:09:21 +0000 2009,en,0,False,0,False,,Meg Whitman,MegWhitman
Enjoyed speaking with the Inland Empire Chapter of New Majority this morning in Ontario.,Thu Oct 01 17:02:15 +0000 2009,en,0,False,0,False,,Meg Whitman,MegWhitman
http://twitpic.com/jqcwx - Great Morning- great talk with Ronn Owens. Excited about Fresno Mayor Swearengin endorsement.,Wed Sep 30 17:23:30 +0000 2009,en,0,False,0,False,,Meg Whitman,MegWhitman
Just received New Majority's debate invitation. I accept. Look forward to it.,Thu Sep 24 03:47:52 +0000 2009,en,0,False,0,False,,Meg Whitman,MegWhitman
Launch tour continues. At a cutting-edge San Diego biotech company today. Off to a Fresno charter school tomorrow.,Wed Sep 23 20:05:29 +0000 2009,en,0,False,0,False,,Meg Whitman,MegWhitman
"It's official! Just announced my candidacy to an enthusiastic crowd  
in Fullerton. Build A New CA with me.",Tue Sep 22 20:28:29 +0000 2009,en,0,False,2,False,,Meg Whitman,MegWhitman
http://twitpic.com/iq1yg - Just spoke to Anita Vogel of Fox News. Looking forward to an exciting announcement day.,Tue Sep 22 18:09:42 +0000 2009,en,0,False,0,False,,Meg Whitman,MegWhitman
Big news tomorrow. Check out this AP article: http://bit.ly/2pqzKf,Tue Sep 22 02:30:38 +0000 2009,en,0,False,1,False,,Meg Whitman,MegWhitman
"RT @CAmpMeg2010 Meg Whitman: To Create Jobs, Curb Environmental Regulation http://bit.ly/2kez4w #meg2010 #cagop",Thu Sep 17 16:15:07 +0000 2009,en,0,False,0,False,,Meg Whitman,MegWhitman
"At Fortune Most Powerful Women event in SD w/400 women business  
leaders talking abt job creation. Spent time w/Warren Buffett + Condi Rice",Wed Sep 16 19:42:59 +0000 2009,en,0,False,0,False,,Meg Whitman,MegWhitman
http://twitpic.com/h7vj7 - Just had lunch with Mitt and Ann Romney. I deeply appreciate their help and friendship.,Thu Sep 10 18:58:53 +0000 2009,en,0,False,1,False,,Meg Whitman,MegWhitman
"http://twitpic.com/h72ox - With my mom in MA celebrating her b-day. She's 89 years young. Love you, mom!",Thu Sep 10 15:06:40 +0000 2009,en,0,False,0,False,,Meg Whitman,MegWhitman
Toured Teixeira farms w/Mark Teixeira. Amazed they can produce top quality products w/so much gov't red tape. Let’s strengthen CA ag,Tue Sep 01 22:44:26 +0000 2009,en,0,False,0,False,,Meg Whitman,MegWhitman
"Strong start to the day in Santa Barbara this morning. Thanks to  
Mike Stoker for putting together such a great event.",Tue Sep 01 18:00:17 +0000 2009,en,0,False,0,False,,Meg Whitman,MegWhitman
Met with the board of directors of the CA Restaurant Association.  These job creators need our support.,Sun Aug 30 22:03:59 +0000 2009,en,0,False,0,False,,Meg Whitman,MegWhitman
http://twitpic.com/fakgx - Great to be in Humboldt County. Over 200 people focused on building A New California joined me at tonight's e ...,Wed Aug 26 02:38:35 +0000 2009,en,0,False,1,False,,Meg Whitman,MegWhitman
Talked about challenges facing small businesses in rural areas with Redding Chamber of Commerce. Great insights.,Tue Aug 25 21:53:30 +0000 2009,en,0,False,0,False,,Meg Whitman,MegWhitman
Afternoon in Chico. Thanks for coming and asking such important questions about our state's future. I enjoyed chatting afterwards.,Tue Aug 25 01:00:40 +0000 2009,en,0,False,0,False,,Meg Whitman,MegWhitman
http://twitpic.com/f5c9z - Thank you for inviting me to join you at the overflow GOP event today in beautiful Plumas County.,Mon Aug 24 21:44:36 +0000 2009,en,0,False,0,False,,Meg Whitman,MegWhitman
"Today, Griff, Will + I took a hike up Mt Judah.  I continued  
to Graeagle + stopped to marvel at the Sierra Valley. Terrific  
weekend.",Mon Aug 24 05:33:22 +0000 2009,en,0,False,0,False,,Meg Whitman,MegWhitman
Great evening last night at the Nevada County GOP BBQ in Grass Valley.,Mon Aug 24 05:26:41 +0000 2009,en,0,False,0,False,,Meg Whitman,MegWhitman
"Ended the day in Covina with a terrific crowd. As I travel the state, I'm excited by your ideas and energy.",Thu Aug 20 03:47:17 +0000 2009,en,0,False,0,False,,Meg Whitman,MegWhitman
Thanks to the LA Chamber for the invite to speak at today's meeting. Engaged group with great questions about our state.,Wed Aug 19 23:22:08 +0000 2009,en,0,False,0,False,,Meg Whitman,MegWhitman
Exciting to be at the California Women Lead reception tonight in Sacramento. It was an honor to be there.,Wed Aug 19 02:22:01 +0000 2009,en,0,False,0,False,,Meg Whitman,MegWhitman
"Great morning at El Dorado Hills grassroots event. Welcoming, supportive crowd and a great start to today.",Tue Aug 18 19:09:37 +0000 2009,en,0,False,0,False,,Meg Whitman,MegWhitman
"Just finished a luncheon with business leaders and MEGaWomen and Former State Senator Dick Rainey and his wife, Sue, in the East Bay.",Fri Aug 14 22:47:00 +0000 2009,en,0,False,0,False,,Meg Whitman,MegWhitman
http://twitpic.com/dt5k0 - Wonderful to be at the Riverside GOP Central Committee with such an enthusiastic crowd. Thanks for the great  ...,Fri Aug 14 02:50:26 +0000 2009,en,0,False,0,False,,Meg Whitman,MegWhitman
http://twitpic.com/dmnhf - Toured the Fowler Packing Company near Fresno this morning with Nisei Farmers. Honored to have their endorsem ...,Wed Aug 12 17:39:35 +0000 2009,en,0,False,0,False,,Meg Whitman,MegWhitman
"http://twitpic.com/djqrw - Warm reception in Modesto and terrific discussion of issues affecting CA, in particular our farmers and ranchers.",Tue Aug 11 22:37:41 +0000 2009,en,0,False,0,False,,Meg Whitman,MegWhitman
http://twitpic.com/dgp58 - Great to be in Santa Cruz with GOP faithful. Wonderful event.,Tue Aug 11 02:30:56 +0000 2009,en,0,False,1,False,,Meg Whitman,MegWhitman
Enjoyed the Hispanic Business Council event this morning. Off to the Ventura County Fair.,Fri Aug 07 21:15:43 +0000 2009,en,0,False,0,False,,Meg Whitman,MegWhitman
"Great meeting with San Diego supporters, volunteers and Congressman Bilbray today.",Wed Aug 05 19:08:15 +0000 2009,en,0,False,0,False,,Meg Whitman,MegWhitman
Thanks for all of the birthday wishes!,Wed Aug 05 01:10:12 +0000 2009,en,0,False,0,False,,Meg Whitman,MegWhitman
Chapman: Thanks for the debate invite - I’ll consider the dates and respond soon,Mon Aug 03 21:51:26 +0000 2009,en,0,False,0,False,,Meg Whitman,MegWhitman
I'm honored to have the endorsement of 2002 GOP nominee Bill Simon as we take on the challenges ahead. Learn more at www.megwhitman.com,Mon Jul 27 23:22:31 +0000 2009,en,0,False,0,False,,Meg Whitman,MegWhitman
