Text,Created Date,Language,Retweet Count,Retweeted,Favorite Count,Favorited,co-ordinates,Tweeted By,Screen Name
Steve Jobs was an iconic entrepreneur. He will be remembered for innovation he brought to market & inspiration he brought to the world.,Thu Oct 06 04:28:24 +0000 2011,en,255,False,239,False,,Meg Whitman,MegWhitman
Excited and honored to lead HP. I'm a true believer in the future of this Silicon Valley icon.,Fri Sep 23 02:45:01 +0000 2011,en,296,False,135,False,,Meg Whitman,MegWhitman
Yesterday was the 30th birthday of the PC. Happy birthday! Where would we be without you? http://t.co/BDeSN4U,Sat Aug 13 18:40:39 +0000 2011,en,66,False,37,False,,Meg Whitman,MegWhitman
Happy 4th of July!,Mon Jul 04 23:04:12 +0000 2011,en,6,False,10,False,,Meg Whitman,MegWhitman
"Just stopped by the @MittRomney campaign in Boston. Great to see everyone who
is working hard at headquarters! http://twitpic.com/58t1db",Wed Jun 08 19:59:51 +0000 2011,en,24,False,7,False,,Meg Whitman,MegWhitman
Joined my friend @hughhewitt on his show yesterday to talk about the campaign and what's next. Check it out here: http://bit.ly/jW1Gvo,Thu Jun 02 23:56:14 +0000 2011,en,9,False,6,False,,Meg Whitman,MegWhitman
"On this Memorial Day, thank you to all who serve in the armed services, and have died in the line of duty, to preserve the freedoms we enjoy",Mon May 30 20:51:48 +0000 2011,en,15,False,8,False,,Meg Whitman,MegWhitman
Congratulations to @MittRomney for raising $10.25 million on National Call Day today! #mittcallday,Tue May 17 02:10:44 +0000 2011,en,30,False,7,False,,Meg Whitman,MegWhitman
Catch me on @FoxBusiness at 1:40pm PDT. President Obama a born-again deficit hawk? Thank you @RepPaulRyan and House GOP leadership.,Wed Apr 20 20:13:28 +0000 2011,en,5,False,4,False,,Meg Whitman,MegWhitman
RT @GWBPresCenter: @MegWhitman's closing remarks from #4percent are on YouTube! http://ow.ly/4zJWr,Wed Apr 13 23:18:35 +0000 2011,en,3,False,0,False,,Meg Whitman,MegWhitman
Looking fwd to today's keynote at @GWBPresCenter. Watch live at 4:30pm CT. http://bit.ly/i5fk3U,Tue Apr 12 21:35:30 +0000 2011,en,5,False,1,False,,Meg Whitman,MegWhitman
Had spirited segment on @CNBC about creating jobs and growing US economy. On to @GWBPresCenter 4% conference. Tax reform is critical.,Tue Apr 12 17:29:42 +0000 2011,en,8,False,2,False,,Meg Whitman,MegWhitman
Watch this video recap of our shared journey. We were all part of the important mission of building A New California. http://meg4.me/kdpg,Fri Nov 05 01:20:08 +0000 2010,en,14,False,6,False,,Meg Whitman,MegWhitman
We love California and we still believe our state can be a better place.  Let’s keep working to make our state great again.,Wed Nov 03 20:35:21 +0000 2010,en,22,False,6,False,,Meg Whitman,MegWhitman
"Congratulations to @jerrybrown2010. To everyone who was part of our campaign - thank you.  Our journey is ending, but the mission is not.",Wed Nov 03 20:34:50 +0000 2010,en,16,False,6,False,,Meg Whitman,MegWhitman
Thank you @gotubsgo! #cagov #gomeg,Tue Nov 02 23:21:58 +0000 2010,en,3,False,0,False,,Meg Whitman,MegWhitman
"Thank you so much, @KampKacalek! #cagov #gomeg",Tue Nov 02 23:19:42 +0000 2010,en,1,False,0,False,,Meg Whitman,MegWhitman
Watch this interview with 2 of our dedicated Woodland Hills volunteers. Thank you to all of our amazing volunteers. http://meg4.me/csj4,Tue Nov 02 21:25:44 +0000 2010,en,13,False,3,False,,Meg Whitman,MegWhitman
Phone banked in Pasadena - remember to vote before polls close at 8pm! www.megwhitman.com/vote http://twitpic.com/33b4xk,Tue Nov 02 19:18:22 +0000 2010,en,9,False,1,False,,Meg Whitman,MegWhitman
"Thank you for the support, @JLove6!",Tue Nov 02 17:31:06 +0000 2010,en,0,False,0,False,,Meg Whitman,MegWhitman
RT @GovChristie: It is time for a new California. Vote today for @Whitman2010. Meg will bring common sense and toughness to Sacramento.  ...,Tue Nov 02 17:23:35 +0000 2010,en,103,False,0,False,,Meg Whitman,MegWhitman
"As of yesterday, our terrific team had made 3 million contacts on doors and phones. Keep it up! #megmentum #gomeg #cagov",Tue Nov 02 17:08:08 +0000 2010,en,15,False,1,False,,Meg Whitman,MegWhitman
Good morning on Election Day! Go to www.megwhitman.com/vote to find your polling place! Pass along to friends! #cagov,Tue Nov 02 14:48:10 +0000 2010,en,40,False,2,False,,Meg Whitman,MegWhitman
Huge turnout at our Temecula office! Thank you so much to the hundreds of volunteers I met today! #cagov #gomeg http://twitpic.com/334kbl,Tue Nov 02 03:30:24 +0000 2010,en,15,False,0,False,,Meg Whitman,MegWhitman
Boots are on the way courtesy of @GovernorPerry! I called it in 5. #cagov #gomeg #SFWorldChamps,Tue Nov 02 03:26:49 +0000 2010,en,15,False,3,False,,Meg Whitman,MegWhitman
@SFGiants are World Champs!  Congrats to all Californians - great win for our whole state. #SFWorldChamps,Tue Nov 02 03:26:02 +0000 2010,en,5,False,1,False,,Meg Whitman,MegWhitman
Thank you! RT @hillaryvaughn I just voted!! Fiorina and Whitman! #cavote2010 http://yfrog.com/mvpmfgj,Tue Nov 02 01:49:04 +0000 2010,en,13,False,2,False,,Meg Whitman,MegWhitman
"We've been all over the state on our Jobs bus - read about the fun we've had, event by event! http://meg4.me/n4bj #cagov #gomeg",Tue Nov 02 01:09:25 +0000 2010,en,10,False,0,False,,Meg Whitman,MegWhitman
Adrenaline is flowing in San Diego! Our get-out-the-vote operation is incredible. #cagov http://twitpic.com/333g3e,Tue Nov 02 01:08:11 +0000 2010,en,13,False,0,False,,Meg Whitman,MegWhitman
Costa Mesa field office was a lot of fun! Such an enthusiastic group of volunteers. Next up: San Diego! #cagov http://twitpic.com/33253j,Mon Nov 01 22:18:52 +0000 2010,en,9,False,0,False,,Meg Whitman,MegWhitman
Did you watch my interview with Hannity last night? Catch the video here: http://meg4.me/zu5e #cagov,Mon Nov 01 19:59:42 +0000 2010,en,18,False,2,False,,Meg Whitman,MegWhitman
Our Woodland Hills field office was packed with volunteer phone bankers - the energy was off the charts! http://twitpic.com/3312j1,Mon Nov 01 19:51:03 +0000 2010,en,8,False,1,False,,Meg Whitman,MegWhitman
Help out in the homestretch! Learn about all the ways you can make a difference: http://www.megwhitman.com/homestretch #cagov #gomeg,Mon Nov 01 18:10:50 +0000 2010,en,20,False,0,False,,Meg Whitman,MegWhitman
Wow - huge crowd in Menlo Park this morning! One more day to go! #cagov #gomeg http://twitpic.com/3300u0,Mon Nov 01 17:21:38 +0000 2010,en,11,False,1,False,,Meg Whitman,MegWhitman
Great win @SFGiants - 1 more to go!,Mon Nov 01 03:36:30 +0000 2010,en,10,False,0,False,,Meg Whitman,MegWhitman
Happy Halloween! I had a blast Trick-or-Treating in Carpinteria with a group of local families. http://twitpic.com/32tosa,Mon Nov 01 02:53:10 +0000 2010,en,14,False,0,False,,Meg Whitman,MegWhitman
2 days to go! Burbank rally was incredible - let's get out the vote for #ANewCA! http://twitpic.com/32qnqj,Sun Oct 31 22:01:29 +0000 2010,en,19,False,0,False,,Meg Whitman,MegWhitman
We need your help in the homestretch! Find your nearest volunteer office: www.megwhitman.com/fieldoffices #cagov #gomeg,Sun Oct 31 18:29:18 +0000 2010,en,19,False,2,False,,Meg Whitman,MegWhitman
Wrapped up the night at our Cupertino HQ. We had an amazing group of volunteers phone banking for A New CA! #cagov http://twitpic.com/32gqig,Sun Oct 31 04:38:43 +0000 2010,en,12,False,1,False,,Meg Whitman,MegWhitman
Ecstatic crowd in Sacramento! We have amazingly dedicated volunteers working hard to get-out-the-vote! #cagov http://twitpic.com/32eda2,Sun Oct 31 00:59:49 +0000 2010,en,8,False,0,False,,Meg Whitman,MegWhitman
San Diego is energized and ready for victory on Tuesday! Thanks to @DarrellIssa for hosting us. Off to Sacramento! http://twitpic.com/32c1hk,Sat Oct 30 20:51:19 +0000 2010,en,12,False,0,False,,Meg Whitman,MegWhitman
"With @MikeVillines, @mimiwalters, @TonyStrickland at our Orange County rally! We have a great GOP ticket! http://twitpic.com/32aucp",Sat Oct 30 18:36:28 +0000 2010,en,12,False,0,False,,Meg Whitman,MegWhitman
Looking forward to rallies around the state today. On the road to A New California! #cagov #gomeg,Sat Oct 30 16:22:28 +0000 2010,en,17,False,0,False,,Meg Whitman,MegWhitman
"New TV ad out. Jerry Brown admits ""It's all a lie... I didn't have a plan for CA."" No plan then, no plan now. http://meg4.me/9mzr #cagov",Sat Oct 30 04:27:27 +0000 2010,en,78,False,2,False,,Meg Whitman,MegWhitman
Crowd at our Bakersfield rally was fired up! Join our amazing volunteer team: http://meg4.me/veuy #cagov #gomeg http://twitpic.com/3224zk,Sat Oct 30 02:18:18 +0000 2010,en,13,False,0,False,,Meg Whitman,MegWhitman
Visited a lovely pumpkin patch in Visalia. Halloween is 2 days away! #cagov #gomeg http://twitpic.com/32137d,Sat Oct 30 00:24:11 +0000 2010,en,8,False,0,False,,Meg Whitman,MegWhitman
Check out this week's Field Notes! http://meg4.me/t84l #cagov #gomeg,Sat Oct 30 00:17:35 +0000 2010,en,7,False,0,False,,Meg Whitman,MegWhitman
Energized crowd at our Fresno rally! Lots of volunteers excited for the final get-out-the-vote push! http://twitpic.com/31zy8v,Fri Oct 29 22:06:41 +0000 2010,en,11,False,0,False,,Meg Whitman,MegWhitman
New Rasmussen poll says race is toss-up - we have the momentum! http://meg4.me/2ehg #cagov #gomeg,Fri Oct 29 18:54:05 +0000 2010,en,36,False,0,False,,Meg Whitman,MegWhitman
Thank you! // RT @maya6buki Volunteers PACKED into Santa Clarita HQ w. Con. McKeon 2 turn out vote 4 @Whitman2010! http://yfrog.com/mvf2emj,Fri Oct 29 03:28:22 +0000 2010,en,11,False,1,False,,Meg Whitman,MegWhitman
Great job @SFGiants!,Fri Oct 29 03:25:42 +0000 2010,en,9,False,0,False,,Meg Whitman,MegWhitman
Loved calling voters tonight at our Walnut Creek field office. Find out where you can help: http://meg4.me/veuy http://twitpic.com/31qrvy,Fri Oct 29 02:29:19 +0000 2010,en,12,False,0,False,,Meg Whitman,MegWhitman
Dropped off my ballot with Griff today! Have you sent in your vote-by-mail ballot yet?  #cagov http://twitpic.com/31pfv8,Thu Oct 28 23:42:21 +0000 2010,en,11,False,0,False,,Meg Whitman,MegWhitman
Ran into these two @SFGiants fans while in Stockton - good luck in Game 2! Go Giants! http://twitpic.com/31p7k2,Thu Oct 28 23:12:45 +0000 2010,en,8,False,1,False,,Meg Whitman,MegWhitman
"On our way to Stockton, decided to make a pit stop at Andersen’s for their famous pea soup!",Thu Oct 28 21:25:03 +0000 2010,en,6,False,0,False,,Meg Whitman,MegWhitman
Griff and I had a chance to sit in a huge John Deere tractor in Salinas! #cagov http://twitpic.com/31obof,Thu Oct 28 21:10:21 +0000 2010,en,5,False,0,False,,Meg Whitman,MegWhitman
Absolutely beautiful morning in Salinas! Thanks everyone for joining. 5 days - on the road to A New CA! http://twitpic.com/31nc7t,Thu Oct 28 18:47:38 +0000 2010,en,9,False,0,False,,Meg Whitman,MegWhitman
Congratulations to the @SFGiants on their Game 1 win!,Thu Oct 28 04:41:52 +0000 2010,en,12,False,0,False,,Meg Whitman,MegWhitman
Excited supporters at our San Bernardino rally in Etiwanda Gardens - 6 days until A New California! http://twitpic.com/31grzn,Thu Oct 28 02:46:42 +0000 2010,en,20,False,1,False,,Meg Whitman,MegWhitman
Check out this op-ed from @DanSenor. A strong California-Israel relationship is in all our interests. http://meg4.me/wa7f #cagov #gomeg,Wed Oct 27 23:06:35 +0000 2010,en,18,False,2,False,,Meg Whitman,MegWhitman
"Check out my new TV ad. Our problems are tough, but so am I. http://meg4.me/t7be #cagov #gomeg",Wed Oct 27 22:31:20 +0000 2010,en,23,False,3,False,,Meg Whitman,MegWhitman
Energetic crowd in Riverside at Johnson Machinery. 6 days to go. Jobs are on the way! http://twitpic.com/31ev82,Wed Oct 27 22:23:47 +0000 2010,en,6,False,1,False,,Meg Whitman,MegWhitman
On phone w/ TX @GovernorPerry to place World Series wager. CA surfboard up against TX cowboy boots! Go @SFGiants! http://twitpic.com/31dcyt,Wed Oct 27 18:35:45 +0000 2010,en,18,False,1,False,,Meg Whitman,MegWhitman
"In San Diego visiting Sneak's Kicks, an eBay success story. Small biz is key to CA's economic recovery! #cagov http://twitpic.com/31d2v4",Wed Oct 27 17:54:41 +0000 2010,en,13,False,1,False,,Meg Whitman,MegWhitman
Popped by our San Luis Obispo office where lots of vols were working the phones! Join us! http://meg4.me/veuy http://twitpic.com/316fcq,Wed Oct 27 01:45:52 +0000 2010,en,10,False,1,False,,Meg Whitman,MegWhitman
Griff and I enjoyed visiting with @LauraWBush at the @TheWomensConf earlier today in Long Beach. #cagov http://twitpic.com/316eg0,Wed Oct 27 01:42:36 +0000 2010,en,10,False,0,False,,Meg Whitman,MegWhitman
"Op-ed from retired high school principal: ""Whitman plan - school grades, charters, merit pay - is right for us"" http://meg4.me/3pzq #cagov",Tue Oct 26 17:55:36 +0000 2010,en,15,False,1,False,,Meg Whitman,MegWhitman
Thank you to @GovChristie for this video endorsement! Please RT! http://meg4.me/bza7 #cagov #gomeg,Tue Oct 26 02:12:34 +0000 2010,en,56,False,2,False,,Meg Whitman,MegWhitman
3 Fresno County Mayors support my plan to address CA's water supply crisis. http://meg4.me/n2mb #cagov #gomeg,Tue Oct 26 01:50:45 +0000 2010,en,24,False,0,False,,Meg Whitman,MegWhitman
"Check out this op-ed. Cleantech is a critical growth sector for CA, and will thrive in a business-friendly CA. http://meg4.me/prpd #cagov",Tue Oct 26 01:32:46 +0000 2010,en,9,False,0,False,,Meg Whitman,MegWhitman
Amazing turnout at our Thousand Oaks rally - so many supporters and volunteers! http://twitpic.com/30uwzo,Mon Oct 25 22:15:54 +0000 2010,en,9,False,1,False,,Meg Whitman,MegWhitman
Taping an interview with Diane Sawyer on our Jobs bus! Watch it this evening on @ABCWorldNews. #cagov http://twitpic.com/30u9gq,Mon Oct 25 20:38:14 +0000 2010,en,12,False,0,False,,Meg Whitman,MegWhitman
Rep. @MaryBonoMack and I met the enthusiastic residents of Sun City Shadow Hills in Indio this morning #cagov http://twitpic.com/30t7e4,Mon Oct 25 17:54:35 +0000 2010,en,13,False,0,False,,Meg Whitman,MegWhitman
"Endorsement from Vacaville Reporter: ""Leadership? It's Whitman"" http://meg4.me/egt3 #cagov #gomeg",Sun Oct 24 22:30:22 +0000 2010,en,15,False,0,False,,Meg Whitman,MegWhitman
"Endorsement from Appeal-Democrat: ""CA's best hope in this election for ... entrepreneurial, aspirational renewal"" http://meg4.me/gebg #cagov",Sun Oct 24 22:29:24 +0000 2010,en,16,False,1,False,,Meg Whitman,MegWhitman
Way to go @SFGiants! On to the World Series!,Sun Oct 24 04:00:09 +0000 2010,en,19,False,0,False,,Meg Whitman,MegWhitman
Amazing view at our Pacific Palms event this afternoon. #cagov #gomeg http://twitpic.com/30aid3,Sun Oct 24 01:30:10 +0000 2010,en,7,False,1,False,,Meg Whitman,MegWhitman
Young MEGa's at Koreatown in LA. Love the spirit! http://twitpic.com/309l2u,Sat Oct 23 23:48:29 +0000 2010,en,5,False,0,False,,Meg Whitman,MegWhitman
Meeting voters in Los Angeles Koreatown - great crowd! http://twitpic.com/309dgp,Sat Oct 23 23:23:55 +0000 2010,en,15,False,1,False,,Meg Whitman,MegWhitman
Great turnout at our event at Saigon Kitchen in San Jose this morning http://twitpic.com/307d2f,Sat Oct 23 19:19:01 +0000 2010,en,4,False,0,False,,Meg Whitman,MegWhitman
Saying hello to the amazing phone bank volunteers at our Santa Barbara headquarters! http://twitpic.com/2zykg9,Sat Oct 23 02:41:40 +0000 2010,en,8,False,0,False,,Meg Whitman,MegWhitman
With my husband Griff meeting voters at Paradise Cafe in Santa Barbara http://twitpic.com/2zyjyv,Sat Oct 23 02:39:13 +0000 2010,en,9,False,0,False,,Meg Whitman,MegWhitman
"Thank you, Mayor @MikeBloomberg: “We don't need politicians today. We need problem-solvers.” http://lat.ms/aYZuDj #cagov #gomeg",Sat Oct 23 00:19:58 +0000 2010,en,15,False,0,False,,Meg Whitman,MegWhitman
Thank you to @Zazzle for hosting a tour for NYC Mayor @mikebloomberg and me - love the shirts! #cagov #gomeg http://twitpic.com/2zvyzd,Fri Oct 22 21:23:59 +0000 2010,en,9,False,0,False,,Meg Whitman,MegWhitman
Check out this week’s Field Notes - http://meg4.me/c837 #cagov #gomeg,Fri Oct 22 21:20:31 +0000 2010,en,4,False,0,False,,Meg Whitman,MegWhitman
Fresno Bee: Our extensive GOTV efforts. We have best volunteers and outreach in CA and are working hard for victory! http://meg4.me/rhw7,Fri Oct 22 21:19:48 +0000 2010,en,4,False,0,False,,Meg Whitman,MegWhitman
Thank you to the Long Beach Area Chamber PAC for their unanimous endorsement. My top priority is creating jobs. http://meg4.me/l6y9 #cagov,Fri Oct 22 21:17:38 +0000 2010,en,9,False,1,False,,Meg Whitman,MegWhitman
Meeting voters at La Familia Juarez Restaurant in Modesto - people are excited about this election! http://twitpic.com/2zo2vn,Fri Oct 22 03:16:38 +0000 2010,en,8,False,0,False,,Meg Whitman,MegWhitman
Visited a fruit packing plant this afternoon - agriculture is one of CA's key industries. #cagov #gomeg http://twitpic.com/2zn1ob,Fri Oct 22 00:59:53 +0000 2010,en,9,False,1,False,,Meg Whitman,MegWhitman
Farmers support my plan for strengthening our $36B ag industry and fixing our water system. http://meg4.me/k4tm #cagov #gomeg,Fri Oct 22 00:52:44 +0000 2010,en,12,False,1,False,,Meg Whitman,MegWhitman
Griff and I had a lovely time meeting voters in downtown Pleasanton tonight. #cagov #gomeg http://twitpic.com/2zdl64,Thu Oct 21 01:41:49 +0000 2010,en,10,False,2,False,,Meg Whitman,MegWhitman
Just finished an interview with @hughhewitt - thank you! #cagov #gomeg,Wed Oct 20 23:43:37 +0000 2010,en,6,False,0,False,,Meg Whitman,MegWhitman
Good luck to the @SFGiants tonight!,Wed Oct 20 23:16:36 +0000 2010,en,6,False,0,False,,Meg Whitman,MegWhitman
"Grateful for endorsement from former Assm. Dutra, who is leading our outreach to Democratic and independant voters. http://meg4.me/9rhr",Wed Oct 20 20:07:32 +0000 2010,en,12,False,0,False,,Meg Whitman,MegWhitman
Fun crowd at the Sonoma Plaza this evening. Great to visit with you all and enjoy this beautiful evening. #cagov http://twitpic.com/2z4xep,Wed Oct 20 01:20:00 +0000 2010,en,11,False,2,False,,Meg Whitman,MegWhitman
Speaking with volunteers at our Napa office - one of over 90 field offices where you can help get out the vote! http://twitpic.com/2z3tra,Tue Oct 19 22:47:06 +0000 2010,en,9,False,0,False,,Meg Whitman,MegWhitman
Phone banking at our Oakland HQ. We have a great team of volunteers - join us! #cagov #gomeg http://twitpic.com/2z33ln,Tue Oct 19 20:56:31 +0000 2010,en,3,False,0,False,,Meg Whitman,MegWhitman
I have the independence to fix our schools and make real reforms. Check out my new TV ad: http://meg4.me/cw8u #cagov #gomeg,Tue Oct 19 20:49:36 +0000 2010,en,12,False,1,False,,Meg Whitman,MegWhitman
Thank you to the students/staff of Jefferson Elem. (Oakland) for welcoming me today! CA kids deserve a great education. #cagov #gomeg,Tue Oct 19 20:43:57 +0000 2010,en,4,False,0,False,,Meg Whitman,MegWhitman
Find your nearest volunteer field office using our map - walk-ins welcome. Over 90 locations across CA! http://meg4.me/veuy #cagov #gomeg,Tue Oct 19 16:48:01 +0000 2010,en,12,False,0,False,,Meg Whitman,MegWhitman
"Honored to have endorsement of 80-20 Initiative, one of the most influential Asian-American political groups in nation. http://meg4.me/9xef",Tue Oct 19 15:42:21 +0000 2010,en,11,False,0,False,,Meg Whitman,MegWhitman
Received endorsement from Deputy Sheriff's Association of San Diego (@DSASanDiego) today - thank you! #gomeg http://twitpic.com/2yurb7,Mon Oct 18 23:42:21 +0000 2010,en,18,False,1,False,,Meg Whitman,MegWhitman
Meeting voters at Bull's Smokin' BBQ in San Diego #cagov #gomeg http://twitpic.com/2yur02,Mon Oct 18 23:41:08 +0000 2010,en,6,False,0,False,,Meg Whitman,MegWhitman
"I had a wonderful Saturday on our ""Jobs"" bus, visiting voters in Redding, Chico, and Los Molinos. Video: http://meg4.me/7yaa #cagov #gomeg",Mon Oct 18 19:48:17 +0000 2010,en,9,False,0,False,,Meg Whitman,MegWhitman
"In Garden Grove, visiting Earth Friendly Products (makers of Ecos detergents). Jobs are #1 issue everywhere I go. http://twitpic.com/2ysyaj",Mon Oct 18 19:09:17 +0000 2010,en,7,False,0,False,,Meg Whitman,MegWhitman
"Today's Chico Enterprise-Record endorsement: ""Whitman has her priorities - and our priorities - in the right place"" http://meg4.me/za79",Mon Oct 18 15:43:04 +0000 2010,en,11,False,0,False,,Meg Whitman,MegWhitman
Endorsements from The Modesto Bee (http://meg4.me/b35v) and The Redding Record Searchlight (http://meg4.me/2e3n) #cagov #gomeg,Sun Oct 17 19:59:05 +0000 2010,en,16,False,2,False,,Meg Whitman,MegWhitman
Endorsements from The Orange County Register (http://meg4.me/3j5l) and The Bakersfield Californian (http://meg4.me/6b9m) #cagov #gomeg,Sun Oct 17 19:58:17 +0000 2010,en,10,False,1,False,,Meg Whitman,MegWhitman
"Proud to have new endorsements from The OC Register, Bakersfield Californian, Modesto Bee, and Redding Record Searchlight. #cagov #gomeg",Sun Oct 17 19:57:23 +0000 2010,en,18,False,0,False,,Meg Whitman,MegWhitman
Have you registered to vote yet? Tomorrow is the last day to register! www.megwhitman.com/vote #gomeg #cagov,Sun Oct 17 18:45:00 +0000 2010,en,24,False,0,False,,Meg Whitman,MegWhitman
Meeting voters at the Black Bear Diner in Redding. Great support for our message of more jobs! #cagov #gomeg http://twitpic.com/2y8eel,Sat Oct 16 22:46:13 +0000 2010,en,8,False,0,False,,Meg Whitman,MegWhitman
Had a great time at the Dairyville Orchard Festival in Los Molinos - loved the Ag Store! http://twitpic.com/2y879r,Sat Oct 16 22:22:40 +0000 2010,en,9,False,0,False,,Meg Whitman,MegWhitman
"Visited Cozy Diner in Chico this morning, and thrilled to receive Halloween surprise - a Meg 2010 jack-o-lantern! http://twitpic.com/2y6b6d",Sat Oct 16 18:37:46 +0000 2010,en,11,False,2,False,,Meg Whitman,MegWhitman
Visiting one of California's greatest state treasures: In-N-Out Burger. #cagov #gomeg http://twitpic.com/2xwirv,Fri Oct 15 23:36:26 +0000 2010,en,25,False,5,False,,Meg Whitman,MegWhitman
Our statewide bus tour kicked of this week - we're on the road to A New California! Read about it here: http://meg4.me/vkus #cagov #gomeg,Fri Oct 15 18:32:40 +0000 2010,en,13,False,1,False,,Meg Whitman,MegWhitman
Check out this week's Field Notes - http://meg4.me/uutz #cagov #gomeg,Fri Oct 15 18:05:30 +0000 2010,en,2,False,0,False,,Meg Whitman,MegWhitman
Show your support wherever you go! Text '2010' to 46634 (GOMEG) to receive a FREE Meg 2010 bumper sticker. Please RT!,Fri Oct 15 00:05:32 +0000 2010,en,30,False,2,False,,Meg Whitman,MegWhitman
"I will be a tough-on-crime governor, and have endorsements from numerous law enforcement groups. Watch my new TV ad: http://meg4.me/6q82",Thu Oct 14 23:51:10 +0000 2010,en,28,False,1,False,,Meg Whitman,MegWhitman
I had an interview with KXTV earlier today. Watch here:  http://meg4.me/bq8q #gomeg #cagov,Thu Oct 14 19:34:46 +0000 2010,en,11,False,0,False,,Meg Whitman,MegWhitman
Had lunch at Philliedog in Bakersfield - love the food! #gomeg #cagov http://twitpic.com/2xlwmi,Thu Oct 14 19:33:16 +0000 2010,en,2,False,1,False,,Meg Whitman,MegWhitman
Great op-ed from Sacramento County DA Jan Scully endorsing my campaign. I will be a tough-on-crime governor. http://meg4.me/hahf #gomeg,Thu Oct 14 16:49:40 +0000 2010,en,14,False,0,False,,Meg Whitman,MegWhitman
Proud to have endorsement of The San Diego Union-Tribune. Creating private sector jobs is my top priority. http://meg4.me/ymjz #cagov,Thu Oct 14 16:02:36 +0000 2010,en,21,False,1,False,,Meg Whitman,MegWhitman
"I had a great chat today with Neil Cavuto about the #CAGov race. Watch here: http://meg4.me/nkr5 (pt 1), http://meg4.me/c8dq (pt 2) #gomeg",Wed Oct 13 23:29:59 +0000 2010,en,13,False,0,False,,Meg Whitman,MegWhitman
Photo during my interview with Neil Cavuto today - video soon! #cagov #gomeg http://twitpic.com/2xd4wy,Wed Oct 13 21:50:56 +0000 2010,en,5,False,0,False,,Meg Whitman,MegWhitman
Had lunch at Philippe's in LA and met a great group of nursing students. #cagov #gomeg http://twitpic.com/2xd445,Wed Oct 13 21:47:32 +0000 2010,en,6,False,1,False,,Meg Whitman,MegWhitman
"Hopping on our new ""Jobs"" campaign bus last night after the debate! #cagov #gomeg http://twitpic.com/2xbolw",Wed Oct 13 18:11:00 +0000 2010,en,9,False,0,False,,Meg Whitman,MegWhitman
Photo from tonight's post-debate rally! #cagov #gomeg http://twitpic.com/2x6opm,Wed Oct 13 05:21:24 +0000 2010,en,11,False,2,False,,Meg Whitman,MegWhitman
"Unveiling our new campaign bus - ""Jobs Are On The Way"". Coming to a city near you! http://yfrog.com/n36w3jj #cagov #gomeg",Wed Oct 13 04:19:56 +0000 2010,en,18,False,1,False,,Meg Whitman,MegWhitman
"I'm in the business of creating jobs, and CA needs jobs. #cagov #gomeg",Wed Oct 13 04:18:18 +0000 2010,en,19,False,2,False,,Meg Whitman,MegWhitman
"Spirited dialogue with Jerry Brown tonight in #CAGovDebate. Pleased with how it went. Thank you to Tom, Dominican for hosting. #gomeg #cagov",Wed Oct 13 04:17:54 +0000 2010,en,10,False,3,False,,Meg Whitman,MegWhitman
Thank you @girevik_ricky! I'm looking forward to tonight's #CAGovDebate! #cagov #gomeg,Tue Oct 12 23:57:20 +0000 2010,en,1,False,0,False,,Meg Whitman,MegWhitman
Want to watch tonight's #CAGovDebate online? An online webcast will be available here: http://meg4.me/xw9g #gomeg #cagov,Tue Oct 12 22:20:08 +0000 2010,en,13,False,4,False,,Meg Whitman,MegWhitman
Today we're launching Chinese-language television ads! http://meg4.me/e5x7 #cagov #gomeg,Tue Oct 12 19:43:47 +0000 2010,en,7,False,0,False,,Meg Whitman,MegWhitman
We had a great rally on Sunday with Rudy Giuliani - read about it here: http://meg4.me/tdx9 #gomeg #cagov,Tue Oct 12 19:17:58 +0000 2010,en,8,False,0,False,,Meg Whitman,MegWhitman
"We've just surpassed 150,000 'likes' on Facebook - thank you! http://meg4.me/tfel",Tue Oct 12 02:41:03 +0000 2010,en,10,False,2,False,,Meg Whitman,MegWhitman
Wondering which channel to watch for tomorrow's debate at 6:30? Find out here: http://meg4.me/b2tz #cagov #gomeg,Tue Oct 12 00:12:09 +0000 2010,en,14,False,0,False,,Meg Whitman,MegWhitman
